id,created_at,text
585764214934994944,2015-04-08 11:20:46,"How a cellphone video led to murder charges against a cop in North Charleston, S.C. - The Washington Post http://t.co/kKsoHdxI4L"
585588331850964992,2015-04-07 23:41:52,South Carolina Officer Is Charged With Murder in Black Man’s Death http://t.co/C0LCRtjSeX
585421898579890176,2015-04-07 12:40:31,Chicago Mayoral-Election Preview: Rahm Emanuel Is Expected to Defeat Progressive Challenger  — Atlantic  http://t.co/6YDUBCKkYC
585227028141645824,2015-04-06 23:46:11,It wasn’t Jackie’s job to get the details of her rape correct. It was Rolling Stone’s  - The Guardian http://t.co/AHOz1BNNgN
584894318906859520,2015-04-06 01:44:07,Gary Hart: Billion-dollar Hillary Clinton 2016 campaign should 'frighten' Americans - POLITICO http://t.co/DiXUbABfuA
584773487111380992,2015-04-05 17:43:58,Cracks appear in Democratic-Jewish alliance in wake of Iran agreement | Fox News http://t.co/f97ja2yY2r
584720228430516225,2015-04-05 14:12:20,Iran 'is intensifying efforts to support Hamas in Gaza'  - Telegraph http://t.co/kiVm9gGfDV
584719726116372480,2015-04-05 14:10:20,RT @Pontifex: Christ is risen!  Christ is alive and journeys with us!
584718259166978048,2015-04-05 14:04:31,RT @DanPatrickTX: @AaronPena @RepKenSheets #selfies should be next!
584566118116937728,2015-04-05 03:59:57,Blue Bell shuts down ice cream factory after deaths http://t.co/9GjD8N2y3f via @TIMEHealth
584526556325883904,2015-04-05 01:22:45,State @RepKenSheets seeks to make hashtags official - Austin American Statesman http://t.co/jUVCCOcoK0 #txlege
584510949836595201,2015-04-05 00:20:44,Texas gaining stature as a key presidential primary state - The Star Telegram http://t.co/JZe48FMWgD
584417470099894272,2015-04-04 18:09:17,Great White Hope: Why Some Dems Are Moving Right - http://t.co/iRoW1RRnoi http://t.co/DFVOrfZVJb
584376326800351232,2015-04-04 15:25:48,Rahm Emanuel and the Unraveling of Chicago - http://t.co/iRoW1RzLZI http://t.co/rm82K6WSQX
584361991583768576,2015-04-04 14:28:50,Elon Musk living off a dollar a day StarTalk - Business Insider http://t.co/yJTrcOZPtu
584010859464241152,2015-04-03 15:13:33,‘House Of Cards’ Renewed By Netflix For Fourth Season: Underwood In 2016 | Deadline http://t.co/Hp2uuu7srQ
584010161724993537,2015-04-03 15:10:47,"In emerging Dem race, O'Malley new target of Clinton machine | http://t.co/Sys99ulSqN http://t.co/7dyl0IPoy7"
583975472633118720,2015-04-03 12:52:57,"How Arizona, Texas, and other solidly red states could soon turn purple http://t.co/abjuItIadg"
583909499230097409,2015-04-03 08:30:47,A Eulogy for Twitter — Atlantic  http://t.co/4U6Snkl67M
583760555283886080,2015-04-02 22:38:56,RT @84thLegislature: .@RepKenSheets filed resolution designating #txlege as official hashtag of the TX Legislature: http://t.co/LEeamOmWl0 …
583759806789390336,2015-04-02 22:35:58,"RT @joelnihlean: Things have come a long way, @AaronPena. Twitter is serious business at the #txlege now. http://t.co/HCY9jPWv9L"
583755941155360768,2015-04-02 22:20:36,Experts: Coming Demographic Shift Will Strengthen US Culture http://t.co/pzColqBtut
583338520087007232,2015-04-01 18:41:55,Six best (worst?) political April Fools | TheHill http://t.co/BVWCuu1uA5 @txglo #ATX
583237970972569600,2015-04-01 12:02:22,A Texas Ban on Gambling That Doesn’t Quite Work - http://t.co/mBJREWiUvO http://t.co/nli7t8GbP8 #rgv
583140342968541184,2015-04-01 05:34:26,Why Isn’t Desalination the Answer to All California’s Water Problems? http://t.co/Rr1FVDdOxx
583080708194889728,2015-04-01 01:37:28,Menendez indictment could come Wednesday - John Bresnahan and Manu Raju - POLITICO http://t.co/r61eiOFyyA
583080286172397569,2015-04-01 01:35:47,Elizabeth Warren on 2016: 'I’m not going to run' —  and Hillary Clinton deserves 'a chance to decide' http://t.co/QNjQP4oFm8
582694031404175361,2015-03-31 00:00:57,Hillary Clinton’s Email and its Antecedents — The Atlantic http://t.co/ilWN5fw9e0
582691565392543745,2015-03-30 23:51:09,.@UTAustin President Bill Powers presents @georgepbush with the inaugural Latino Leadership Award. http://t.co/CpCacyWrwC #ATX
582684995275329536,2015-03-30 23:25:03,I’ve joined @georgepbush at the University of Texas as he receives the Latino Leadership Award. http://t.co/cCfBjMMPLq
582588275191377920,2015-03-30 17:00:43,CNN: One shot dead at Fort Meade after trying to ram NSA gate http://t.co/drTVpQ9vFP
582403825706864640,2015-03-30 04:47:47,RT @jessesco Something about unexpectedly seeing a great friend that can put a smile on your face. And keep you smiling. Thanks @AaronPena
582390972597858304,2015-03-30 03:56:42,NASA alert: Asteroid 2014-YB35  set to skim past Earth on Friday - Daily Express http://t.co/kJF29RThLW
582284923639234561,2015-03-29 20:55:18,Investigators Face Complex Task With Inquiry Into Germanwings Co-Pilot Andreas Lubitz http://t.co/7r1IWVW95W
582280328972247041,2015-03-29 20:37:03,Poll: Who would Americans consider voting for in 2016? - CBS News http://t.co/w4XI63MYLD
582203233587843073,2015-03-29 15:30:42,Audio released of Texas student Cameron Redus’ last moments before being shot by police officer http://t.co/QqpiIySc94
581894134111313920,2015-03-28 19:02:27,Trey Gowdy: Hillary Clinton wiped her server clean - POLITICO http://t.co/tQJ6WlGQPv
581735128558383104,2015-03-28 08:30:37,King Richard III of England re-interred 530 years after death http://t.co/9b2XytysFd via @NewsHour
581607961174347776,2015-03-28 00:05:18,Republican Bracketology - http://t.co/iRoW1RRnoi http://t.co/mETQIxHKI6
581514854109962241,2015-03-27 17:55:19,RT @GOVERNING: Atlantic City is on the brink of financial disaster http://t.co/84LjZw23S4
581440636726956032,2015-03-27 13:00:25,Sen. Harry Reid (D) will not seek reelection - http://t.co/mBJREWiUvO http://t.co/jwPVgUUEU7
581435567390457856,2015-03-27 12:40:16,Prosecutor: Co-pilot on doomed flight hid psychological treatments - The Washington Post http://t.co/J5YMjSbldG
581244584598044673,2015-03-27 00:01:22,Report: DEA agents had ‘sex parties’ with prostitutes hired by drug cartels - The Washington Post http://t.co/5YXprEHjkO
581215348520722433,2015-03-26 22:05:12,Americans Love Big Hot Suburbs ... in Texas. — Atlantic http://t.co/FjxEIiDGuJ #ATX
581086397798416385,2015-03-26 13:32:47,Andreas Lubitz: First picture of Germanwings pilot and what we know about him - Telegraph http://t.co/MYFNE3mVQv
581068522694029312,2015-03-26 12:21:46,Prosecutor: Co-pilot deliberately crashed Flight 9525 http://t.co/SMRHyxYzVQ via @USATODAY
581067938674921472,2015-03-26 12:19:26,Russia unveils plans for Europe-U.S. superhighway http://t.co/ivxK1ahsRt via @USATODAY
580922137252364288,2015-03-26 02:40:05,Video: Kay Bailey Hutchison Will Endorse Jeb Bush http://t.co/rv8IDYkLYr via @TexasTribune
580587487598419968,2015-03-25 04:30:18,Half of America doesn’t save any money and lives paycheck to paycheck - Business Insider http://t.co/5G6xRKVwVp
580504718629294081,2015-03-24 23:01:24,48 Hours in Austin Texas’s coolest city keeps on keepin’ on. - Western Living Magazine http://t.co/yNtQ0PZZu3 #ATX
580443754504552450,2015-03-24 18:59:09,It’s National #BoysandGirlsClubs Week and we’re celebrating the ways that #GreatFutures start in area Clubs. I started mine in ‘69 @BGCE.
579970953964314624,2015-03-23 11:40:25,“Blood makes you related. Loyalty makes you family.” ~ Unknown Author
579828569624461313,2015-03-23 02:14:38,Honduras sends soldiers to protect 'lost city' from drug cartels  - Telegraph http://t.co/82fUyb2Hek
579809816211779584,2015-03-23 01:00:07,Richard III reburial: Leicester welcomes king’s remains – in pictures - The Guardian http://t.co/TFKA2UpsUr
579807452687937536,2015-03-23 00:50:43,Thousands watch King Richard III’s burial. http://t.co/oD67b2kzpi via @MailOnline
579671270687666176,2015-03-22 15:49:35,Texas Sen. Ted Cruz to announce 2016 GOP presidential bid http://t.co/vg7a5lvKK8 via @WSJ
579667997553528832,2015-03-22 15:36:34,The Washington D.C. Cherry Blossom Festival in photos: http://t.co/FAMf7xFAhr
579666820124286977,2015-03-22 15:31:54,When It Pays to Pretend You're Not Running for President - http://t.co/iRoW1RRnoi http://t.co/cf7cYXSwC3
579660589351497728,2015-03-22 15:07:08,Antonio Garza: Establishing rule of law is Mexico’s big challenge | Dallas Morning News http://t.co/6VXrdFOAbr
579652466100305920,2015-03-22 14:34:51,"In recognition of Twitter’s 9th birthday, here’s my #FirstTweet back in 2007: http://t.co/xG2Hcisuu9"
579146682476167168,2015-03-21 05:05:03,Twitter’s 9th Anniversary: How the Social Network Has Grown Over Time http://t.co/aF9M5yykMR
579049851985494017,2015-03-20 22:40:17,Battleground Israel Turns Out Like Battleground Texas - RedState http://t.co/AWBlYUk5sT
578540546039361537,2015-03-19 12:56:29,Democratic support for Hillary Clinton softens: Reuters/Ipsos poll http://t.co/1wp39goz52
578538249230163968,2015-03-19 12:47:21,"As ratings plunge, MSNBC faces shakeup http://t.co/rRWC16gBJi via @POLITICO"
578473638128668672,2015-03-19 08:30:37,Milky Way has billions of planets in habitable zone – NASA’s Kepler satellite shows http://t.co/gzHbPL0s4z
578321268845473792,2015-03-18 22:25:09,CNN: Poll: Hillary Clinton still tops in 2016 http://t.co/Ae2tZXYJSo
578247291708051456,2015-03-18 17:31:12,NASA: California Has One Year of Water Left http://t.co/wjeK7VtiRb
578111174010482689,2015-03-18 08:30:19,The Democratic Party is facing a Catholic apocalypse - http://t.co/FxCpDHUU1n http://t.co/7uVtc3k48Z
578008045512482816,2015-03-18 01:40:31,Tu casa es mi casa | The Economist http://t.co/Gz6kgc9GXj
577968126530351105,2015-03-17 23:01:54,The Democrats’ Weak Bench and the Paradox of Power http://t.co/egaYROsrsG
577953097877757952,2015-03-17 22:02:11,Israel’s Netanyahu declares victory in tight race - AP http://t.co/TwlIDM7weA
577819113269157889,2015-03-17 13:09:46,Suicide of Missouri candidate for governor highlights the nastiness of today’s politics. http://t.co/mCDFLKzLCM
577814452944404481,2015-03-17 12:51:15,Missouri Candidate's Suicide Brings Political Nastiness to National Attention - NBC News http://t.co/e0R56yhYBB
577624257150230528,2015-03-17 00:15:29,‘Utter Baloney’: WH Shoots Down Valerie Jarrett Hillary Email Leak Story | Mediaite http://t.co/AdNAuT8pAX
577620459728084992,2015-03-17 00:00:23,Sharyl Attkisson Gives TED Talk on Astroturf and Manipulation of Media Messages | Video | RealClearPolitics http://t.co/PGaB6b08Vr
577605310849896448,2015-03-16 23:00:12,"In 2016 race, an electoral college edge for Democrats http://t.co/bfDNfs2Uyz"
577524114837090304,2015-03-16 17:37:33,Both parties' favorability now below 40 percent | TheHill http://t.co/zEner515j7
577523828227776512,2015-03-16 17:36:25,"Ferguson home values have dipped by nearly 50 percent since Michael Brown’s shooting, data show http://t.co/y0b6T0W8nf via @thisisfusion"
577437312449179648,2015-03-16 11:52:38,Is It Time for the Jews to Leave Europe? - The Atlantic http://t.co/4FgV4XluB1
577113444689801217,2015-03-15 14:25:42,Hillary Clinton's fear of the trail - POLITICO http://t.co/NSi8TREilK
577097971814248448,2015-03-15 13:24:13,The Ides of March | History Today http://t.co/Ayp1XDpa84
576842865533431809,2015-03-14 20:30:31,NBC Series ‘California’ Will Trace Latino Family’s Roots In The Area Over 200 Years http://t.co/kT1SXMVbN5 #latism
576744463516581888,2015-03-14 13:59:30,RT @mashable: Happy Pi Day! This year's is a once-in-a-lifetime event. http://t.co/t2JDdpLIxs http://t.co/JJTvazCRIF
576438586683293696,2015-03-13 17:44:03,"The Best Barbecue in Austin, Texas - Bon Appétit http://t.co/F0z3iexV5d #ATX"
576260273012609024,2015-03-13 05:55:30,How do Americans stand out from the rest of the world? http://t.co/QhgCbwC40i
575710209575948288,2015-03-11 17:29:44,"AP sues State Department, seeking access to Clinton records http://t.co/oR4tkL1r6h"
575569457055186944,2015-03-11 08:10:26,Hillary Concedes She Deleted Nearly 30K ‘Private’ Emails - Breitbart http://t.co/M3zGraq1fI via @BreitbartNews
575212096880795648,2015-03-10 08:30:25,Official NHS calculator predicts when you will have a heart attack  - Telegraph http://t.co/PKSBlh7tkb
575054840109383680,2015-03-09 22:05:32,The 9 biggest things from the Apple Watch and MacBook announcement | The Verge http://t.co/2amESyuGpI
574911474520346624,2015-03-09 12:35:51,RT @fischler360: A wave of mostly white voters is reshaping the politics of D.C. http://t.co/VSsIPMyWAY
574906461052100608,2015-03-09 12:15:56,Monument to African-American history in Texas planned for Capitol - Houston Chronicle http://t.co/2140HkUDPm
574585099200643072,2015-03-08 14:58:57,Cruz: Menendez probe politically motivated | TheHill http://t.co/cVhne6sLcr
574293683379568640,2015-03-07 19:40:58,We give thanks and remember. RT @AP: Thousands gather to commemorate “Bloody Sunday” anniversary: http://t.co/fTeyxznR6s #Selma50
574205827680235520,2015-03-07 13:51:52,Team Clinton Will Beat the Press - Again  - POLITICO Magazine http://t.co/bs1mIwAzRG
574140074868211712,2015-03-07 09:30:35,Tiger Woods: Stranger Than Fiction http://t.co/ABiEXr7tcp via @rollingstone
574139980198580224,2015-03-07 09:30:12,Do we really want to know if we’re not alone in the universe? - The Washington Post http://t.co/FpfWuBim9A
574071744778145792,2015-03-07 04:59:04,The Hillary Camp's Rationale for Staying Quiet - Bloomberg Politics http://t.co/SpX6TVbSDf
573913466106437632,2015-03-06 18:30:07,Meet the Gaffe Warriors of the Democratic Party - Bloomberg Politics http://t.co/zHpoWB0RrX
573907178588925954,2015-03-06 18:05:08,RT @latimes: Harrison Ford is recovering following yesterday’s plane crash near the Santa Monica Municipal Airport: http://t.co/l9rhha74hi
573726733393924096,2015-03-06 06:08:07,Census: Austin is the fastest growing and 11th biggest city in U.S. | All Ablog Austin http://t.co/Cv4UOF0hFT
573632934474727425,2015-03-05 23:55:23,"RT @myfoxla: Here's footage of the plane that went down near Santa Monica Airport, reportedly piloted by #HarrisonFord http://t.co/zU6LW1wH…"
573632913226395648,2015-03-05 23:55:18,RT @myfoxla: Report: Actor Harrison Ford Injured In Small Plane Crash Near Santa Monica Airport http://t.co/vhSYWCPVaN http://t.co/V4CkKeoE…
573621552543039488,2015-03-05 23:10:10,"Amid Clinton controversies, Democrats yearn for an alternative http://t.co/2pZZmjWwQW"
573494955852726274,2015-03-05 14:47:07,"RT @WildeWednesday: ""If you want to tell people the truth, make them laugh, otherwise they'll kill you."" -Oscar Wilde http://t.co/8rfp09LKh…"
573488585418096640,2015-03-05 14:21:48,Hispanic Republicans see 2016 as an opportunity | http://t.co/Sys99ulSqN http://t.co/l4ztsIuIFX
573485553389281280,2015-03-05 14:09:45,Did John Roberts Tip His Hand? - The New Yorker http://t.co/hXVctNTRPe
573483645966630912,2015-03-05 14:02:10,"Boehner escapes jam on DHS vote, but more GOP battles loom http://t.co/P4IMb4qm3k"
573480496153370625,2015-03-05 13:49:39,Likely 2016 GOP hopefuls  recast immigration views | TheHill http://t.co/bYFiFkMInE
573114145639419904,2015-03-04 13:33:54,Netanyahu speech divides Dems | TheHill http://t.co/3AxiOUOdzx
572977342135599104,2015-03-04 04:30:18,Jesus’ house? 1st-century structure may be where he grew up |  http://t.co/jFTBDmT2df
572937074577436672,2015-03-04 01:50:17,Israel and the Democrats http://t.co/5PRww9xoa4 via @WSJ
572895581150060544,2015-03-03 23:05:25,"Netanyahu, in Speech to Congress, Criticizes ‘Bad Deal’ on Iran Nuclear Program http://t.co/WPour6GBJw"
572483516455247873,2015-03-02 19:48:01,"RT @WomenOfHistory: If through a broken heart God can bring His purposes to pass in the world, then thank Him for breaking your heart."
572415468692250624,2015-03-02 15:17:37,"Buoyed By Net-Neutrality Win, Internet Activists Prepare Next Campaign - http://t.co/iRoW1RRnoi http://t.co/hxP6NagM8T"
572415000054272000,2015-03-02 15:15:45,This Is What Immigration Limbo Looks Like - http://t.co/iRoW1RRnoi http://t.co/Lrk3j3dOOs
571540860086714370,2015-02-28 05:22:14,IRS watchdog reveals Lois Lerner missing emails now subject of criminal investigation - Washington Times http://t.co/EeED9RDI8Z
571384110750371840,2015-02-27 18:59:22,"RT @TheRealNimoy: A life is like a garden. Perfect moments can be had, but not preserved, except in memory.  LLAP"
571382047920402432,2015-02-27 18:51:10,RT @NASA: RIP Leonard Nimoy. So many of us at NASA were inspired by Star Trek. Boldly go... http://t.co/qpeH5BTzQc http://t.co/nMmFMKYv1L
571374969491488768,2015-02-27 18:23:03,Supreme Court could trigger Obamacare meltdown http://t.co/lRZ06g6nkO
571373377530806272,2015-02-27 18:16:43,"Farewell Leonard Nimoy, the stars are waiting - Telegraph http://t.co/ilwFFOAinQ"
571358523713462272,2015-02-27 17:17:42,"RT @nytimes: Breaking News: Leonard Nimoy, Spock of ‘Star Trek,’ Dies at 83
http://t.co/3djfRLUIKb"
571308021122347008,2015-02-27 13:57:01,RT @Independent: A Swedish office is microchipping its employees http://t.co/35BBfj7flm http://t.co/NvQp8rDzCS
571306928254652416,2015-02-27 13:52:40,Good News! Harrison Ford to star in Blade Runner sequel http://t.co/a9YduMubxz
571131402172956674,2015-02-27 02:15:12,RT @NBCNightlyNews: Facebook introduces new tools to help prevent suicide http://t.co/p8ZhFvgyHh http://t.co/zv3EOiLDoG
571104637702447104,2015-02-27 00:28:50,RT @quotationsOO: «A man sees in the world what he carries in his heart.» Johann Wolfgang von Goethe
571082525856153601,2015-02-26 23:00:59,FCC on brink of broadband transformation - POLITICO http://t.co/mfJo3EIh80
571018143306358784,2015-02-26 18:45:09,RT @Sports_Greats: Respect all... Fear none.
571014494526312449,2015-02-26 18:30:39,Supreme Court ruling could upturn Obamacare politics - POLITICO http://t.co/XlGr61yPfl
571010601989873665,2015-02-26 18:15:11,Net neutrality: Five things to watch for as FCC votes on Internet rules - LA Times http://t.co/L9Q7bWUI9B
570766121953058816,2015-02-26 02:03:42,Karl Rove: Republicans Could Be In for a Wild Ride in 2016 http://t.co/QzCJXpMLPH via @WSJ
570755439031390208,2015-02-26 01:21:15,Boehner reminds members of dress code: 'You know who you are' | TheHill http://t.co/dNVuejVDKZ
570720012199178240,2015-02-25 23:00:29,Some Dems prepared to override Obama's veto | TheHill http://t.co/n1AWrK3owO
570649718872797184,2015-02-25 18:21:09,What’s up with this administration? Susan Rice: Netanyahu’s speech ‘destructive’ http://t.co/cPhILpvpmX
570467619326832640,2015-02-25 06:17:33,"RT @John_Tedesco: Once booming, now fading in the Eagle Ford Shale: http://t.co/LfjadMAzCr via @mySA #eagleford http://t.co/wDw2c7T5Rx"
570407512954032128,2015-02-25 02:18:43,Axelrod quips irritate Clintonland http://t.co/SKfYrgGdaG
570289610208759810,2015-02-24 18:30:13,Dreaming of Condi and the sorry state of the once-mighty California GOP. - POLITICO http://t.co/pVkAJyggow
570213271569104896,2015-02-24 13:26:52,"RT @InspowerMinds: Be real, be yourself, be unique, be true, be honest, be humble, be happy."
570074824938266624,2015-02-24 04:16:44,"Oman calling for maximum oil production, saying ""oil price rout over"" http://t.co/Qz3gvJTiUS"
570067538492592128,2015-02-24 03:47:47,Congress inches closer to cliff http://t.co/6VeK5BxLVy via @POLITICO
570022451670724608,2015-02-24 00:48:37,Italy and Vatican on guard after ISIL threat http://t.co/nOeAaCG36M via @USATODAY
569745806493769729,2015-02-23 06:29:20,"RT @THR: ""I think fear is the condom of life."" - #AlejandroGonzalezInarritu backstage at the #Oscars http://t.co/FtXmK7GPZQ http://t.co/lw9…"
569745198043021312,2015-02-23 06:26:55,Academy Awards 2015: Complete list of Oscar nominees and winners - LA Times http://t.co/yBBQB5L7ui
569521798355787776,2015-02-22 15:39:12,Here’s How The Academy Chooses The Best Picture | FiveThirtyEight http://t.co/T4dBKeqkwl
569518384175554560,2015-02-22 15:25:38,The Express Tribune 2015 Oscars ballot – The Express Tribune http://t.co/cFiYTS1itt
569428969331818496,2015-02-22 09:30:20,"Inside Oscars’ Social Media War Room: Followers, Ratings and the Ghost of Ellen’s Selfie http://t.co/Y6c9B6TRQG"
569330473543065600,2015-02-22 02:58:57,Guy Falling for 9 Seconds – Imgur Blog http://t.co/l3oEH1ZnKe
569046440313532417,2015-02-21 08:10:18,"When Climate Change Hits The Fan, Your Glass-Walled Apartment Will Be Your Tomb: Gothamist http://t.co/pB9piJbTii"
569036420788199424,2015-02-21 07:30:29,How to Fill Out Your Oscar Ballot http://t.co/QgtwOPwz5n
568915298629390336,2015-02-20 23:29:11,Why Democrats Are Ready for Warren's Ideas - The Atlantic http://t.co/UJYNFpZI6f
568842512976125952,2015-02-20 18:39:58,"Warren acknowledges 2016 supporters, says public 'ready to fight back' http://t.co/t0sgjI7ssS"
568264330556399617,2015-02-19 04:22:28,What ISIS Really Wants - The Atlantic http://t.co/XiNW2k6yQ3
568185794558627840,2015-02-18 23:10:24,Doomed by the South: Why the emerging Democratic majority may never happen - http://t.co/FxCpDIcvpX http://t.co/2MR4I40tqL
568037520635617280,2015-02-18 13:21:13,The Middle East is red with the blood of Christians - via @Telegraph http://t.co/iEnBeHHeSs
567898759826272256,2015-02-18 04:09:50,"RT @JusticeWillett: ♫ Near, far—wherever you are /
I believe that the heart does go on ♫ http://t.co/qSVIMUuv5n"
567889952156950529,2015-02-18 03:34:50,4 reasons you don't have an Apple Watch yet via @FortuneMagazine http://t.co/m7E39FYw66
567881324264042496,2015-02-18 03:00:33,Pope says beheaded Coptic Christians are ‘martyrs’ - NY Daily News http://t.co/a6rRsd6yyX
567356758658527233,2015-02-16 16:16:06,Crude Oil Trades Near Two-Month High as Drilling Slows in U.S. http://t.co/YbTl0xgodN via @business
567350912122122240,2015-02-16 15:52:52,"Washington and Lincoln, forgotten on Presidents Day | TheHill http://t.co/kot39nVUXK"
567344284278730753,2015-02-16 15:26:32,Is Mount Rushmore Statistically Accurate? | FiveThirtyEight http://t.co/DB7VP4BIO9
566965485921509378,2015-02-15 14:21:20,Gov. Greg Abbott wants Texas as a top global economy http://t.co/YamD8KXtOs via @gosanangelo #txlege
566959528101830656,2015-02-15 13:57:39,ISIS video claims to show 17 Kurdish fighters in caged procession | Daily Mail Online http://t.co/1EjL6Cxpem
566958743682707456,2015-02-15 13:54:32,Bill Clinton: Sorry For The Drug War http://t.co/JHvOzM4u6o via @HuffPostPol
566745133186433024,2015-02-14 23:45:44,RT @dmhj: The @RGVPartnership will host Karl Rove and James Carville on Feb. 27 in Edinburg #rgv http://t.co/pGXlihA08r
566401707144642560,2015-02-14 01:01:04,Ukraine’s ‘Joan of Arc’: The helicopter pilot imprisoned in Russia http://t.co/Fo02vB9cTT
566303412120481792,2015-02-13 18:30:29,The Outrage Dilemma - http://t.co/iRoW1RRnoi http://t.co/m1Ifbd3QBZ
566159964180590592,2015-02-13 09:00:28,Facebook introduces Legacy Contacts to manage your account when you die | PCWorld http://t.co/t9aHH3cSLX
566063966963924993,2015-02-13 02:39:01,'American Sniper' suspect told cop he took 'couple of souls' - Houston Chronicle http://t.co/4c3Ilol4cN
566024038716571648,2015-02-13 00:00:21,Democrats pick Philadelphia for 2016 convention http://t.co/R3vZoiHce7 via @USATODAY
565679268035055616,2015-02-12 01:10:21,"Shock poll: Warren leads Clinton in Iowa, N.H. | http://t.co/Sys99ulSqN http://t.co/yG78f6gmRT"
565676940733206531,2015-02-12 01:01:07,"No, the Obama coalition won’t be easily re-created in 2016 http://t.co/O8GTqRE2bd"
565647761279049728,2015-02-11 23:05:10,"RT @AP: Republican-led Congress passes bill approving Keystone XL oil pipeline, setting up Obama veto: http://t.co/XSY2KaWXRp"
565573104161026048,2015-02-11 18:08:30,Zetas Cartel Runs Mexican Border University Out of Town http://t.co/SaGOHRRW3J via @BreitbartTexas
565484491503071235,2015-02-11 12:16:23,Statement by Prime Minister Benjamin Netanyahu on the U.S. offer to Iran and the security of Israel http://t.co/Qz0JN2Rm0O
565376598774652929,2015-02-11 05:07:39,Kayla Mueller: 'I Have Surrendered Myself To Our Creator' http://t.co/BDQRygT36F
565142980982353921,2015-02-10 13:39:21,Democrats suffering from Clinton fatigue say they’re ready for Warren http://t.co/XRlLmcI75b
565142601775742977,2015-02-10 13:37:50,"Climate Is Big Issue for Hispanics, and Personal - http://t.co/mBJREWiUvO http://t.co/TaylXBgXHk"
565080420602376192,2015-02-10 09:30:45,Doomed twin stars found at nebula’s heart - BBC News http://t.co/8z3RR8JNTw
565028668003868672,2015-02-10 06:05:06,The Guide to Republicans and Climate Change  - http://t.co/iRoW1RRnoi http://t.co/N37zYR7wZw
564899153357328385,2015-02-09 21:30:28,"Today In Creepy Privacy Policies, Samsung’s Eavesdropping TV  |  TechCrunch http://t.co/O5QLQT3HDM"
564853917071470593,2015-02-09 18:30:42,The Perils of Blaming the ‘Liberal Media’ - http://t.co/iRoW1RRnoi http://t.co/F5oVTD7QWA
564491706003763200,2015-02-08 18:31:25,Medical Marijuana Advocates: Texas Proposal Doesn't Go Far Enough http://t.co/aUo9ZtwO95 via @TexasTribune
564445456445370368,2015-02-08 15:27:38,"RT @DavidRoads: Prayer in action is love, and love in action is service."
564108920138907649,2015-02-07 17:10:21,Benjamin Netanyahu’s side strikes back http://t.co/yyA3gJ8kAp via @POLITICO
564080221381353473,2015-02-07 15:16:19,RT @wwwordseditor: Site updates: A new gender-neutral title is appearing in the UK: 'Mx' http://t.co/Zn6gxuR7l5
564061521521963009,2015-02-07 14:02:01,The Front-Runner’s Peril - http://t.co/iRoW1RRnoi http://t.co/iR5wYJpdzt
563993156598120448,2015-02-07 09:30:21,Top 10 Hotels in Las Vegas: Readers’ Choice Awards 2014 - Condé Nast Traveler http://t.co/jCUnIgDppp
563923930764038144,2015-02-07 04:55:16,Jordan’s Retaliation Is the Real Arab Awakening the Pentagon Has Been Waiting For - http://t.co/iRoW1RRnoi http://t.co/UpYs2j7SEI
