id,created_at,text
842970771815247874,2017-03-18 05:27:48,"RT @Pundamentalism: If you want to know why dried fruit is a rubbish reward, I will give you 5 good raisins."
663210356337020928,2015-11-08 04:24:05,"The trends on the TV channels are more confusing than the girls I've dated. 
#BiharElections #Sexist #idgaf"
663208300943532032,2015-11-08 04:15:55,#Thugbandhan #BiharElections
652235218301157376,2015-10-08 21:32:48,"RT @Mdixon55: The second tweet from @BillMcCollum. Tricky, tricky. 

https://t.co/WQuQ61p6XU"
652235164488200192,2015-10-08 21:32:35,RT @Zachary_Cohen: .@BillMcCollum using speaker elections to troll #FLsen watchers. #sayfie #FlaPol http://t.co/PA2CFqoNi6
652224677272756224,2015-10-08 20:50:55,that if I was still in the House I would vote for @RepWebster for Speaker - he's a man of great character and integrity #sayfie #FlaPol 2/2
652224111909957632,2015-10-08 20:48:40,"Hey @mdixon55 wanted you to be the first to know that I'm announcing ...
#sayfie #FlaPol 1/2"
621677040283058176,2015-07-16 13:45:31,And nobody ever accuses @MarcACaputo of being stupid. http://t.co/1KENXGUyfG
621069423097585665,2015-07-14 21:31:04,Obama's tragic mistake in negotiating this deal with Iran emboldens our enemies like appeasement always does #sayfie #flapol
621068351541018624,2015-07-14 21:26:48,Obama nuclear deal with Iran is a complete giveaway and tragic disaster #sayfie #flapol
157462380283035650,2012-01-12 14:02:11,Bill McCollum endorses Presidential candidate... http://t.co/p59mfV1g
32285777417216001,2011-02-01 03:55:03,"Judge Vinson's ruling a huge victory for states' rights, personal freedom. Ind. mandate non-severable, #HCR law must be repealed #sayfie"
15563713373278208,2010-12-17 00:27:33,"I’ll discuss our challenge of ObamaCare tonight with @gretawire at 10:20 pm, and tomorrow on @FoxandFriends at 7:45 am: http://bit.ly/ENqs"
15561283948519424,2010-12-17 00:17:53,Florida today led oral arguments in 20-state lawsuit against ObamaCare. Read more about our fight to preserve liberty: http://bit.ly/ENqs
14805017416433664,2010-12-14 22:12:45,Busy week for the Florida Cabinet – Health Care Lawsuit Heads to Oral Arguments  http://bit.ly/hWRgH0 #hcr #sayfie
28440154407,2010-10-22 21:11:04,Why I’m casting my vote for Rick Scott for Governor of Florida: http://bit.ly/cWYEV0.
27406868199,2010-10-15 03:34:27,"I’m pleased to announce our lawsuit challenging ObamaCare is moving forward, thanks to today's federal court ruling. http://bit.ly/bAwUGs"
26108247170,2010-10-01 19:20:48,Rep. Grayson’s ”Taliban Dan” TV ad smearing my friend @WebsterCongress  should outrage voters in Florida CD 8 http://bit.ly/a0C3Sn #flgop
25815941907,2010-09-28 20:08:23,I will be on the Fox Business Channel discussing health care reform at 5pm EST. Check it out! #hcr
24751562393,2010-09-17 12:00:13,Be sure to catch me this morning around 8:40am on MSNBC's Morning Joe talking about health care.  #hcr
24421966826,2010-09-13 22:50:30,RT @HucksArmy Forbes.com: We’ve Been Conned; Obamacare Will Not Save a Cent http://nthlnz.xrt.me
24421576816,2010-09-13 22:45:07,Be sure to catch me On The Record with @gretawire where I will be talking about stopping Obamacare  #hcr
22064850752,2010-08-25 05:35:32,I am humbled and overwhelmed by your passion for our campaign and depth of your support.  Thank you for your votes! #bill2010 #flgov #flgop
22023356421,2010-08-24 19:00:02,Thank you for your support! @RobSmithJr @jacktink @ebacon08 @scottplakon @sarahwhg #bill2010 #flgov #flgop
21998464089,2010-08-24 12:57:41,Thank you for your support and I am honored to have your vote! @wpickel @IAmTheChoy @FnLshow @JessicaOsman @CMDeB @IvanGH #bill2010
21991794100,2010-08-24 11:03:54,Polls are open!  Please go out and vote! #bill2010 #flgov #flgop
21916818213,2010-08-23 14:10:33,Honored to have your support RT @taimymiami @BillMcCollum all of my family support you
21915847975,2010-08-23 13:56:49,Help me get the vote out online!  Contribute your Twitter avatar or Facebook profile pic today! http://bit.ly/McCollumGOTV #bill2010 #flgov
21915771881,2010-08-23 13:55:44,Thank you for your votes and support! @nikkibama @RMFosterJr @KFReilly @HeathWhiteaker @TeamHuckFl @mattn9 @ClayWelsh #bill2010 #flgov
21841157843,2010-08-22 16:18:10,With Mike Huckabee at the Duval County REC HQ revving up supporters! #bill2010 (@ Republican HQ) http://4sq.com/dzjcNH
21783490352,2010-08-21 22:58:21,Finished up my day in the Panhandle on a high note.  This 9 point lead is because of YOUR support!  http://bit.ly/d6A40e #bill2010 #momentum
21778895264,2010-08-21 21:33:42,Stopping at the Shrimp Boat to rally the supporters in Panama City! #bill2010 (@ The Shrimp Boat) http://4sq.com/aRPyXx
21774328758,2010-08-21 20:07:24,"""With your support we will win on Tuesday and again in November!""  #bill2010  http://twitpic.com/2gx2mc"
21773205058,2010-08-21 19:46:05,At the world famous Donut Hole! #bill2010 (@ Donut Hole) http://4sq.com/anUcA0
21767942173,2010-08-21 18:11:36,Participating in the tradition of stapling a dollar to the wall at McGuire's #bill2010  http://twitpic.com/2gw265
21762245091,2010-08-21 16:42:19,Stopping for a quick bite to eat and a famous burger #bill2010 (@ McGuire's Irish Pub) http://4sq.com/bNXD4d
21758375867,2010-08-21 15:48:53,"Talking jobs, economy, the oil spill and more jobs with some local fisherman #bill2010  http://twitpic.com/2gupqd"
21758026261,2010-08-21 15:44:10,Catching some voters before they go out and enjoy this beautiful Saturday. #bill2010 (@ Gulf Breeze Bait And Tackle) http://4sq.com/bZwqHM
21756428597,2010-08-21 15:23:25,"Getting ready to start my Real Solutions, New Jobs Bus tour through the panhandle - keep an eye out for updates! #bill2010"
21752660067,2010-08-21 14:33:18,Thanks! RT @kaylaanderson I'm at the George Bush Republican Center/RPOF to make phone calls for @BillMcCollum! :-)
21683725172,2010-08-20 17:59:29,Talking about how to jump start our economy at Gulf Marine Repair.  #bill2010 #flgov #flgop #sayfie http://twitpic.com/2gj5o6
21677971003,2010-08-20 16:35:45,Thanking some fine men and women for there service to our country.   http://twitpic.com/2gigen
21665675232,2010-08-20 13:48:45,Help me get the vote out!  Contribute your Twitter or Facebook picture today!  http://bit.ly/McCollumGOTV #bill2010 #flgov #flgop #sayfie
21664296900,2010-08-20 13:29:28,Thanks for the support! RT @noragrace94 Everyone needs to go and vote for @BillMcCollum for Governor. #flgov.
21622541000,2010-08-20 00:56:59,Watch me and Rudy Giuliani on @foxnews's @SeanHannity show in a few minutes!  #bill2010 #flgov #flgop
21586855011,2010-08-19 15:39:39,Honored to announce the support of the Florida Police Chiefs! http://bit.ly/PoliceForMcCollum #bill2010 #flgov #flgop #sayfie
21583511935,2010-08-19 14:55:06,@FnLshow Thanks for having me on this morning!  Great questions and I look forward to going on again.  #bill2010
21495296784,2010-08-18 14:40:56,Thanks for helping me get my message out! Latest independent Q-Poll has me leading by 9 points! http://bit.ly/bYl1oP #bill2010
21426656100,2010-08-17 19:17:11,"Talking jobs, economy and health care with employees of Chromalloy Casting in Tampa.  #jobs #bill2010 #flgov http://twitpic.com/2fo937"
21409295375,2010-08-17 14:57:13,Thanks for your support! RT @MiaMcCole @BillMcCollum I already think of you as 'Governor McCollum'! We're getting out the vote for you here!
21404337346,2010-08-17 13:46:56,Thanks for your support! RT @MollyMcFarland One week until the primaries! Vote @BillMcCollum for governor! #bill2010 #flgov #flgop
21404303254,2010-08-17 13:46:27,Thanks! RT @TheRickWilson Going to early vote today for @BillMcCollum to be the Republican nominee for Governor of Florida #flgop #flgov
21311530336,2010-08-16 12:40:03,Winning the Pinellas Straw poll and closing out the bus tour with a MOMENTUM! http://bit.ly/9lm3ER #bill2010
21249915081,2010-08-15 18:19:41,"Mingling with the crowd post speech - jobs, economy, immigration and more jobs. #bill2010 #flgov #flgop  http://twitpic.com/2f2svv"
21248756844,2010-08-15 18:00:21,Speaking at the Pinellas Straw Poll and Picnic  #bill2010 (@ Banquet Masters) http://4sq.com/aoFLt6
21225599595,2010-08-15 11:51:56,"Want to know how the third day of my bus tour went? ""Golf Carts, Freedom, and Lots of Food"" http://bit.ly/bA9Gy5 #bill2010"
21189737995,2010-08-15 00:37:17,Dinner with the road crew #bill2010 (@ Golden Corral) http://4sq.com/bYO006
21184482506,2010-08-14 23:02:49,Revving up the crowd before @seanhannity comes on! #bill2010  http://twitpic.com/2esmw8
21182442013,2010-08-14 22:25:17,Getting ready to speak at the Sean Hannity Freedom Concert #bill2010 (@ UCF Arena) http://4sq.com/5DOo7H
21174426820,2010-08-14 19:59:20,Racking up the early votes! #bill2010 (@ Bartow City Hall (Early Vote)) http://4sq.com/bXFfJS
21172646399,2010-08-14 19:23:38,RT @DebtFreeBuddy: @BillMcCollum Our entire Family just early voted for you! I also have endorsed you on my blog at www.TheChristianAmer ...
21169270619,2010-08-14 18:22:05,Don't forget to early vote! #bill2010 (@ Riverview Library) http://4sq.com/9ZAPOq
21164423488,2010-08-14 17:03:50,"Quick lunch press, @adeslatte, Marc Caputo and Leslie Williams-Hale #bill2010 http://twitpic.com/2eph3o"
21163587836,2010-08-14 16:51:22,Quick bite to eat @FergsSportsBar #bill2010 (@ Ferg's Sports Bar & Grill w/ 2 others) http://4sq.com/5q1l6F
21159412646,2010-08-14 15:52:12,One more to the list of proud supporters! #bill2010  http://twitpic.com/2eot5h
21158810198,2010-08-14 15:43:48,More early vote! #bill2010 (@ Pinellas Supervisor of Elections) http://4sq.com/dzzQAC
21149766434,2010-08-14 13:34:18,Early vote with Bill #bill2010 (@ The Villages Public Library) http://4sq.com/dxMKK2
21098708071,2010-08-13 21:58:36,Too young to vote but nice shirt! #bill2010 http://twitpic.com/2efec2
21095802481,2010-08-13 21:12:37,Rallying with supporters in Brevard County #bill2010 (@ McCollum For Governor HQ - Brevard County) http://4sq.com/dh3WZK
21095802407,2010-08-13 21:12:37,"I just unlocked the ""Adventurer"" badge on @foursquare! http://4sq.com/9bZblz"
21094584543,2010-08-13 20:52:43,BBQ With Bill http://bit.ly/atCbdk #bill2010
21086577361,2010-08-13 18:39:45,Meeting voters at the world famous Daytona International Speedway #bill2010 (@ Daytona International Speedway Lot 7) http://4sq.com/9ZluYy
21082827843,2010-08-13 17:41:35,"Cutting out the ""fat"" #bill2010  http://twitpic.com/2eddfh"
21080942332,2010-08-13 17:14:17,BBQ with Bill #bill2010 (@ Smokin D's BBQ) http://4sq.com/b0Uvrl
21075549147,2010-08-13 16:02:37,Talking issues with @nicklulli of jaxnewsnow.net #bill2010  http://twitpic.com/2eckj7
21073043254,2010-08-13 15:30:12,Talking jobs and immigration to Duval County Republicans #bill2010 (@ Duval County REC) http://4sq.com/c2zv2n
21059345059,2010-08-13 12:21:53,Breakfast with Bill! #bill2010 (@ Bright Mornings) http://4sq.com/cUv3fG
21025965763,2010-08-13 02:10:28,A First Pitch and Better Education http://bit.ly/cSOKnM #bill2010 #flgov #flgop
21018925898,2010-08-13 00:29:58,Speaking to St. Johns REC about jobs and immigration #bill2010 (@ Special Events Building) http://4sq.com/aeAddr
21013931202,2010-08-12 23:15:27,Strike! #bill2010  http://twitpic.com/2e4c6g
21010424290,2010-08-12 22:22:13,Getting ready to throw out the first pitch at Jacksonville Suns baseball game #bill2010 (@ Baseball Grounds of Jacksonville)
21007359841,2010-08-12 21:35:56,One voter at a time #bill2010 http://twitpic.com/2e3k62
21005344136,2010-08-12 21:05:31,Jacksonville Chamber of Commerce Hob Nob talking jobs & economy #bill2010 (@ Hyatt Regency Jacksoville) http://4sq.com/bmsdCA
21003771963,2010-08-12 20:39:50,"Read about my first day on the Real Solutions, New Jobs Florida Bus Tour here - http://bit.ly/abwAKe #bill2010 #flgov #flgop"
20996867342,2010-08-12 18:39:20,"""I will create more jobs in Florida"" #bill2010  http://twitpic.com/2e28ym"
20996081231,2010-08-12 18:26:22,"http://twitpic.com/2e24uk Math and science skills need to improve so we have a capable workforce, my Ed plan accomplishes that #bill2010"
20995518334,2010-08-12 18:16:58,"At American Coolair plant talking jobs, economy and reducing burdensome regulations #bill2010 (@ American Coolair) http://4sq.com/9jIRkI"
20990254586,2010-08-12 16:56:25,"http://twitpic.com/2e1ft3 ""Florida is in the top 10 regulated states in the nation. That needs to change to grow the economy."" #bill2010"
20986732146,2010-08-12 16:07:38,"I just unlocked the ""Newbie"" badge on @foursquare! http://4sq.com/bTqMy4"
20986731984,2010-08-12 16:07:37,Speaking to Republican Women's Club of Duval County (@ San Jose Country Club) http://4sq.com/9BtZKU
20985415223,2010-08-12 15:49:56,Follow me on Four Square as I make my bus tour stops!  http://foursquare.com/user/billmccollum #bill2010
20984556347,2010-08-12 15:38:27,"Excited to kickoff my Real Solutions, Florida Jobs Bus Tour!  Follow me around the state here http://bit.ly/McCollumBusTour #bill2010"
20923218203,2010-08-11 22:46:57,"Check out the Leadership Florida Debate, I talk health care, immigration and jobs http://bit.ly/FLDebate #bill2010 #flgov #flgop"
20902710245,2010-08-11 17:24:40,"Today, I joined FL legislators to introduce a FL immigration law. Read my thoughts on our state laws here http://bit.ly/9PppK6"
20831434045,2010-08-10 22:34:12,Just had a great interview with Hugh Hewitt on the #hhrs!  Always enjoy talking politics on conservative talk radio.
20803714803,2010-08-10 15:34:54,Honored to have @ReaganWorld's (Michael Reagan) endorsement and support! http://bit.ly/aHLp2u #bill2010 #flgov #flgop
20791954901,2010-08-10 12:50:46,Honored to have your support! RT @AuthorLMendez @billmccollum has my vote Aug 24 #bill2010 #flgov #flgop
20765925598,2010-08-10 04:11:16,@blondegator thank you for your vote!  And your comments are respectfully noted @blondegator @jackief34 @pnp07
20740509380,2010-08-09 22:05:28,@rickytsay @DiegoTPestana @E_Wall @Chappy222 @RMFosterJr  Thanks for your votes today!  #bill2010 #flgov #flgop
20739180712,2010-08-09 21:43:32,RT @politifact_fl: Bill McCollum correctly explains Florida law to Rick Scott. http://bit.ly/alBHy9
20725138335,2010-08-09 17:40:19,"Check out photos, events and live tweets from my day with @JebBush @MikeHaridopolos @DeanCannon here http://bit.ly/BillandJeb #bill2010"
20711850875,2010-08-09 14:26:36,Thanks for your vote! RT @BryTupper Just early voted for the next govenor of the great state of Florida @BillMcCollum #bill2010 #flgov
20711473822,2010-08-09 14:21:22,@kaylaanderson @FnLshow @RMFosterJr @MyDog_Scout @jga05 @danrichman thanks for your early vote support!  #bill2010 #flgov #flgop
20710854331,2010-08-09 14:12:56,Early Vote with @JebBush lots of excitement! #bill2010 #flgov #flgop http://twitpic.com/2d4dhq
20709556477,2010-08-09 13:54:57,"@Telemundogirl Yes, its on Youtube right now, front page of my channel, here you go - http://bit.ly/arJBKz #bill2010 #flgov #flgop"
20704621742,2010-08-09 12:40:36,@blondegator I support the AZ law and in fact think it should be stronger in FL - you can read my full position here http://bit.ly/d7mETO
20703334404,2010-08-09 12:19:32,Early voting starts today! Policy comparisons: http://bit.ly/aT9nKH Polling locations (PDF): http://bit.ly/9ob6t7 Vote McCollum! #bill2010
20515407359,2010-08-07 01:43:18,Oreo Cookie Blizzard mixed with some campaigning! 18 days! #bill2010 #flgov #flgop http://twitpic.com/2ca08h
20469620777,2010-08-06 13:44:04,"An op/ed in today's WSJ discusses my challenge to Pres. Obama's healthcare law. ""McCollum vs. Obamacare"": http://bit.ly/dlYxW8"
20431191893,2010-08-06 02:02:39,Tune into On the Record with Greta Van Sustren on Fox News at 10:30 to hear about the status of my #ObamaCare lawsuit. #tcot #hcr
20428792313,2010-08-06 01:29:17,"""it was clear Bill McCollum was victorious tonight"" http://bit.ly/axLds0 #bill2010 #flgov #flgop"
20418247084,2010-08-05 22:55:10,Fraud Files Bingo for the Tampa Debate! Click here to play at home. ~staff    http://scr.bi/943RMn
20325864829,2010-08-04 19:01:31,Thanks! RT @keifer24 Just sent in my absentee ballot. Voted 4 @marcorubio & @BillMcCollum. 2 great leaders for FL #bill2010 #flgov #flgop
20317206590,2010-08-04 16:39:38,Great crowd at the Lakeland REC today! #bill2010 #flgov #flgop http://twitpic.com/2bklqh
20309634242,2010-08-04 14:47:56,Thanks for the support! RT @kevinkelso Voted for @marcorubio @BillMcCollum and @JohnLindsey #bill2010 #flgov #flgop
20255080265,2010-08-03 22:31:31,"Thanks for joining, great question on taxpayer protection RT @E_Wall Just finished a blogger conf. call with @BillMcCollum #sayfie #flgov"
20150683521,2010-08-02 16:17:46,Check out my Policy Comparison Overview http://bit.ly/McCollumComparison #bill2010 #flgov #flgop #sayfie
20149325355,2010-08-02 15:57:24,@bsfarrington correct.  My apologies to you and @davidsgirl03.
20148823858,2010-08-02 15:49:44,Getting ready for the debate on Univsion.  Be sure to watch it tonight if your in Miami!  #bill2010 #flgov #flgop http://twitpic.com/2azvmh
20139444117,2010-08-02 13:32:05,"@Procket1800 There will be another debate, broadcast in English, this Thursday on Tampa-WTVT 13 FOX"
20077684612,2010-08-01 17:51:26,Click here to read my op/ed from the Ft. Myers News-Press on the recent injunction issued in the AZ immigration case. http://bit.ly/94RZsU
20008957924,2010-07-31 18:04:54,Great day walking precincts with enthusiastic volunteers in Ocala! #bill2010 #flgov @flgop http://twitpic.com/2af579
19941233506,2010-07-30 21:39:38,@FnLshow DM me your email and my staff will send you the info.
19941112575,2010-07-30 21:37:30,@FnLshow My proven track record of conservatism http://bit.ly/McCollumBio.  Want to ask me that question on our next blogger conf. call?
19940215065,2010-07-30 21:21:57,Thanks! RT @nosey_nellie @BillMcCollum thank you Mr. McCollum. I am going to spread the word via my little network! #flgov #flgop
19939794031,2010-07-30 21:14:28,@nosey_nellie Yes.  You can read my full position here - http://bit.ly/McCollumAZLaw @bill2010 #flgop #flgov
19934565440,2010-07-30 19:42:40,Honored to have your support RT @1FoundingFather @BillMcCollum 6 votes for you out of my household. Hang tough Bill #sayfie #flgop #flgov
19926796822,2010-07-30 17:35:50,Thank you for the support! RT @WWUHLE @BillMcCollum You have mine and my wife vote.. #bill2010 #flgov #flgop
19925904341,2010-07-30 17:22:31,"Today, I introduced my plan for Florida's energy future. Read about it here: http://bit.ly/9NvwGe #tcot #bill2010 #flgov"
19923782112,2010-07-30 16:51:23,@MittRomney thanks for the #ff and your support!  #bill2010 #flgov #flgop
19844385697,2010-07-29 18:01:42,"Our state has lost a great man and friend, Admiral Leroy Collins, Jr. the Secretary of Florida Department of Veterans Affairs"
19823053473,2010-07-29 12:48:47,Thanks! RT @NicholasCStone I just sent $100 to @billmccollum. Won't you join me? Rush him your generous donation today! #flgop #flgov
19774639079,2010-07-28 22:20:41,"Thanks! MT @jennieelizabeth Just got my AB in the mail. Will be voting for @billmccollum, @pambondi & @marcorubio! NO on 4 & YES on 9 #flgop"
19747170077,2010-07-28 15:01:40,Thank you @FlChamber for your endorsement! #bill2010 #flgov #flgop #sayfie http://twitpic.com/29g7m0
19742357956,2010-07-28 13:56:01,Thanks! RT @ksalerno i voted for @BillMcCollum and @KurtDKelly on my absentee ballot. true conservative leaders! #bill2010 #flgop #flgov
19738699011,2010-07-28 13:02:10,"Thanks for the support! RT @DywanW Stand up with Florida, stand with @BillMcCollum for Governor. #sayfie #rpof #bill2010"
19686196398,2010-07-27 21:09:00,I am honored to have your support! RT @Kotch52 @BillMcCollum you have my vote!  #bill2010 #flgov #flgop
19685903483,2010-07-27 21:03:41,Honored to have the endorsement of @GaryLBauer Chairman of American Values http://bit.ly/aHcpwD #bill2010 #tcot #sayfie #flgop #flgov
19657338923,2010-07-27 13:40:50,Click here for an important video announcement from the campaign - http://bit.ly/bRPUre  #bill2010 #sayfie #flgop #flgov
19620318069,2010-07-27 02:03:31,Congrats to Matt Garza on throwing the first no hitter in Tampa Bay Rays history!
19613200709,2010-07-27 00:09:17,Thanks Manatee REC for the opportunity to speak and the standing ovation! #bill2010 #flgov #flgop http://twitpic.com/28ztbl
19600923993,2010-07-26 20:43:53,Thank you for the kind words! RT @JacobEngels Proud to stand by my good friend @BillMcCollum...Because integrity matters! #bill2010 #flgop
19596330801,2010-07-26 19:22:22,Honored to have the endorsement of over 30 current/former Sheriffs & President of the Fraternal Order of Police http://bit.ly/d8QXmI  #flgov
19572330399,2010-07-26 13:13:12,@BryTupper Great picture!
19506285808,2010-07-25 16:16:28,Thanks for your vote! RT @jessicacorbett  Just sent my absentee ballot back to FL! Proud to vote for @BillMcCollum for Gov. #bill2010 #flgov
19429613743,2010-07-24 15:50:40,"At the Florida Home Builders Association convention, speaking about the economy and how to build it!  #bill2010  http://twitpic.com/288u52"
19341835555,2010-07-23 14:06:43,I will be on the Laura Ingraham show shortly - catch it streaming on the web! http://bit.ly/bb2rDE #bill2010 #flgov #flgop #sayfie #tcot
19303331285,2010-07-23 02:20:51,@brandibelle73 You can also read my Jobs/Economy plan here: http://bit.ly/McCollumJobs  #flgop #flgov
19303189845,2010-07-23 02:18:41,"@brandibelle73 I think the AZ Law should be in FL, but stronger.  You can read my stance here: http://bit.ly/McCollumAZLaw #tcot #flgov"
19287973557,2010-07-22 22:18:52,@brandibelle73 Here is the info: http://bit.ly/9ihHWQ.  I am working to make sure they are widely broadcast.  #bill2010 #flgov #flgop
19286707083,2010-07-22 21:58:10,"@brandibelle73 Yes, August 2 & 5.  I would like more but @scottforflorida won’t agree to the Leadership Florida debate #flgov #sayfie #tcot"
19277365555,2010-07-22 19:14:01,Taking a quick break to play some Domino&#039;s with some voters in &quot;Domino Park&quot;  #bill2010 #flgov #flg http://twitpic.com/27n6vm
19273118152,2010-07-22 18:01:46,Honored to have your support! MT @kakelso I'll be voting @billmccollum. Cant trust @scottforflorida http://bit.ly/bO9XsD #bill2010 #sayfie
19263032745,2010-07-22 15:29:04,Talking with voters at the Sweetwater Senior Center.  #bill2010 #flgov #flgop http://twitpic.com/27lg87
19219276288,2010-07-22 02:17:05,I am honored to have your vote! RT @RgnCnsrv1 This Floridian voting @BillMcCollum for Governor. #bill2010 #flgov #flgop
19112871721,2010-07-21 23:13:59,"""There is no one better running for Governor"" - Armando Perez Roura of Radio Mambi #bill2010 #flgov #flgop #sayfie"
19087813400,2010-07-21 16:13:14,"""I am voting for McCollum"" - voter at Goodlet Senior Center #bill2010 #flgov #flgop http://twitpic.com/27bz7g"
19029961933,2010-07-20 23:13:26,Packed room at the Tri-County Tea Party event tonight!  #bill2010 #flgov #flgop #tcot #sayfie http://twitpic.com/274v37
19025699653,2010-07-20 22:03:02,Today in 1969 the Astronauts of Apollo 11 became the 1st humans 2 step on the moon. Congrats to @NASA for your inspiration and innovations!
18933374205,2010-07-19 17:54:18,Announcing my comprehensive Health Care plan - Read about it here - http://bit.ly/McCollumHealth #bill2010 #flgov http://twitpic.com/26vbum
18912168076,2010-07-19 12:30:46,Talking jobs and economy with the Naples Chamber of Commerce #bill2010 #flgov #flgop http://twitpic.com/26t0pg
18781852265,2010-07-17 17:49:59,Great turnout at the Naples GOP HQ!  #bill2010 #flgov #flgop http://twitpic.com/266yhf
18716465659,2010-07-16 21:20:20,I am honored to have your vote! RT @SPGGOP I dropped off my AB ballot to SOE on Wednesday. Proudly voted for @BillMcCollum! #bill2010 #flgov
18695791000,2010-07-16 15:48:04,@SPGGOP @fineout You can read my full education plan here - http://bit.ly/McCollumED  #flgov #flgop #bill2010
18690820604,2010-07-16 14:42:26,Check out my Jobs Plan http://bit.ly/McCollumJobs RT @NadiaNaffe Florida Unemployment 11.4 percent for June 2010. #flgov #flgop #tcot
18686932658,2010-07-16 13:50:30,"Great day On The Trail in South Florida! Jobs, Economy and Radio Mambi! http://bit.ly/9cukwR #bill2010 #flgop #flgov"
18565307572,2010-07-15 01:45:58,Great conference call with State and National Bloggers tonight!  DM me if you want to be on the next one!  #bill2010 #flgop #flgov #tcot
18535747751,2010-07-14 17:28:19,Check out whats been happening On The Trail http://bit.ly/cy9jPF #bill2010 #flgop #flgov
18456783650,2010-07-13 18:22:40,Check out this op/ed about my candidacy in today's @WashTimes.  RT to share! http://bit.ly/bSEzTF #tcot #bill2010 #flgov
18456002939,2010-07-13 18:09:50,"George Steinbrenner, baseball legend, a great businessman and a great friend to Florida passed today and I give my condolences to his family"
18396181003,2010-07-13 00:53:55,It was great skyping with the Jax Young Republicans tonight. Thanks to all for the birthday wishes! #tcot #flgov #bill2010
18367284067,2010-07-12 16:45:27,"Thanks for the bday wishes! RT @KateWesner Help @BillMcCollum celebrate his bday, give $20.10 to support his campaign http://bit.ly/b9kiZV"
18082766122,2010-07-09 02:18:09,I hope @KingJames can bring another NBA Championship to Florida with his new team. Go Heat!
18057651869,2010-07-08 19:29:44,"My plan for Transportation and Infrastructure, creates jobs and improves quality of life -  http://bit.ly/cSYP5R #bill2010 #flgop #flgov"
17954721781,2010-07-07 14:56:21,@SteveForbesCEO opines on the #flgov race. ~staff http://bit.ly/aiGfCi #bill2010 #tcot #sayfie
17886047440,2010-07-06 18:19:02,The Obama Admin is choosing the wrong course by challenging Arizona's immigration law.  Here is my statement: http://bit.ly/c6UP3S
