id,created_at,text
281091196783312896,2012-12-18 17:38:58,"Low taxes, low debt, job growth, progress in education &amp; improvement in the quality of life... The First 2 Years: http://t.co/Bxa8Yc0Y"
279697196545363968,2012-12-14 21:19:42,Flags over the Capitol &amp; State office buildings being flown at half-staff out of respect for the victims of today’s tragic events in CT
278617108399652864,2012-12-11 21:47:49,RT @The_RGA: ICYMI: TN Gov @BillHaslam on @HappeningNow discussing why Tennessee will not be running a healthcare exchange: http://t.co/ ...
278211085633466368,2012-12-10 18:54:26,Tennessee will NOT be running a state-based healthcare exchange under the Affordable Care Act. Learn more &gt;&gt; http://t.co/L3I7z8AV #TNgov
276848031100440576,2012-12-07 00:38:08,RT @CrissyHaslam: @BillHaslam &amp; I were honored to pay tribute to victims of homicide at TN Season to Remember &amp; hope the event b ...
276786099869872128,2012-12-06 20:32:03,Joined hundreds of public safety professionals from across TN earlier today to work together on how we can make TN a safer place #TNgov
276345948433702912,2012-12-05 15:23:03,@CaryHayes83 Reservations are requested... Find a time that works for you and reserve online: http://t.co/zAbcWV7S
276076091083464704,2012-12-04 21:30:44,I always enjoy getting to speak with such an engaged group of Tennesseans as the #FirstTuesday group #tngov
274572537785118721,2012-11-30 17:56:08,I really value the time teachers took 2day to talk w/me about what they're learning in the #Memphis Teacher Residency Program #tngov #tnedu
274271418114514945,2012-11-29 21:59:36,"RT @CrissyHaslam: ""TN's Home for the Holidays"" Open House at the TN Residence begins on Monday. @BillHaslam &amp; I encourage you to vis ..."
273537531474223105,2012-11-27 21:23:24,"Are you a college junior or senior looking for a unique internship? If so, consider joining us! Apply online: http://t.co/Pa5enK70"
273155607652081664,2012-11-26 20:05:46,We'll be lighting the Capitol Christmas tree tonight at 5:30p on Legislative Plaza... Join us! http://t.co/Aw9inaJ9
271033523257880576,2012-11-20 23:33:22,Kick off the holiday season with Christmas at the Capitol - next Monday night (11/26) on Legislative Plaza: http://t.co/Aw9inaJ9
270586460124614656,2012-11-19 17:56:54,Honored 2 join Rep. Lois DeBerry 2 proclaim November Pancreatic Cancer Awareness Month. This terrible disease affects 2 many TNan families
269488766161403904,2012-11-16 17:15:03,I share your frustrations about Obamacare - here's a quick update on where we are: http://t.co/INrB08Tg
269148868753637376,2012-11-15 18:44:25,"As #GEW2012 continues, let's remember that entrepreneurship and innovation are a big part of making TN #1 in the SE for HQ jobs #Jobs4TN"
268490219714654210,2012-11-13 23:07:11,It's Global Entrepreneurship Week- let's celebrate innovators &amp; job creators who launch startups &amp; bring ideas to life: http://t.co/JjwQTEXZ
266672691354955777,2012-11-08 22:44:58,I hope you'll join me in thanking Private First Class Elease Jenkins for her service to our country and state: http://t.co/f6EHtQOe
266304462962966529,2012-11-07 22:21:46,"With Veterans Day this Monday, we're joining forces w/ @TNDVA to honor veterans throughout the week. Say thanks: http://t.co/DD4kTw7f"
265879812126679040,2012-11-06 18:14:22,I voted. Have you? Plenty of time to make your voice heard! Find your polling location: http://t.co/ktHDN2Ei &amp; #Vote http://t.co/wyYqKci2
265526327870889985,2012-11-05 18:49:44,"RT @TNDVA: Join us in recognizing Veteran state employee &amp; .@BillHaslam honoree Frank C. Bell, Jr. http://t.co/KZ4NYF3R #VeteransDay"
264412652921552896,2012-11-02 17:04:23,The #TDOT #840 project shows #TN can continue 2 b a dynamic place 4 #econdevel while preserving our state's natural beauty #Jobs4TN #tngov
263765807522275330,2012-10-31 22:14:03,First Lady @CrissyHaslam Hosts a @Read20TN Family Book Club Halloween Event at The Tennessee Residence: http://t.co/jCTq27cS
263362439440109568,2012-10-30 19:31:13,Proud 2 join @SenAlexander in announcing #RockyFork to become a new state park - to be the 55th state park and highest park in state #tngov
263314301631209472,2012-10-30 16:19:56,"Want 2 address cost, access &amp; quality of higher education so we're providing needed graduates 4  2day's workforce #tnedu #tngov #Kingsport"
263311268360900609,2012-10-30 16:07:53,"Glad 2 b in #Kingsport w/ @SenAlexander - #TN is highly ranked for its low debt, tax burden, gov't management, but we want 2 b No. 1 #tngov"
263310961866321923,2012-10-30 16:06:40,RT @SecTreHargett: Time Running Out to Vote Early in Tennessee http://t.co/ONUHfcSQ
261871507297419265,2012-10-26 16:46:47,Just voted at Knoxville's City-County Building... Remember: early voting runs through November 1st in Tennessee. #vote
261843220596658176,2012-10-26 14:54:23,RT @CrissyHaslam: Just released a report on Parent Engagement @MetroSchools Engagement Summit! Read it here: http://t.co/7fGiSj63
261107769896214528,2012-10-24 14:11:58,"RT @CrissyHaslam: Congratulations! RT @TNedu: Congrats to our Teacher of the Year, Memphis 2nd-grade teacher Allyson Chick https://t.co/ ..."
260787238395322368,2012-10-23 16:58:17,"Just finished meeting with bond rating agencies in #NYC - always enjoy telling TN's story: low debt, low taxes and conservative fiscal mgmt."
260475064733028352,2012-10-22 20:17:49,"In New York City meeting w/ bond rating agencies to tell #Tennessee's story - a low tax, low debt state w/ strong fiscal management #tngov"
259348415031418880,2012-10-19 17:40:55,"Very thankful 4 gr8 partnership #Tennessee has w/ @NissanNews - 3rd shift, &gt;800 jobs @ Smyrna. They've added &gt;2k jobs since 7/2011 #jobs4tn"
259333442284695552,2012-10-19 16:41:25,RT @CrissyHaslam: I just finished early voting! Find your polling location &amp; vote at a time that's convenient for you: https://t.co/ ...
259022294272327680,2012-10-18 20:05:02,Looking forward to making a pretty significant jobs announcement around 12:00p tomorrow. Stay tuned. #Jobs4TN
259017349204688897,2012-10-18 19:45:23,RT @UTPresidentJoe: 1 of 8 'Ideas to Improve Higher Ed' by Gov @BillHaslam in TIME magazine out today: Tie Funding to Graduation Rates h ...
259009490572177408,2012-10-18 19:14:09,October's email update | A Top State: http://t.co/dDQF8nyH
258654217349263360,2012-10-17 19:42:25,Today marks the start of early voting across Tennessee. Find your polling location here: http://t.co/lFgmWio0 #Election2012
258571955110805504,2012-10-17 14:15:32,"RT @CrissyHaslam: If you are not doing so already, be sure to ""like"" my facebook page to receive live updates @ my early ed initiatives! ..."
258299640322080768,2012-10-16 20:13:27,On behalf of the state I want 2 congratulate Fifth Consolidated and Trimble in Dyer Co. &amp; all other Rewards Schools 4 job well done #tnedu
258253211096477696,2012-10-16 17:08:58,"Announced #CDBG and #LPRF grants for Weakley Co, Dresden, Sharon, South Fulton - grants will help meet basic infrastructure needs #tngov"
257926698685825024,2012-10-15 19:31:31,Great to see a Tennessee company playing a significant role in @BaumgartneFelix's record-breaking jump: http://t.co/8h050pLN
257193069470945280,2012-10-13 18:56:20,"Happy 237th Birthday, @USNavy! http://t.co/GZn0xmRe #NavyBday"
256869882677833729,2012-10-12 21:32:07,Heading back to Nashville after dedicating the LMU Math &amp; Science Bldg. - Looking forward to the 840 bike ride tomorrow http://t.co/ml275g4L
256464543209889792,2012-10-11 18:41:26,"TN has a rich history with the auto industry, and we're addressing #TNedu because we know we need to improve to attract jobs of the future"
256145589702623232,2012-10-10 21:34:02,"Congratulations to Jane Winter, 2012-13 Principal of the Year and to Bobby Cox, 2012-13 Supervisor of the Year! @TNedu https://t.co/HxQRaL43"
255683939522449408,2012-10-09 14:59:36,RT @CrissyHaslam: Strong leaders in education are important for student success. @BillHaslam and I are glad to be a part of @TNedu's #LE ...
255351513650704384,2012-10-08 16:58:39,Tennessee Ranked Top Tier State for Digital Technology: https://t.co/fz0s8fj0 #Jobs4TN
254265701311848450,2012-10-05 17:04:01,"What exactly is a CDBG? Well, they support projects in local cities and towns that help strengthen the community: http://t.co/DsggNYr6"
253975884938227713,2012-10-04 21:52:24,"&gt;$1M in grants to Huntsville, Oneida &amp; Scott Co. for community improvements - gr8 2 b able to help strengthen communities - esp. rural areas"
253533939472416770,2012-10-03 16:36:16,"RT @TNVacation: Tennessee Fall Foliage By Train, Boat, and Air! http://t.co/tRmN6fKq"
252882616519360512,2012-10-01 21:28:08,RT @CrissyHaslam: The October @Read20TN Book of the Month is Darwen Arkwright &amp; the Peregrine Pact by A.J. Hartley! Find out more he ...
251762824529997824,2012-09-28 19:18:29,"Joined @DaveRamsey just a few minutes ago to declare ""Dave Ramsey Show Day"" in TN for the show's 20th anniversary. Congrats Dave &amp; team!"
251316417520082944,2012-09-27 13:44:37,"Joined @HCAhealthcare's Richard Bracken &amp; #MayorDean a few minutes ago to announce HCA's $200m investment and 2,000 new jobs in Nashville"
251032993773264896,2012-09-26 18:58:24,"Announced a Local Parks and Recreation Fund grant of $250,000 to further develop Leeper Lane Park in Jackson: https://t.co/xjXLtaI0"
250337778934616064,2012-09-24 20:55:52,Weak Dollar Could Help Draw Japanese Businesses: http://t.co/itTfmuMy
249229270268923906,2012-09-21 19:31:03,RT @CrissyHaslam: What an honor to join First Lady Laura Bush &amp; Jenna Bush Hager today in celebrating the 100th Anniv. of Girl Scout ...
248894434689826818,2012-09-20 21:20:32,RT @CrissyHaslam: @BillHaslam &amp; I loved reading to some of our children in foster care as part of @TNImagination Library Week! http: ...
248836060912705536,2012-09-20 17:28:34,Some further thoughts on Tennessee's important partnership with Japan: http://t.co/T2dgSirc #Jobs4TN
248516156359581697,2012-09-19 20:17:23,@BNYMellon's expansion announcement earlier means more high quality #Jobs4TN- Growing existing businesses plays a critical role for new jobs
248182457214578689,2012-09-18 22:11:23,"Happy 65th Birthday to the @USAirForce! In their honor, the U.S. Air Force Song: http://t.co/VgzaPf3T"
248103802450874368,2012-09-18 16:58:50,"Honored to join Treasurer Lillard, @RonRamsey &amp; @SpeakerHarwell for relaunch of the TNStars College Savings Program http://t.co/OabFkCvc"
247830776668880896,2012-09-17 22:53:56,"RT @CrissyHaslam: Happy Constitution Day! This day commemorates the formation &amp; signing of the U.S. Constitution on September 17, 1787."
247729642713255936,2012-09-17 16:12:04,@T_E_M_A's ReadyTN mobile application now available for iPhone &amp; iPad https://t.co/FfLDseEs
246691954484715521,2012-09-14 19:28:39,RT @CrissyHaslam: Check out photos from @FlatStanley's last day in Japan here: http://t.co/vzURrCxG. @READ20TN
245971697868611586,2012-09-12 19:46:37,"Flags to be lowered immediately in honor &amp; in memory of U.S. personnel killed during attack on our diplomatic facility in Benghazi, Libya"
245960077012504576,2012-09-12 19:00:26,RT @CrissyHaslam: @FlatStanley &amp; I had a great adventure in Tokyo while @BillHaslam participated in the SEUS meeting! Visit http://t ...
245624491223429120,2012-09-11 20:46:56,"Proud to be a part of the Expect More, Achieve More coalition aimed at raising expectations in the classroom: http://t.co/0XpafDiw #TNedu"
245572673462235137,2012-09-11 17:21:02,"Let us always remember the victims, their families, 1st responders, those lost and those continuing to fight the war on terror. #Remember911"
245244348768333824,2012-09-10 19:36:23,Flags at the State Capitol and all state buildings will be flown at half-staff tomorrow in memory of those who lost their lives on 9/11/01
243780131892654080,2012-09-06 18:38:07,"The national debt surpassed $16 trillion just a few days ago, but we're on a different path here in Tennessee: http://t.co/NhuwGMpu #TNgov"
243463540898406400,2012-09-05 21:40:06,Finished our workforce development conversations w/ local bus. &amp; ed. leaders - here's a video wrap on what we learned: http://t.co/b7j3JmXF
241278956362428417,2012-08-30 20:59:20,Joined @TeamCavuto on @FoxBusiness from #GOP2012 last night: http://t.co/Q5nN5lk6
240183313027981312,2012-08-27 20:25:38,"RT @CrissyHaslam: Kenrose Elementary students were excited to learn they are hosting ""surprise"" celebration for over 100 top TN schools! ..."
239502368457248768,2012-08-25 23:19:49,Congrats Goodlettsville All-Stars on your #LLWS win! All of TN will be cheering you on tomorrow at 2:00p CDT vs. Japan!
239015176626659328,2012-08-24 15:03:53,RT @TNECD: #Franklin &amp; #Hendersonville make @CNNMoney's 2012 Top 100 Best Places to Live list! http://t.co/loTHhU4q @HvilleChamber @ ...
238758531648593920,2012-08-23 22:04:04,Thanks so much for all of the birthday wishes today - it's been a great one!
238666990410153984,2012-08-23 16:00:19,Our 7th (and final) post-secondary education discussion will be @UTChattanooga this afternoon. Look for a wrap-up of these discussions soon.
238059145918574592,2012-08-21 23:44:57,RT @CrissyHaslam: The Cheatham Co Fair is last @Read20TN stop today. Giving away free copies of Charlotte's Web to encourage reading! ht ...
238028055514316800,2012-08-21 21:41:25,RT @CrissyHaslam: Boys &amp; Girls Club of Maury Co joined me today at the Maury Co Library to hear more about the @Read20TN Book Club!  ...
238019738247241728,2012-08-21 21:08:22,En route back to Nashville after completing my 6th conversation around post-secondary ed.  What would you like to add to the conversation?
236543256974999553,2012-08-17 19:21:21,"It's back to school time, so what better time is there to raise your hand and help out? Join @CrissyHaslam and volunteer to help @RYHTN!"
236128409477074944,2012-08-16 15:52:54,Great morning in Clarksville... Walked with Moore Magnet students along the riverwalk and then announced a grant that will help expand it...
235839847879806976,2012-08-15 20:46:16,"RT @CrissyHaslam: Did you see TN Exec. Residence Chef, Matt Gallaher, on ""Talk of the Town"" last week? Watch video of his feature here:  ..."
235746053515788289,2012-08-15 14:33:33,An Update from the State Capitol: Back to School - http://t.co/3wwF6c3h
235476081484918784,2012-08-14 20:40:47,Just wrapped our 5th conversation on post-secondary education at the TN Technology Center here in Nashville - great discussion! #tnedu
235466659316506624,2012-08-14 20:03:20,RT @CrissyHaslam: New @Read20TN Family Book Club members in Hamblen County! http://t.co/6LL7QU9C
235133223510888448,2012-08-13 21:58:23,RT @CrissyHaslam: I'll be promoting my @READ20TN Book Club in East TN tomorrow! Come join us if we are in your area! Event schedule: htt ...
235034157150003200,2012-08-13 15:24:44,RT @CrissyHaslam: Please take a moment to read my op-ed! This is an imortant message for parents and guardians: http://t.co/p7JhVQf7
233667286525960192,2012-08-09 20:53:17,Honored to participate in the @CARGroup Management Conference earlier today in MI | Shared some of our progress via http://t.co/XXn3qQnW
233304507847675904,2012-08-08 20:51:43,RT @CrissyHaslam: Donating 6 copies of Charlotte's Web to Henry Co Library today as part of @Read20TN Book Club promotion in NW TN. http ...
233221874153299969,2012-08-08 15:23:22,We're always looking for opportunities to grow the automotive supply chain here in TN: http://t.co/a1knNsjF #Jobs4TN
232912332093808640,2012-08-07 18:53:21,Announced a couple of significant transportation grants for Savannah &amp; Bolivar - now en route to a post-secondary education event in Memphis
232594366491930626,2012-08-06 21:49:53,"RT @TNedu: TN's new #STEM schools use partnerships, iPads and collaborative learning to prep students for 21st-century careers https://t ..."
232549926800879616,2012-08-06 18:53:17,Tractor Supply is a great corporate citizen in Tennessee so it's great to hear this : http://t.co/Ti9KdZtM #Jobs4TN
231504679048187904,2012-08-03 21:39:51,@Amazon to Accept Applications at TN Career Centers for Several Hundred Full-Time Warehouse Positions http://t.co/MdiMAI6X #Jobs4TN
231488719826321408,2012-08-03 20:36:26,"Just a reminder: this weekend is Tennessee's Annual Sales Tax Holiday! Save on school supplies, clothes &amp; computers: http://t.co/B6ZyQ6Re"
231106556207443969,2012-08-02 19:17:51,Tennessee: There's still plenty of time to get out and vote! Find your polling location and more here: http://t.co/AFxae2O8
230683395896782849,2012-08-01 15:16:22,RT @CrissyHaslam: Excited to announce the August READ20 Family book is Charlotte's Web by E.B. White. Visit http://t.co/gEH8ewX1 for mor ...
230419491169894401,2012-07-31 21:47:42,This weekend is Tennessee's Annual Sales Tax Holiday: http://t.co/B6ZyQ6Re Please RT to spread the word! #TNgov
230316400349175808,2012-07-31 14:58:03,It's great to see educators in these school districts improving student performance &amp; narrowing achievement gaps! http://t.co/pYO5V1ze
229978946438057984,2012-07-30 16:37:08,@TNHighwayPatrol accepting applications for academy: http://t.co/TcoCaapi
229258191005945856,2012-07-28 16:53:06,RT @CrissyHaslam: So proud of Cole Elementary for visiting the homes of every Cole family today at our Back to School Neighborhood Knock ...
228482673050546177,2012-07-26 13:31:28,Great No-Till Field Day breakfast in Milan - Events like this really speak to who we are in Tennessee @TNFarmers
228210794716872704,2012-07-25 19:31:08,En route to Dickson City Hall for a TDOT Enhancement Grant Announcement at 3:15 p.m. #tngov
227887946513133568,2012-07-24 22:08:15,Happy Birthday to one of the very best House Speakers in America @SpeakerHarwell #tngov
227441184585433088,2012-07-23 16:32:58,"RT @CrissyHaslam: School starts soon &amp; parent engagement is key 4 success! This week, I'll make door-to-door visits to encourage fam ..."
226403719460298752,2012-07-20 19:50:27,"Honoring &amp; remembering the victims of the tragic events that took place in Aurora, CO this a.m. by lowering flags at all state buildings..."
226051488051511297,2012-07-19 20:30:49,RT @CrissyHaslam: Interested in registering your 5-and-under child with TN's statewide Imagination Library? Go to http://t.co/D3hg6V7l t ...
224982878440796160,2012-07-16 21:44:32,Some great news to start the week: TN Ranks No. 1 in Automotive Manufacturing Strength Three Years Running http://t.co/XUzjhBjm #Jobs4TN
224903795619020800,2012-07-16 16:30:18,RT @CrissyHaslam: Thanks to the military children&amp;families who joined me in Knoxville today to learn more about the @Read20TN Book C ...
224223839033360384,2012-07-14 19:28:23,A quick update on our efforts around post-secondary education in Tennessee: http://t.co/sSxuPsiV #tnedu
223806370837835777,2012-07-13 15:49:31,"@PatSummitt is the very picture of what we want college sports to be all about. Congratulations, Pat. http://t.co/c124XrVK #WeBackPat"
223541923388993536,2012-07-12 22:18:42,Announced several TDOT grants this afternoon | Hopeful that these grants help bring added energy to these W. TN towns http://t.co/Iha4NEuR
223465694782697472,2012-07-12 17:15:48,It's a New Day in Tennessee: http://t.co/KLuSNzdS #tngov #tnedu
223165989347524608,2012-07-11 21:24:52,Higher education experts praise Tennessee efforts: http://t.co/Txh7yZ6X #TNedu
223082218791256065,2012-07-11 15:52:00,RT @CrissyHaslam: I'll be visiting w/military families in July to promote my @Read20TN Book Club! Met 80 cute kids @ Ft. Campbell today! ...
222810979866644480,2012-07-10 21:54:11,Great meeting earlier today with post-secondary education leaders from across the state... How would you improve higher education? #TNedu
222368924434563072,2012-07-09 16:37:37,Support Tennessee in @CNBC's Top States for Business Twitter Battle | Simply RT to cast your vote! | Watch http://t.co/ruW4XURS #TopStatesTN
221732698828451840,2012-07-07 22:29:29,Watch 2 see y TN should win @CNBC’s #TopStates for Business Twitter Battle! http://t.co/ruW4XURS RT 2 cast vote #TopStatesTN #Jobs4TN #TNgov
218814062371414017,2012-06-29 21:11:52,RT @CrissyHaslam: @BillHaslam &amp; I were thrilled to thank some of our military and their families at the Tennessee Residence today! h ...
218420762535673856,2012-06-28 19:09:02,A few thoughts on this morning's #Obamacare ruling: http://t.co/uH5Eo9PU  What's your take?
218070627809099777,2012-06-27 19:57:43,RT @CrissyHaslam: Bill &amp; I will attend @memphisredbirds game tomorrow night to promote my @READ20TN book club! 1st 200 families ther ...
218016347651715073,2012-06-27 16:22:02,ICYMI: The TN Department of Safety is using iPads for faster self-service driver license renewals: http://t.co/RdipZlsZ #TNForward
217712068705521666,2012-06-26 20:12:56,"Proud of our students, teachers and parents for supporting statewide efforts to improve education: http://t.co/A0tzbtE8 #TCAP #TNedu"
217343152942616576,2012-06-25 19:47:00,Discussed workforce development @SGPB - We've got some real opportunities for growth in TN - just need to make sure the workforce is ready
216224817660170241,2012-06-22 17:43:08,RT @ORChamber: And here's the big news! This is wonderful for Jackson Square and for the City of Oak Ridge! Thanks to all of our... http ...
215927185616281601,2012-06-21 22:00:27,"RT @RYHTN: Have u read to children, tutored or mentored? Share 2day in @RYHTN @UnitedWay BigTweet. Use #iamthechange #LIVEUNITED http:// ..."
215256400631308290,2012-06-20 01:34:59,"RT @TSUedu: Today is the day we celebrate 100 years of academic excellence, history, tradition and service.Happy Birthday #TSU! #100Stro ..."
215209278565392385,2012-06-19 22:27:45,"RT @JimmyWayne: Senator Doug Overbey, @BillHaslam @jimmywayne @RepMarkWhite presenting me with a signed copy of the bill pas http://t.co ..."
215156521691131904,2012-06-19 18:58:06,Just signed an important bill that allows foster families to care for children until age 21. Great news for families &amp; kids! cc: @JimmyWayne
214042153280741376,2012-06-16 17:10:00,"200 years ago TN earned the nickname “The Volunteer State"" This gr8 exhibit explains why &amp; more re: War of 1812: http://t.co/TyvU99Ep"
213670342915407872,2012-06-15 16:32:34,Kiplinger names Nashville the top city in the nation for job growth: http://t.co/H1qMOhIv #Jobs4TN
213449454051786752,2012-06-15 01:54:50,RT @CrissyHaslam: Great night for baseball! Thanks to all the children &amp; families who pledged to #Read20 min a day at the @nashville ...
213368438708645888,2012-06-14 20:32:54,"Looking forward to joining @CrissyHaslam, @BGCMT &amp; @PhoenixClubNash in promoting @Read20TN at tonight's @NashvilleSounds game. Join us!"
213340969062498305,2012-06-14 18:43:45,RT @BGCMT: Looking forward to joining @phoenixclubnash tonight with @billhaslam @crissyhaslam to help promote @read20tn at @nashvillesou ...
213303775241314304,2012-06-14 16:15:57,Today marks the 235th Flag Day and it's also the 237th birthday of the U.S. ____.  Happy Birthday to both! http://t.co/iSAZxdKf
212939766197522433,2012-06-13 16:09:31,RT @CrissyHaslam: What a treat to hear Gov.'s Children's Cabinet talk @ their important work &amp; collaborating between depts. today at ...
212936135859634176,2012-06-13 15:55:05,ICYMI: Magneti Marelli to Expand Pulaski Site to Include Lighting Operation | Will Create 800 New Jobs in Giles County: http://t.co/fW4kZpEn
212590111668453376,2012-06-12 17:00:07,One major reason TN is such a great state to live in and locate a business - no state income tax: http://t.co/iBm4DXPP #Jobs4TN
212546335482707971,2012-06-12 14:06:09,RT @CNBCSquawkSt: TODAY: Gov. @BillHaslam and Fmr. @GM Vice Chrmn join; @jboorstin on @comscore data on @facebook; @staceyretail talks @ ...
210822954450300928,2012-06-07 19:58:03,RT @TNVacation: 30 years ago today Graceland opened its doors for public tours! Any of you visited the @ElvisPresley landmark? Share you ...
210730760657829888,2012-06-07 13:51:43,RT @MyFutureMyWay: Hillwood students got to job shadow at the Tennessee State Capitol! Thanks to Governor Bill Haslam and State... http: ...
210421187673735168,2012-06-06 17:21:35,A pretty good week for TN: signed a bill that reduces the tax on food &amp; just signed a bill that phases out TN's inheritance tax. #Jobs4TN
210116175747756032,2012-06-05 21:09:34,Enjoyed stopping by the TN Digital Government Summit earlier today. What big ideas do you have for improving government via technology?
209759121724026883,2012-06-04 21:30:46,RT @DOHRtn: Are you a state employee with a good idea on how to improve operations/reduce costs? Let us know! Visit: http://t.co/DjjQe7rr
209711521088012288,2012-06-04 18:21:37,Our job: give the very best service at the very lowest price. Just one reason I proudly signed a bill that reduces the tax on groceries.
208673832729452546,2012-06-01 21:38:13,RT @CrissyHaslam: I'm so excited to launch the @READ20TN book club! Please check out http://t.co/TQGjL16V to learn more. Please RT!
208604835027755008,2012-06-01 17:04:03,"Nissan to hire 1,000 | Job fair for Smyrna plant scheduled for Saturday: http://t.co/H9doqIuL #Jobs4TN"
208306301091053568,2012-05-31 21:17:46,Did you know? Tennessee is the 3rd most admired state in the nation! What do you love about Tennessee? http://t.co/AlQleuvk #TNForward
208214299804577792,2012-05-31 15:12:12,@MBJMemphis: Amazon hiring fully underway in Middle Tennessee: http://t.co/wel8WnYq #Jobs4TN
207910237716492288,2012-05-30 19:03:58,RT @CrissyHaslam: Great to be with @RepDianeBlack and @JamieWoodson at TN Tech to help create partnerships btwn schools and businesses.  ...
207565703342063616,2012-05-29 20:14:54,@CrissyHaslam &amp; I were at @ALAVGS earlier... Always impressed by the level of engagement and desire to lead http://t.co/mR0aqhDL
