id,created_at,text
136932093841248256,2011-11-16 22:22:09,Congrats to Chattanooga & @Volkswagen - @VW's Passat has been named Car of the Year by @MotorTrend! #CHA http://t.co/VaBzluvd
136587957153968129,2011-11-15 23:34:41,Thanks to Sprint for deciding to build a modern call center in Sullivan Co. - investment is indicative of the pro-business climate in TN
134745620891172865,2011-11-10 21:33:54,Please join me in recognizing Phyllis M. Long with the Dept. of Correction: http://t.co/8HNjEDiu RT to show your support for our veterans!
134358111413731328,2011-11-09 19:54:04,"Highlighting the service of Scotty W. Martin, Sr. - one of our veterans tied as our newest state employee: http://t.co/BhASI0Sa"
134031910694424576,2011-11-08 22:17:52,Join me in recognizing Donald Gagne w/ Dept. of Correction - one of our veterans tied as our newest state employee: http://t.co/SP3LR3x5
133649988260601857,2011-11-07 21:00:14,"In observance of Veterans Day, we'll be highlighting state employees & their service to our country each day this wk: http://t.co/SE9x4T01"
132582560734773249,2011-11-04 22:18:40,Great 2nd day of budget hearings - archived video available now - live hearings resume 11/15 in Nashville: http://t.co/VkOmniSJ #TNgov
132103437742645248,2011-11-03 14:34:48,"Email update: Credit Ratings, Tennessee's Home for the Holidays & Amazon: http://t.co/kuG8bvW8 #TNgov"
131853216794165248,2011-11-02 22:00:31,"Enjoyed hearing from Commissioners Gibbons, Davis, Hagerty & Gonzales today - live budget hearings resume Friday at 8:30 a.m. in Nashville"
131733140627664897,2011-11-02 14:03:22,Join me in welcoming MANN+HUMMEL USA to Tennessee - appreciate the investment and jobs the company is creating here! http://t.co/4yJYULcb
131367511118716929,2011-11-01 13:50:29,The Complete College Act is an important part of what we're doing to make TN the #1 location in the SE for high quality jobs. #Jobs4TN
131110427202560000,2011-10-31 20:48:56,Congrats! RT @WMBWKate: Congrats to @TNVacation for being named 1 of the “Top 20 tourism sites for your inspiration” by http://t.co/x4X6A04e
130038416447504384,2011-10-28 21:49:09,Great things are happening at South Side HS- share your thoughts on a local school that deserves recognition- video: http://t.co/kFitxdMN
129576058293981185,2011-10-27 15:11:54,"RT @investtennessee: Gov @BillHaslam, Comm Hagerty Announce Viacom Shared Services Ctr to Locate in Williamson Co: http://t.co/otSx374I  ..."
129309579258503168,2011-10-26 21:33:00,Budget hearings will be taking place across the state starting next Wednesday at the University of Memphis: http://t.co/EJyzzgr1 #TNgov
129242350286409728,2011-10-26 17:05:52,Great discussion yesterday! MT @TNFarmBureau: @BillHaslam visits with West TN #farmers - listen to audio on the event! http://t.co/OhJnoZFn
128838513671159808,2011-10-25 14:21:10,Met with some great educators at South Side High School in Jackson - Looking forward to hearing from ag. stakeholders at Woodburn Farm
128602276800626688,2011-10-24 22:42:26,RT @investtennessee: Gov @BillHaslam and Commissioner Hagerty Announce Expansion of Cormetech: http://t.co/MprIUYnJ #Jobs4TN #TNManufact ...
128504097161756672,2011-10-24 16:12:18,Improving health is intricately tied to ECD and education - that's why we must improve TN’s health status from #42/50: http://t.co/yei7WpY4
127479961660559361,2011-10-21 20:22:45,@WVLT Feel free to use any photos posted to flickr.com/governorbillhaslam/ online and on-air... #TNedu
127470534731636737,2011-10-21 19:45:18,Photos from last night's Teacher of the Year Banquet in Nashville: http://t.co/uKJDWYBX #TNedu
127392777607708674,2011-10-21 14:36:19,RT @YvetteM_BHMedia: .@BillHaslam and Health Commissioner Dreyzehner explain the importance of getting your flu shot.  Watch their msg h ...
127156300084817920,2011-10-20 22:56:39,Looking forward to the Teacher of the Year Banquet with @CrissyHaslam this evening! #TNedu
127061117196451844,2011-10-20 16:38:25,RT @TNCommerceInsur: Have you reached a milestone lately? The Tenn. Insurance Division encourages consumers to review coverage annually. ...
126319745766137856,2011-10-18 15:32:28,Just had a chance to get a seasonal flu shot in Clarksville with Department of Health Commissioner Dreyzehner. Will you get a flu shot?
126007048285601793,2011-10-17 18:49:56,Report: TN charters are national leaders: http://t.co/ITUf3riv #TNedu
124214704376774656,2011-10-12 20:07:47,Great to see an existing Tennessee business expanding in Robertson county: http://t.co/yZwS4yns #Jobs4TN
123507109127127040,2011-10-10 21:16:04,"RT @investtennessee: Governor @BillHaslam, Commissioner Hagerty Announce CANBERRA Expansion in Oak Ridge: http://t.co/EH3xIdJM #Jobs4TN  ..."
122410439387779072,2011-10-07 20:38:17,MT @TennStateParks: Gov. Haslam recently recorded a radio spot for TN State Parks- it's a perfect weekend to visit one: http://t.co/brsXcSML
122335391670996993,2011-10-07 15:40:04,Enjoyed visiting Memphis' Stax Museum & Music Academy - looking forward to stopping by Gov's Conf. on Tourism http://t.co/wznPB0zS
122038991326416896,2011-10-06 20:02:17,Proud that @Amazon has chosen to make a significant investment in TN and is committed to expanding its presence here http://t.co/0HULr6Ry
121284608175243265,2011-10-04 18:04:38,Video: Some quick thoughts on the great news that Tennessee is maintaining its strong credit ratings - http://t.co/kqEUnkkW #TNgov
120979446231605248,2011-10-03 21:52:02,"October 6th Job Fair Features Up to 2,000 Seasonal Positions at Online Distribution Center in Lebanon: http://t.co/PsH8rfBw #Jobs4TN"
120961897196552193,2011-10-03 20:42:18,"Enjoyed traveling to New York last week to participate in NBC's ""Education Nation"" - Video: http://t.co/jBIOQxA1 #TNedu"
119853978602307585,2011-09-30 19:19:49,Common Core Standards and Teacher Tenure Reform in Tennessee Win PIE Network Education Reform Awards: http://t.co/TSa0L7yJ #TNedu
119140071000653825,2011-09-28 20:03:01,Really enjoyed speaking to a great crowd at the @DwntwnNashville annual luncheon - Downtown is everybody's neighborhood! #TNgov
118692686541754368,2011-09-27 14:25:16,RT @educationnation: #HigherEdNat will be moderated by @mitchellreports and features @completecollege @BillHaslam @JulietVGarcia and @Ch ...
118449189553307648,2011-09-26 22:17:42,VIDEO: The Five Truths About Job Creation in Tennessee: http://t.co/5B612WbR #Jobs4TN
118364453292085249,2011-09-26 16:40:59,RT @DSmith_BHMedia: @BillHaslam on MSNBC & webcast here http://t.co/ZTa2p3NE  at 1:45 EDT today for NBC #EducationNation Governor's Pers ...
117249619934711808,2011-09-23 14:51:02,Just at the @WhiteHouse highlighting the state's role as a leader in ed. reform- look forward to the fed. gov. narrowing its role in #TNedu
116915665281093632,2011-09-22 16:44:01,Enjoyed meeting a lot of the great folks at TDOT during a dept. visit earlier - looking forward to stopping by Children's Services this p.m.
116552124774612992,2011-09-21 16:39:26,A minute and a half update on your Tennessee State Government: http://t.co/6oX9ueYT #Jobs4tn #TNgov
115816340358578177,2011-09-19 15:55:41,Congrats to MedSolutions on the expansion of their Franklin headquarters! +263 high quality jobs over 3 years http://t.co/HXViuH07 #Jobs4TN
115143996195602433,2011-09-17 19:24:02,Vols/Gators about to kickoff - feeling really good about my chances for some Key Lime Pie from @FLGovScott  #GoVols http://t.co/D4Wa8DIL
114700040735428608,2011-09-16 13:59:55,Enjoying friendly competition w/ @FLGovScott on Vols/Gators: Benton's bacon if Gators win; key lime pie when #GoVols win!!! #BaconVsPie
114350424718450688,2011-09-15 14:50:40,Appreciate TeamHealth’s commitment to & investment in Blount Co. - Expansion to create nearly 550 jobs: http://t.co/eqozz9lU #Jobs4TN
113988745702801409,2011-09-14 14:53:29,Thanks to TRG Customer Solutions for locating in TN - hundreds of new jobs will be a welcome addition to the Maury County economy #Jobs4TN
113629925327650816,2011-09-13 15:07:39,RT @debramaggart: This am TN House GOP meeting with Dr. Art Laffer on ways to spur TN's economy at our caucus retreat.
113288377708711937,2011-09-12 16:30:28,En route to NYC to meet with the three bond rating agencies- TN is and will continue to be a low tax state with a great story to tell #tngov
112940557784981504,2011-09-11 17:28:21,America's Resilience - Ten Years Later - http://t.co/6uPBYYc
112242676463710209,2011-09-09 19:15:14,Thanks to all who shared their 9-11 stories - Here's a brief video reflecting on that day & the resilience of America: http://t.co/0zNoPJY
111907251094171648,2011-09-08 21:02:22,This Sunday marks ten years since 9-11-01. Where were you that day? Share your story and thoughts...
111842518693453824,2011-09-08 16:45:09,"Governor Haslam, Commissioner Hagerty Announce Board Members for Film, Entertainment & Music Commission: http://t.co/y4g9e51"
108931748305440768,2011-08-31 15:58:47,Thankful for the ideas from 60+ Memphis & Shelby Co. bus. & elected leaders all talking about how state can work w/ local econ. dev. plans
108694746641334272,2011-08-31 00:17:01,Does parental involvement play a role in a child's success? Read the @CrissyHaslam Op-Ed and share your thoughts: http://t.co/0K4EsGu
108562782428987392,2011-08-30 15:32:38,RT @WZTVJohnDunn: Very excited to learn about 400 jobs coming to Perry County!  This area has been hit very hard by the recession.
108548029350543361,2011-08-30 14:34:01,Pleasure to award grant for Greenbelt Pedestrian Bridge project - helps make a healthier TN and adds to quality of life
108531054754803712,2011-08-30 13:26:34,NE TN has many great economic development models that encompass improving education - essential to job growth. #Jobs4TN
108296294312853504,2011-08-29 21:53:43,"Looking forward to a busy day tomorrow: joining @RonRamsey in the Tri-Cities, then heading to Knoxville & Vonore before heading back #tngov"
107622422076862465,2011-08-28 01:15:59,Beautiful day for a race @BMSUpdates - enjoyed participating in the pre-race festivities earlier! http://t.co/PCrxktr
107120197126725632,2011-08-26 16:00:19,Great crowd and questions this morning at the Nashville Business Breakfast at @Lipscomb #tngov
107084522708942848,2011-08-26 13:38:34,An Update from the Capitol: http://t.co/cizyLFl
106842234678288386,2011-08-25 21:35:48,Photos from yesterday's Chattanooga events and today's events in Hendersonville are now available on Flickr: http://t.co/2oGag8G #TNgov
106803679616712704,2011-08-25 19:02:36,Thoroughly enjoyed meeting with business owners and discussing #TNedu at COMPASS event in Hendersonville earlier today #TNgov
106412961752563712,2011-08-24 17:10:01,Really enjoyed #CHAchamber Annual Lunch- we must continue to be a low tax state w/ an attractive business climate to encourage investment
106090801800548352,2011-08-23 19:49:52,"Are you a college junior or senior? If so, our intern program has a couple of spots left for fall! Apply online: http://t.co/FqkcUkv"
105752411267796992,2011-08-22 21:25:14,"Have you had a chance to sign up for our monthly email updates? If not, It's quick and easy: http://t.co/qPhXUER"
105669132669825024,2011-08-22 15:54:19,The National Folk Festival is coming to Nashville for a 3 day celebration of American culture Sept. 2-4. Watch: http://t.co/ykcLnqH
104243914885701633,2011-08-18 17:31:00,Wrapping up a great event with Rep. Hawk at Unicoi Middle School & now heading to Erwin Town Hall for a couple of TDOT announcements...
104191471053320192,2011-08-18 14:02:37,Leaving the Sullivan County Courthouse and headed to ETSU for a TDOT announcement. Looking forward to a great day in NE TN #tngov
103556994660696065,2011-08-16 20:01:26,Just visited the Department of Safety & Homeland Security - Great to see so many driver services moving online: http://t.co/eAMo7Sg
102118892905824257,2011-08-12 20:46:56,RT @TNAgriculture: @BillHaslam & @CrissyHaslam recently celebrated the 25th anniversary of @PickTnProducts w/ 25 farmers at the residenc ...
102048204064948224,2011-08-12 16:06:02,On my way to Ellington Agriculture Center to meet & congratulate winners of TDEC's Governor's Environmental Stewardship Awards
101455315236687873,2011-08-11 00:50:07,Celebrating Tennessee farmers and the 25th anniversary of @PickTnProducts this evening at the Tennessee Residence http://t.co/qcxzDKJ
101415040606928896,2011-08-10 22:10:04,Education forum this morning at West End Middle with @ArneDuncan et. al. - here's a quick video with some highlights: http://bit.ly/mQcV7G
101312351080423425,2011-08-10 15:22:01,"Joining U.S. Ed. Sec @ArneDuncan, Comm. Huffman, Chris Barbic, @JamieWoodson, Gera Summerford & others at West End Middle to discuss #TNedu"
101016156944605185,2011-08-09 19:45:03,"Encouraged by the progress we've made in #TNedu reform - TBR's video, ""Truth For A Change,"" focuses on the movement: http://bit.ly/nwXOAZ"
100959075151511552,2011-08-09 15:58:13,"Honored to be named vice chair of the National Governors Association Education, Early Childhood and Workforce Committee #tnedu #tngov"
98060069186453504,2011-08-01 15:58:37,The 58th Annual Governor’s Conference on Economic and Community Development is right around the corner:  http://1.usa.gov/o7Kvjc #Jobs4TN
96684795383382016,2011-07-28 20:53:46,Met with some great teachers over lunch today in Lebanon. A lot of feedback around evals. - look forward to continuing the dialogue! #TNedu
96595186787946497,2011-07-28 14:57:41,Just posted: photos from yesterday's various West TN events - http://bit.ly/pAD88t
96289549185060864,2011-07-27 18:43:12,En route to Henderson City Hall for a TDOT Enhancement Grant Announcement at 2:00p #tngov
95854983286767616,2011-07-26 13:56:23,Enjoyed welcoming the Sustaining Military Readiness Conf. to Nashville - military communities have a significant impact on our great state
95583992056778752,2011-07-25 19:59:34,TN awarded a $1 million grant by Complete College America and the Bill & Melinda Gates Foundation - appreciate the investment & support!
94418495432966144,2011-07-22 14:48:18,Just posted: photos from yesterday's Downtown Memphis Commission Luncheon #DMC11 http://bit.ly/qbsqc2
94164552622673920,2011-07-21 21:59:13,"Great day in Memphis: Center City Commission Luncheon #DMC11 & Whitehaven DL Center opening - If TN is to succeed, Memphis needs to succeed!"
94140978801283072,2011-07-21 20:25:33,"RT @CrissyHaslam: I had so much fun reading with the kids at The Henry Center in Harriman, TN! http://t.co/IJQyQ8e"
94053537662767104,2011-07-21 14:38:05,Enjoyed calling in to @DrakeandZeke this morning and really looking forward to spending the rest of the day in West TN... #TNgov
93364143838605312,2011-07-19 16:58:41,"Spoke at #SLCMemphis this morning - Regardless of what happens in Washington, states are committed to making the hard decisions. #TNgov"
92971362016169984,2011-07-18 14:57:54,MT @lipscomb: @crissyhaslam will be joining @billfrist & @lipscomb's College of Educ. for a summit on rural education. http://bit.ly/r7Y67M
91623760729341952,2011-07-14 21:43:01,"thanks Ron, got any advice? "" @RonRamsey: Looking forward to welcoming Gov. @BillHaslam to the grandaddy club: http://j.mp/q8bPq9 """
91603303716225024,2011-07-14 20:21:44,Really enjoyed traveling our great state the last couple of days- here's a collection of photos from yesterday's stops: http://bit.ly/ogGEMl
91530647528669184,2011-07-14 15:33:01,Great stop this morning at the Clayton Shoe Store in Tullahoma for a TDOT Enhancement Grant Announcement for Coffee Co. http://bit.ly/omgfgw
91158127369658368,2011-07-13 14:52:45,"Museum of Scott Co. is an impressive place and well worth the visit - built, run and maintained by Scott Co. students - http://bit.ly/qqBjJg"
91151534787788801,2011-07-13 14:26:34,RT @SecTreHargett: World Book Encyclopedia Available Through Tennessee Electronic Library http://tnsos.org/Press/story.php?item=287
91144430995783680,2011-07-13 13:58:20,"Busy morning in East TN- breakfast with Sen. Baker, Rep. Keisling & Sen. Yager, stopped by the Museum of Scott Co. & now headed to Oak Ridge"
90795239857586176,2011-07-12 14:50:46,Great to see @TNCareerCoach making a difference across the state  |  Job seekers find help at mobile center: http://bit.ly/olZeVX
90536007744749568,2011-07-11 21:40:40,Over 50 new photos of recent department visits and events just posted to Flickr: http://bit.ly/p7oM9x
88611319992950784,2011-07-06 14:12:39,"Watch the latest ""Governor's Update"" and share your thoughts: http://t.co/j5RXRKz #Jobs4TN #TNgov"
88609699406168064,2011-07-06 14:06:13,RT @investtennessee : View pics from today's Startup Tennessee anncmt on ECD's Flickr site: http://t.co/kb0F2N1 #StartupTennessee
87910701120749568,2011-07-04 15:48:39,Crissy and I wish everyone a very happy 4th of July on this 235th anniversary of our independence!
86519568872386560,2011-06-30 19:40:47,"Enjoyed visiting with the great folks at the TN Department of Intellectual & Developmental Disabilities - they really are ""All About People"""
86177137098366976,2011-06-29 21:00:05,"Extremely pleased to hear that DLH Industries will be locating its newest manufacturing facility in Bristol, TN #Jobs4TN"
85756097067102209,2011-06-28 17:07:01,Great event launching #StartupTN at Nashville's @EntreCenter with Comm. Hagerty - Startups are an important generator of new jobs - #Jobs4TN
85440177627086848,2011-06-27 20:11:40,"RT @investtennessee: Hemlock - Construction Workforce Tops 1,600 at Clarksville, Tenn. Site: http://bit.ly/jXATzH #Jobs4TN"
85390810023079936,2011-06-27 16:55:30,Looking forward to visiting the hard working men and women of the @TNTDOC1 early this afternoon #TNgov
83977383408967681,2011-06-23 19:19:03,Truly appreciate everyone's involvement here and across the web - civic engagement is critical to a healthy democracy. http://bit.ly/mrOECy
83910733322125312,2011-06-23 14:54:12,Enjoyed stopping by the TN Digital Gov. Summit – great to see so many engaged in improving gov. & processes through technology #GovTech
83551530275450880,2011-06-22 15:06:51,"RT @investtennessee: Commissioner, Rutherford County Officials Welcome Auto Supplier to Rutherford County: http://bit.ly/iyH6qm #Jobs4TN"
83301947737780225,2011-06-21 22:35:06,RT @CrissyHaslam: Lots of great work done on behalf of seniors at the Aging Summit today at Lipscomb University. Glad I was able to part ...
83247172925140992,2011-06-21 18:57:27,"RT @CrissyHaslam: Enjoyed speaking to members of Fifty Forward and learning about the FLIP program, where members volunteer to read with ..."
83223598298443777,2011-06-21 17:23:46,RT @RonRamsey: Signing the Hall tax cut with @billhaslam & @speakerharwell. Unified GOP govt cuts taxes for seniors.
83174108166230017,2011-06-21 14:07:07,#AgingSummit @Lipscomb today is a great opportunity to bring experts together to discuss ways that we can better care for our seniors #tngov
83159990789095424,2011-06-21 13:11:01,Heading to the Governor's Summit on Aging at Lipscomb - senior citizens are an incredibly valuable asset to our communities #AgingSummit
82838742729109504,2011-06-20 15:54:29,Honored to announce Barry Staubus as the next Sullivan County District Attorney General: http://bit.ly/jiVqZt #TNgov
81845550646956033,2011-06-17 22:07:54,A couple of great events today: opening session of the TN VFW State Convention & the TN Women's Hall of Fame Awards - http://bit.ly/jC9gwk
81434152720801792,2011-06-16 18:53:09,Proud to sign this year's budget. During difficult times it's great to have strong bipartisan support. #tngov  http://t.co/7MfgDon
81390127280160768,2011-06-16 15:58:13,The Tennessee Civil Justice Act is now law- helps us attract and retain jobs while offering businesses more predictability. #Jobs4TN #TNgov
81087139516919809,2011-06-15 19:54:15,Our progress in #TNedu reform continues: the cap on charter schools has been lifted & enrollment opened 2 more students http://bit.ly/lsa2yE
81031451906293760,2011-06-15 16:12:58,RT @CrissyHaslam: Bill and I are wearing purple today to commemorate Elder Abuse Awareness Day! http://twitpic.com/5bxxqs
80724593878376448,2011-06-14 19:53:37,"The latest ""Governor's Update"" covers a couple of extremely important bill signings and my Health & Wellness Task Force http://bit.ly/lmqek0"
80348128003362816,2011-06-13 18:57:41,RT @CrissyHaslam: I'm excited to share my first video to review what we've been doing lately to help improve literacy! http://t.co/3pqStJd
80336341476442112,2011-06-13 18:10:51,With Gov. @BobMcDonnell & Gov. @HaleyBarbour discussing manufacturing market in the U.S.. Discussed my #Jobs4TN plan &  our INCITE program
79514972840927232,2011-06-11 11:47:01,"Excited about the Harpeth River Ride w/ Nissan execs, @LanceArmstrong and a lot of great riders - starts in a few mins. - Good luck to all!"
79293284660424704,2011-06-10 21:06:06,Looking forward to the 2011 @HarpethBikeClub Harpeth River Ride tomorrow morning - hope to see some of you all there!
79211296431669248,2011-06-10 15:40:19,RT @walkbikenash: Congrats to @harpethbikeclub on the success of selling out the Harpeth River Ride tomorrow! @lancearmstrong and @BillH ...
79197563487657984,2011-06-10 14:45:45,"RT @bfrist: #Health, #jobs, #economy, & #education all linked tightly together in #TN .. @BillHaslam & my message yesterday http://bit.l ..."
78868864615714816,2011-06-09 16:59:37,"Extremely happy to welcome @IQT_Inc and 900 technically focused, good paying jobs to our state capital - #Jobs4TN #TNgov"
78492029713252352,2011-06-08 16:02:12,Signed HB 2010/SB 1529 into law a few minutes ago @MTSU - will allow students to use the HOPE Scholarship for summer courses #TNedu #TNgov
78459655747145728,2011-06-08 13:53:34,RT @RepChuck: I am hosting FRED the Show on 102.3 in #CHA today from 10-12. We will have @BillHaslam on in the 1st hr. Tune in! http://b ...
77779706669301760,2011-06-06 16:51:41,SB 1265/HB 1051 is now law - helps us confront Tennessee’s meth problem head on: http://bit.ly/jLxiyC #TNgov
76679605343363074,2011-06-03 16:00:17,"just in beautiful Kodak , TN for the Lisega grand opening - one of 67 German companies in TN & will mean 200 more jobs over time #Jobs4TN"
76408113196048384,2011-06-02 22:01:28,Visited with employees at the Dept. of Agriculture earlier — Ag. production generates &gt;$2.8B in cash receipts/yr. http://bit.ly/mHf1CS
76387188245413888,2011-06-02 20:38:19,"MT @score4schools: SCORE CEO @Jamiewoodson 2 speak on #edreform w/ US Ed Sec @ArneDuncan, Gov @BillHaslam & Kevin Huffman http://ow.ly/58TeM"
75984984632066048,2011-06-01 18:00:06,RT @RonRamsey: Happy Statehood Day! Tennessee became the 16th state on this day in 1796. http://j.mp/jyZGcm #tngov
75974466810810368,2011-06-01 17:18:19,Just signed HB2156 - extends the period of eligibility for unemployment compensation benefits. #tngov
75638703900471296,2011-05-31 19:04:06,@CrissyHaslam and I really enjoyed the chance to visit and speak with Volunteer Girls State attendees earlier today at Lipscomb! #tngov
73855268869513216,2011-05-26 20:57:22,Photos from the Memorial Day Observance Ceremonies at the State Capitol: http://bit.ly/jpcBM9
73494605315833856,2011-05-25 21:04:14,Here's a great video wrap-up by @InvestTennessee: Volkswagen Chattanooga Grand Opening: http://youtu.be/euNfLO_OrI8 #Jobs4TN
73395489525084160,2011-05-25 14:30:22,Photos from yesterday's @VW @VWGoA grand opening in Chattanooga: http://bit.ly/jWqdef #Jobs4TN
73124556101005312,2011-05-24 20:33:47,"Congrats to @VW on the grand opening of their #CHA facility -- perfect example of local, state, & federal gov. working together. #Jobs4TN"
72730627107069952,2011-05-23 18:28:27,Great day in West TN today - Megasite board meeting for an update on the project & the Dunavant Public Service Awards in Memphis #Jobs4TN
72050298679603200,2011-05-21 21:25:04,Extremely proud of what we've accomplished this session & truly appreciate the General Assembly's support http://bit.ly/ikSGvx #TNgov #TNedu
71982763410063360,2011-05-21 16:56:42,Passage of HB 1989/SB 1523 eliminates charter school caps and expands enrollment opportunities for students: http://bit.ly/issamm #TNedu
71674946140647424,2011-05-20 20:33:33,"As we push for more college graduates in TN, passage of HB 2010/SB 1529 allows HOPE scholarship funds to be applied to summer school. #TNedu"
71606105314308096,2011-05-20 16:00:00,Final passage of the Tennessee Civil Justice Act will help bring predictability and certainty to businesses - http://bit.ly/kLf9wy #Jobs4TN
71590208277196800,2011-05-20 14:56:50,Back in Nashville after great welcome home ceremony at Ft Campbell- truly appreciate the sacrifice our troops make in the defense of freedom
71305058788184064,2011-05-19 20:03:45,RT @CrissyHaslam: Thanks to Red Bank Elementary in Chattanooga for their warm welcome and hard work toward improving literacy rates in o ...
71247363469094912,2011-05-19 16:14:29,Looking forward to speaking @CNMMidTN Bridge to Excellence Conf. @BelmontUniv this afternoon. Nonprofits do important work in TN! #cnmbridge
70936042018050048,2011-05-18 19:37:25,Key for job creation: MT @RonRamsey: Working to make sure TN stays income tax-free -- forever. SJR221 passes third & final reading. #Jobs4TN
70883246543605761,2011-05-18 16:07:37,RT @CrissyHaslam: Really enjoyed my time in West Tennessee yesterday! Northwest Elem. and Hamilton Elem. pledged to READ 20 minutes ever ...
70579064196440064,2011-05-17 19:58:54,"RT @investtennessee: Gov @BillHaslam, Comm Hagerty Announce Windham Professionals to Build New Regional Corporate HQ in Hendersonville:  ..."
70489499460833280,2011-05-17 14:03:00,"Heading up to Springfield, TN with Commissioner Huffman for an Educator Roundtable at Krisle Elementary School #TNedu"
70244641731121152,2011-05-16 21:50:02,"RT @wbir: Crissy Haslam helps to launch ""Read with your Child"" program http://bit.ly/leiItV"
