id,created_at,text
8287983506,2010-01-27 18:06:21,"To learn more about the brave Florida law enforcement we honored today, visit www.myfloridalegal.com."
8282900008,2010-01-27 15:28:54,"Encouraged by the growing momentum for our agenda, but the only poll that matters is on Election Day: http://bit.ly/9TJ0ez"
8207422673,2010-01-25 21:22:05,Thank you to the Florida Federation of College Republicans for their support in this past weekend’s straw poll: http://bit.ly/5iEIPO.
8130832684,2010-01-24 01:06:16,"Final Score: UF: 58, South Carolina: 56 – an incredible finish to a great game tonight at the O'Connell Center. Go Gators!"
8121740893,2010-01-23 19:53:14,Had a great afternoon with members of the Florida Dental Association and now headed to see UF take on the South Carolina basketball team.
8077774041,2010-01-22 17:41:23,Job creation must be our top priority: http://bit.ly/7WQYNN.
8002652263,2010-01-20 22:35:06,"I enjoyed meeting with the Associated Builders & Contractors of Florida earlier today, and I thank them for their endorsement and support."
7970924893,2010-01-20 02:42:28,Congratulations to Senator-Elect Scott Brown on a well executed campaign and a tremendous victory: http://bit.ly/88UHkt.
7962099945,2010-01-19 22:25:06,FOX NEWS: Florida Attorney General Threatens Lawsuit Against Health Care Mandate: http://bit.ly/5KSBmF ~ staff
7907394840,2010-01-18 15:28:33,"Enjoyed joining the Central FL YMCA and Orlando Jaycees at the 19th annual Arthur ""Pappy"" Kennedy Prayer Breakfast in honor of Dr. King."
7765804510,2010-01-14 23:25:44,"To learn more about the Florida Crisis Response Team members assisting Florida's Haitian communities, visit www.myfloridalegal.com."
7717809345,2010-01-13 18:48:21,"Our thoughts and prayers are with the people of Haiti following yesterday's devastating earthquake. To help, visit www.redcross.org."
7696225802,2010-01-13 03:55:33,"I'm in Gainesville at the Gators' SEC home opener against the Kentucky Wildcats, where this basketball game is coming down to the wire."
7635863155,2010-01-11 17:08:41,"Today, I joined the Florida Police Chiefs Association in honoring Clearwater Chief Sid Klein for his extraordinary service to our state."
7481673328,2010-01-07 15:18:50,AP: Bill McCollum raised more than Democratic Chief Financial Officer Alex Sink in the last quarter of 2009: http://bit.ly/7PQHCZ  ~ staff
7454700331,2010-01-06 21:41:12,I enjoyed the grand opening of Embry-Riddle University’s new Orlando Metro campus – a great opportunity for new job growth in the area.
7236625516,2009-12-31 15:15:21,Wishing you and your families a happy and peaceful New Year. Also wishing Stanford's #70 Bert McBride good luck in today's Sun Bowl.
7209072153,2009-12-30 21:17:28,Heritage: McCollum requested that state Attorney Generals join him in “a full review of the individual mandate.” http://bit.ly/5eHyYL ~staff
7201810362,2009-12-30 17:10:50,Take a moment to view Bill McCollum's FOX & Friends interview on his review of federal health care legislation: http://bit.ly/68cpDf ~staff
7193858114,2009-12-30 11:55:22,I’ll join FOX & Friends live at 7:45 am to discuss Florida’s review of the constitutionality of federal health care legislation.
7174063235,2009-12-29 22:28:25,Today I asked all state Attys General to join me in reviewing the constitutionality of the federal health care bill's individual mandate.
6900234269,2009-12-21 17:51:51,"At 5:00 pm, I'm joining guest host Karna Bodman on WGUF's ""The Dave Elliott Show."" If you live in Naples, tune into 98.9 FM this afternoon."
6607977956,2009-12-12 20:11:50,"Enjoyed meeting with the great folks of ABATE.  As Governor, I will work with them to make our streets safer for bikers."
6603225646,2009-12-12 16:50:21,Heading to speak to ABATE - a great group of American bikers. I'm proud Florida is one state that has seen a drop in motorcycle deaths.
6578239305,2009-12-11 20:46:55,Statement by Bill McCollum on the Commencement of Hanukkah: http://bit.ly/64D9Wu
6466901855,2009-12-08 15:56:26,"If you live in the Tallahassee area, be sure to RSVP for Breakfast w/Bill http://bit.ly/6cUktu"
6442521986,2009-12-07 21:34:49,Remember those who fell at Pearl Harbor in the name of freedom. We owe our veterans a tremendous debt and must never forget their sacrifices
6435301775,2009-12-07 16:43:15,Pleased the House has moved swiftly in support of SunRail and thousands of jobs in Florida. Optimistic the Senate will follow suit.
6377091571,2009-12-05 19:21:16,Getting ready for the SEC Championship Game...Go Gators!
6345859939,2009-12-04 18:58:01,Senator Paula Hawkins was a lifelong friend to me and Ingrid. Florida has lost an outstanding public servant.
6319805653,2009-12-03 23:59:33,Rep. Schenck agrees with AG McCollum: keep politics out of the pension fund http://bit.ly/5RoSuo
6273866604,2009-12-02 16:34:21,"Great to be with my friends at TaxWatch this morning, as they continue their important work for our state."
6272221158,2009-12-02 15:34:02,Check out this Bradenton Herald article about yesterday's Breakfast w/Bill event: http://bit.ly/7B3uns
6144818928,2009-11-28 16:39:19,Good to see ESPN College GameDay is in The Swamp.  Go Gators!
6142781954,2009-11-28 15:06:25,If you live in the Manatee/Sarasota area be sure to RSVP for Breakfast with Bill http://bit.ly/59hMSI
6052049922,2009-11-25 15:18:20,I wish you and yours a Happy Thanksgiving and look forward to working with you in the year ahead. http://bit.ly/5urvtR #iamthankfulfor
6035866263,2009-11-25 01:16:42,Proudly signed my support to a brief urging the SCOTUS to preserve our Constitutional right to keep and bear arms. #sayfie #Bill2010 #nra
5870753986,2009-11-19 22:20:54,Back in FL after attending a great Republican Governors Association Annual Meeting out in Texas. #the_RGA
5805970509,2009-11-17 20:53:53,Grateful for the support of the Fraternal Order of Police. http://bit.ly/2HR3RQ
5773757110,2009-11-16 19:45:57,Another successful launch for the Space shuttle Atlantis- an awesome sight indeed.  Wishing the crew a successful mission and safe return.
5722914380,2009-11-15 00:32:43,Looking forward to a great game of Lightning hockey with my good friend Sen Pres Pro Tem Mike Fasano.
5655823568,2009-11-12 18:27:02,"Support the Campaign at the Orange County REC Hob Nob on Thursday, Nov. 12! Click here for more info: http://bit.ly/3yXed2"
5623472421,2009-11-11 16:57:22,Celebrating Veterans Day in Tampa. Thank you to the many veterans around our great nation for your service and sacrifice.
5602453219,2009-11-10 23:08:33,"As a retired JAG Corps officer, I'd like to wish a Happy 234th Birthday to the Marine Corps!"
5597524774,2009-11-10 19:53:25,At the Tampa EOC getting briefed by Director Almaguer about TS Ida; so glad our state was not heavily damaged and people are safe.
5565742605,2009-11-09 18:50:22,Scammers are active before and after storms. Report any price gouging to my office: 1-866-9-NO-SCAM. Stay safe ahead of Ida!
5487498698,2009-11-06 20:02:04,My heart goes out to the victims of the terrible tragedy in Orlando; keeping them and their loved ones in my thoughts and prayers.
5461330612,2009-11-05 22:04:03,ARDA commends FL Attorney General's Office for investigation into fraudulent timeshare resale operation http://bit.ly/Pxyhk
5424420567,2009-11-04 16:47:49,Congratulations to @bobmcdonnell and @christiefornj for their incredible wins in VA and NJ.
5393833687,2009-11-03 15:32:33,I am honored that Governor Jeb Bush supports me for Florida Governor! http://bit.ly/2AYHqd
5368463101,2009-11-02 17:46:54,"Proud to annouce ""Women for McCollum,"" led by Carolyn Booth, Toni Jennings, and Sharon Day - I am honored to have your support!"
5314107518,2009-10-31 14:06:31,Wishing everyone a safe and happy Halloween!
5275984466,2009-10-30 01:46:09,Great to be with our Florida Farm Bureau leaders and Commissioner Bronson tonight at annual meeting.  Humbled by the warm welcome.
5262530936,2009-10-29 16:19:51,McCollum Announces County Political Leadership Teams-- Dynamic Team of 378 Florida Leaders Unite Behind McCollum http://bit.ly/3DSVDf
5243995901,2009-10-28 23:31:16,Had a great tour of the Ocoee Employee/Family Health Center in Central Florida today - helps city employees and also saves $$ for local gov!
5210728916,2009-10-27 20:56:50,“Florida Leads Multistate Settlement with Student Loan Provider” http://bit.ly/3OFQ0v $17 million in loans forgiven for Florida students
5125485935,2009-10-24 16:14:26,Wishing everyone a great weekend! Go Gators!
5080087463,2009-10-22 21:38:28,"The CyberSafety Education Program has been presented to over 482,000 students in 1,000 schools! http://tinyurl.com/yhs2kpr"
5069701771,2009-10-22 14:00:45,New @RasmussenPoll: Florida Governor 2010: McCollum (R) 46% Sink (D) 35%
5049633169,2009-10-21 18:50:47,Attending Republican Jewish Coalition dinner tonight in Boca Raton; looking forward to seeing former WH Press Secretary Ari Fleischer
4976873959,2009-10-18 23:11:49,I hope everyone had a good weekend.
4948444214,2009-10-17 18:58:00,Tailgating with friends. Look around for fans wearing Gators for McCollum stickers.
4925059728,2009-10-16 20:24:02,I'm headed to Gainesville with Ingrid. We are looking forward to Gator Growl and Homecoming.
4918154869,2009-10-16 15:26:14,Attending a Boy Scouts of America luncheon in Orlando w/ Rep Dean Cannon. 100th Anniversary of the BSA next year!
4900140274,2009-10-15 22:23:08,"Great meeting with TurboCombustor Technology in Stuart w/ @joenegronfl.  Job creation, local partnerships, talent, small biz success story."
4871884188,2009-10-14 21:15:30,New @FLChamber poll shows Bill McCollum with a 7 point lead over Dem opponent in for Florida Governor! Thank you the continued support!
4862146111,2009-10-14 13:52:32,Just told Florida's business leaders I oppose union-supported card check and asked Alex Sink to join me - will she?
4848324776,2009-10-13 23:55:31,"""It all comes down to friendship, treating people right. "" - Ernie Banks"
4822048139,2009-10-13 00:32:51,Heading home for the evening. I'm hoping to catch some of the Phillies/Rockies game and maybe the Dolphins on Monday Night Football.
4760174232,2009-10-10 13:29:13,I’m speaking at the Police Benevolent Association meeting today.
4692689442,2009-10-07 21:39:51,"As we look to the final months of 09, we want to thank you for your support, and dedication of time, talent & resources."
4680685822,2009-10-07 12:16:47,I'm looking forward to the MLB Playoffs starting today. Who are you rooting for?
4606566028,2009-10-04 17:05:53,I think it is great that the NFL is wearing pink for Breast Cancer Awareness.
4506457568,2009-09-30 20:36:01,Our fundraising quarter ends at MIDNIGHT! Please click on the link below to get involved with the campaign: http://bit.ly/qCR8Z
4394035754,2009-09-26 14:19:00,Go Gators! Beat Kentucky!
4367432408,2009-09-25 12:49:43,"Baseball is a red-blooded sport for red-blooded men... It's a struggle for supremacy, a survival of the fittest. - Ty Cobb"
4351940763,2009-09-24 21:30:43,"Headed to Jacksonville, the largest city in Florida."
4319534498,2009-09-23 16:49:11,Our fundraising quarter ends in ONE WEEK on SEPT. 30!  Please click on the link below to get involved with the campaign: http://bit.ly/qCR8Z
4111832329,2009-09-19 22:50:24,That was a great game by Florida.
4104386377,2009-09-19 15:52:10,All I have to say is GO GATORS!  Headed to Gainesville shortly.
4019294738,2009-09-16 01:44:53,I just spoke with John Thrasher and congratulated him on winning the SD8 Special Election this evening.
3991197774,2009-09-14 23:13:48,Still impressed after the #FFRW meeting.  Ingrid gave out over 200 bumper stickers.  Thanks for the support!
3956437478,2009-09-13 15:51:49,I hope everyone is enjoying their weekend.
3910321081,2009-09-11 12:53:00,"God Bless America. ""Where Were You When the World Stopped Turning?"" Dedicated to the victims and heros of 9-11. http://bit.ly/16wYEx"
3896388838,2009-09-10 21:21:32,Don't forget 2 things I'm going to tell you. 1 don't believe everything that's written about you. 2 don't pick up too many checks. Babe Ruth
3873563054,2009-09-09 22:44:09,"McCollum, candidate for governor, opposes a government-run `public option' for health insurance. http://bit.ly/2tiY5"
3818429530,2009-09-07 13:42:10,"Happy Labor Day.  As we celebrate the end of summer, please take time today to honor the working families across this nation."
3779310214,2009-09-05 14:28:43,I'm looking forward to some great college football today. Go Gators!
3746612777,2009-09-04 01:09:41,Here is a brief video of a recent campaign appearance in Orlando:http://bit.ly/1b4Cf2
3732449317,2009-09-03 12:23:27,"""Finding good players is easy. Getting them to play as a team is another story. "" - Casey Stengel"
3720681345,2009-09-02 22:39:54,"Be sure to sign up for campaign updates, connect, and get involved! http://bit.ly/12OT7L"
3720675999,2009-09-02 22:39:36,"Be sure to sign up for campaign updates, connect, and get involved! http://bit.ly/H6auu http://bit.ly/BVEDO"
3613388665,2009-08-28 22:55:39,Almost to Destin. I've got a busy weekend. Lots of travel around the state.
3577919524,2009-08-27 12:12:47,"""Defense to me is the key to playing baseball."" - Willie Mays"
3568205848,2009-08-27 00:20:33,I'd like to thank Chairman Maggard and the Pasco REC for their endorsement for my campaign for Governor.
3566563656,2009-08-26 22:51:50,"Today is Women's Equality Day, celebrating the 19th Amendment- allowing women the right to vote."
3499743080,2009-08-23 22:11:48,Thanks to everyone who made this a great weekend at the RPOF Quarterly and Statesman's Dinner.
3448493572,2009-08-21 12:14:23,I'm looking forward to seeing the grassroots leaders of the RPOF at the Quarterly Meeting and Statesman's Dinner this weekend.
3403371096,2009-08-19 11:27:26,"""Stubbornness is usually considered a negative, but I think that trait has been a positive for me."" - Cal Ripken Jr."
3393644019,2009-08-18 23:44:36,A poll released by Florida Chamber shows our campaign Leads by 9. Join us in working for a stronger & safer Florida http://bit.ly/qCR8Z
3373115832,2009-08-18 01:05:58,I'd like to take this opportunity to thank everyone for the show of support after the poll released earlier today.
3360387147,2009-08-17 12:04:03,Please be sure you are prepared for the current and coming storms and hurricanes.
3346555599,2009-08-16 17:04:51,Finished up yard work.
3335906713,2009-08-15 23:47:17,Enjoying time with Ingrid at the Orange County REC picnic.
3318703879,2009-08-15 00:09:37,Heading out to watch some football- looking forward to Rams v. Jets. It's exciting to know football season is right around the corner.
3274283346,2009-08-12 22:19:59,This is an interesting site. It creates a graph of your social media network: http://bit.ly/egKHv
3143608191,2009-08-05 11:21:42,Congratulations to @joenegronfl for winning the Special Election in Florida Senate District 28.
3123581528,2009-08-04 12:51:01,Be sure to vote for @joenegronfl in the Special Election help today in Florida Senate District 28.
3122763353,2009-08-04 11:32:34,"""Any time you think you have the game conquered, the game will turn around and punch you right in the nose. "" - Mike Schmidt"
3102771538,2009-08-03 11:37:35,"I'm just a ballplayer with one ambition, & that is to give all I've got to help my ball club win. I've never played any other way. -DiMaggio"
3096667661,2009-08-03 02:19:38,I hope everyone had a wonderful weekend.
3059690640,2009-07-31 22:33:33,Completed an interview with the Ocala Star-Banner. Spoke with them about the accomplishments of the AG's office and the Governor's race.
3058360739,2009-07-31 21:12:10,Ingrid and I just got to the Holiday Inn in Ocala.  We are looking forward to this evenings Marion Co REC Lincoln-Reagan Dinner.
2949849891,2009-07-31 12:02:46,"""There are three things you can do in a baseball game. You can win, or you can lose, or it can rain."" - Casey Stengel"
2912595992,2009-07-29 16:50:28,Today my campaign announced the Statewide Campaign Leadership structure. http://tiny.cc/XSMbz
2899373513,2009-07-28 23:30:45,"""It's a great day for a ball game. Let's play two! "" - Ernie Banks"
2888534209,2009-07-28 11:43:58,Thank you to everyone for supporting me in this online poll: http://tw8.us/wr
2839736592,2009-07-25 17:10:49,On the road en route to speak with the Florida Medical Association. Looking forward to hearing their thoughts and ideas.
2826557732,2009-07-24 21:45:50,The Great American Game should be an unrelenting war of nerves. - Ty Cobb
2817241973,2009-07-24 12:05:41,"Congratulations to Mark Buehrle on pitching a perfect game yesterday- 18th perfect game in MLB history. As a baseball fan, exciting to see."
2806323789,2009-07-23 21:47:44,En route to Sarasota.
2796383730,2009-07-23 11:04:33,It's a great day to be a Floridian.
2787312251,2009-07-22 23:04:51,"Finishing up a good day. I did Hispanic radio in Miami this AM, visited the Miami Children's Hospital and attended an adoption ceremony."
2745724818,2009-07-20 21:19:55,Today marks the 40th Anniversary of the first lunar landing & moonwalk by American hero Neil Armstrong! http://bit.ly/pIuV7 #NASA #Apollo11
2738105925,2009-07-20 12:57:07,"An American is one who will sacrifice property, ease, and security in order he and his children may retain the rights of free men. -Ikes"
2731254220,2009-07-20 02:01:03,RT @espn: San Francisco Giants majority owner Sue Burns dies - http://tinyurl.com/mn5fow
2710565296,2009-07-18 19:43:46,He serves his party best who serves the country best. -Rutherford B. Hayes
2706232085,2009-07-18 13:49:30,Driving to Tampa to meet with @HCRPChairman and Hillsborough REC Members. These leaders will help lead the way to Victory in 2010.
2695986838,2009-07-17 21:45:19,Thank you for the Follow Friday support. @IRSmidt @ksalerno @GOPMichael @StephanieSteele @HeathWhiteaker @mikegrissom #FF #FollowFriday
2687619923,2009-07-17 12:49:37,We are up and running with text messages.  Text: Bill2010 to 24453 to get updates from the campaign
2668940445,2009-07-16 12:49:59,Who loves his country cannot hate mankind. -- Charles Churchill
2650155671,2009-07-15 12:33:08,Congratulations to Carl Crawford of the Tampa Bay Rays on winning the All Star Game MVP Award.
2650017031,2009-07-15 12:19:53,Congratulations to the American League after their All-Star Game win. The A.L.'s recent streak is 12-0-1.
2640015456,2009-07-14 22:13:02,Hitting is the most important part of the game. It is where the big money is where much of the status is & the fan interest.  - Ted Williams
2622055310,2009-07-13 22:50:22,"Those who expect to reap the blessings of freedom must, like men, undergo the fatigue of supporting it.  --Thomas Paine"
2613335492,2009-07-13 12:33:35,I appreciate all of the birthday wishes. Thank you very much.
2602978117,2009-07-12 20:18:25,The crowd makes the ballgame. - Ty Cobb
2588140608,2009-07-11 20:06:58,Thanks for the #followfriday @vivskivs @E_Wall @HeathWhiteaker
2587154245,2009-07-11 18:46:39,@DavidAll Thanks for the follow.  Check out the campaign's website: http://www.billmccollum.com/
2585953331,2009-07-11 17:06:53,"Those who expect to reap the blessings of freedom must, like men, undergo the fatigue of supporting it. -Thomas Paine"
2585021212,2009-07-11 15:50:03,@RustyKeeble Thanks for your support.
2584796318,2009-07-11 15:30:27,We're half way through the year & I believe what we do TODAY will set the  campaign's tone. There are many to get involved http://tw8.us/YF
2567710884,2009-07-10 13:12:31,"But what is Freedom? Rightly understood, A universal license to be good.  
--Hartley Coleridge"
2560984861,2009-07-10 02:04:31,I hope you have a wonderful birthday @MHudson101
2549690995,2009-07-09 12:59:41,"Those who deny freedom to others deserve it not for themselves, and, under a just God, cannot long retain it.  --President Abraham Lincoln"
2531755909,2009-07-08 12:52:13,The men who succeed best in public life are those who take the risk of standing by their own convictions.  --James Garfield
2513396082,2009-07-07 12:52:34,"Nearly all men can stand adversity, but if you want to test a man's character, give him power.  -- Abraham Lincoln"
2468456690,2009-07-04 12:10:05,"On Independence Day, as we celebrate our nation's birthday I hope we take time to keep our friends in the armed services in our thoughts."
2454041153,2009-07-03 13:58:13,"A man who is good enough to shed his blood for the country is good enough to be given a square deal afterwards. 
 - Theodore Roosevelt"
2441647309,2009-07-02 19:12:22,"I have over 1,500 followers. Still hoping to get to 1776 by July 4 in honor of Independence Day."
2435857158,2009-07-02 12:00:27,@SarahFowler Thank you for the reminder.  Don't forget to check out my facebook page: http://www.facebook.com/Bill.McCollum
2429875254,2009-07-02 01:38:46,Don't forget to check out my facebook page: www.facebook.com/Bill.McCollum
2429277416,2009-07-02 00:55:24,"RT @JustinSayfie @congbillposey @NASA 4th of July weekend, great view of space station. Find when it passes over your city http://tr.im/qvQM"
2426530668,2009-07-01 21:31:04,In honor of Independence Day my goal is to have 1776 followers by 4th of July.
2413178953,2009-07-01 01:31:39,Had a great event with Gov Jeb Bush tonight in Miami. Amazing turnout! Can you help put us over the top by 12 AM TONIGHT: http://is.gd/1cvCU
2410733948,2009-06-30 22:23:19,"If elected I'll focus on the econ, keeping taxes down, and public safety. Tonight will help set the campaign tone. http://bit.ly/NoiBG"
2409914213,2009-06-30 21:23:19,Only hours remain to make a stand for Florida!  The clock is winding down and I need your support by MIDNIGHT TONIGHT. http://is.gd/1cvCU
2406585504,2009-06-30 17:25:51,"Help Us Reach Our Goal! We're trying to hit our online fundraising goal of $10,000 by MIDNIGHT TONIGHT http://tinyurl.com/bill4gov"
2391148828,2009-06-29 18:24:19,"We're trying to raise $10,000 online by midnite on Tues. Will you help? http://tinyurl.com/bill4gov Please spread the word. #sayfie #TCOT"
2387837106,2009-06-29 14:15:53,"It's hard to ask for money during tough times, but I believe in our cause.  Can you give $25 to help us end the quarter: http://is.gd/1cvCU"
2359913243,2009-06-27 15:39:01,I'd like to welcome my friend Bob Starr (@rjstarrman) to twitter.
2358721920,2009-06-27 13:38:50,We have to work to keep our economy strong and fight to make sure our streets are safe. http://is.gd/1cvCU  Please RT! #TCOT #sayfie #legfl
2349848266,2009-06-26 21:01:46,Thanks for your support! @ksalerno @GOPMichael @proactivism @aaalex32 @natemeloon
2342726890,2009-06-26 11:52:25,"We need to create a better tomorrow for our state, nation, and the GOP. http://is.gd/1cvCU #TCOT #fltcot #sayfie #sgp #legfl"
2332121720,2009-06-25 21:01:33,"Florida needs a level-headed leader with vision, focus and tenacity. I am that leader: http://is.gd/1cvCU #TCOT #fltcot #legfl #sgp #sayfie"
2314593230,2009-06-24 19:02:16,495 days until Election Day 2010! Get involved with my campaign today.  http://tinyurl.com/2010survey
2295920413,2009-06-23 15:32:32,Get involved with my campaign.  Take this survey and tell me what you care about: http://tinyurl.com/2010survey
2286080562,2009-06-22 22:58:20,"I just finished making remarks to a great group of friends in the town I grew up in-- beautiful Brooksville, FL."
2283512375,2009-06-22 19:43:18,I want to hear from you.  Take this survey and tell me what issues are important to you: http://tinyurl.com/2010survey #Bill2010 #fltcot
2278452997,2009-06-22 13:01:55,@billmccollum got a grade of 95.9/100 on @grader.  Check it out:  http://twitter.grader.com/billmccollum
2270169891,2009-06-21 21:28:13,"As Father's Day comes to an end, I recall baseball, fishing & hiking with my 3 boys. I'm proud to be their father as they have grown to men."
2258077392,2009-06-20 22:21:03,Ingrid and I saw The Proposal last night. It is a very funny movie.
2254916619,2009-06-20 17:28:59,In and out of political meetings all day.
2239374165,2009-06-19 15:27:55,Just finished event advocating for the SBA to invest in Florida venture capital as a key way to increase economic growth.
2222230482,2009-06-18 13:41:14,Working on a video email to go out shortly from the campaign. Stay up to date here: http://www.billmccollum.com/get-involved/volunteer
2211413963,2009-06-17 19:49:32,Thanks for all the recent follows.  Please be sure to subscribe for updates on my site www.billmccollum.com #Bill2010 #fltcot #tcot
2195674643,2009-06-16 18:27:04,Florida GOP Congressional Members Endorse Bill McCollum for Governor http://tinyurl.com/nukssh
2193044406,2009-06-16 14:55:13,About to head to the Florida Police Chiefs Assoc meeting.  Looking forward to speaking with the brave men & women who keep our streets safe.
2172778183,2009-06-15 02:44:33,Congratulations to the NBA Champion L.A. Lakers. What a great and amazing season by the Orlando Magic.
2167929537,2009-06-14 19:03:43,"I'm a conservative who believes in values. When likeminded folks disagree, I believe in having degree of tolerance. http://is.gd/11PYC"
2166029263,2009-06-14 15:47:14,Heading back home after a great event. Driving through FL reminds me how beautiful this state is and why I'm running for Governor.
2160387074,2009-06-14 01:53:41,"Great evening in Miami, 400 GOPers at LDD for my speech. Looking forward to campaigning in the guayabera shirt given to me by @IRL & REC"
2156183851,2009-06-13 18:22:09,Ingrid is driving me to Miami.  I'm reviewing my notes for the Miami-Dade REC LDD speech. Should be a great evening.
2150044205,2009-06-13 04:03:55,Just set my facebook username!  Check it out: http://www.facebook.com/bill.mccollum
2124801903,2009-06-12 01:06:07,Amway Arena is absolutely electric. Let's go Magic!
