id,created_at,text
17872387833,2010-07-06 14:49:35,Talking high-tech job creation with Florida's own Turbocor.  #bill2010 #flgop #flgov  http://twitpic.com/22y2c3
17729524688,2010-07-04 16:06:59,Happy Birthday America!  Everyone please have a fun and safe holiday!
17520807139,2010-07-01 21:10:34,@BarackObama has once again missed the point on immigration reform -  http://bit.ly/9RNZxu #bill2010 #flgov #flgop #tcot #sayfie
17511643214,2010-07-01 18:21:20,"Proud to announce my initiative to recover taxpayer dollars, The Transparency in Private Attorney Contracting Act, goes into effect today"
17451985492,2010-07-01 00:14:01,Thanks @SouthFLTeaParty for the opportunity to speak!  #bill2010 #flgov #flgop #tcot #teaparty http://twitpic.com/21cspp
17440886887,2010-06-30 20:53:06,"I'm happy to announce the endorsement of pro-life, pro-family leader John Stemberger. http://bit.ly/9t2wBa"
17421727434,2010-06-30 15:24:04,When you get a chance check out my video interview with @THESHARKTANK1 http://bit.ly/bAaDG3 #bill2010 #flgov #flgop #tcot #sayfie
17418441272,2010-06-30 14:36:41,Thanks! @JoshCockrell Woke up to find my cat supporting the next Gov of FL @BillMcCollum! #gop #rpof #tcot http://tweetphoto.com/29976151
17297477862,2010-06-29 02:05:23,Thanks Broward REC for having me tonight! Great crowd and I appreciate the warm reception! #bill2010 #flgov  http://twitpic.com/20uwby
17286717001,2010-06-28 23:07:13,"@whatchawearing well thanks for the vote of confidence, let me know how I can earn your vote!"
17269839918,2010-06-28 18:18:46,Thanks! RT @Langata145 @BillMcCollum Check Bill's tweets and vote for him in FLA Gov. elections.  #bill2010 #flgov #flgop
17249213029,2010-06-28 12:57:24,Happy to announce the endorsement of @newtgingrich.  Look for him on the campaign trail with me in the coming weeks! #flgov #sayfie #tcot
17215281448,2010-06-28 02:06:42,"""Yard-signing"" from this afternoons remarks to the Pinellas Patriots! #bill2010 #flgov #flgop http://twitpic.com/20loux"
17203023787,2010-06-27 23:37:41,Thanks for having me! RT @SPGGOP Fls next Gov @BillMcCollum  speaking @ N. Pinellas HQ grand opening http://tweetphoto.com/29551913  #flgov
17180422146,2010-06-27 17:09:30,Make sure to follow me or my facebook page as we announce some big news tommorow!  http://bit.ly/acltXg #bill2010 #flgov #flgop #sayfie
17101338044,2010-06-26 16:08:49,Speaking to @floridamedical members in Tampa.  Thanks @fmapac for the endorsement!  #bill2010 #flgov #flgop  http://twitpic.com/205pyx
17093583649,2010-06-26 14:13:46,Earning votes the good way - one at a time on this beautiful Saturday morning!  #bill2010 #flgov #flgop  http://twitpic.com/204q17
17061630115,2010-06-26 02:36:40,Thank you for having me! RT @HCRPCHAIRMAN Thanks to all Our summer dinner series was a huge event! #tcot #flagov #rpof #hcrp
17058602285,2010-06-26 01:44:54,"@nicklulli not sure, but DM me with your email and staff will keep you posted!"
17058264632,2010-06-26 01:39:00,Just reached 7k fans on Facebook!  Will post some exciting news on Monday!  http://bit.ly/acltXg  #bill2010 #flgov #flgop #tcot
17055923188,2010-06-26 00:57:36,@nicklulli Hello - thanks for the follow!
17055422179,2010-06-26 00:48:25,Honored to speak at Hillsborough County Republican Dinner Series.  Standing ovation was great too! #flgov #flgop http://twitpic.com/1zyj3g
17021467675,2010-06-25 15:16:08,@FloridaAFP Thanks for the tweet!  More candidates should sign the www.NoClimateTax.com pledge!  #sayfie #tcot #flgov #flgop
17019950162,2010-06-25 14:55:45,On the set with Chris Chmura of WTVT FOX in Tampa - keep an eye out for the interview!  #flgov #flgop  http://twitpic.com/1ztz0h
16929420360,2010-06-24 13:34:10,Thank you @adamputnam for your endorsement!  http://bit.ly/dsdchP #bill2010 #flgov #flgop #tcot
16870054117,2010-06-23 19:01:06,"Check out my latest television ad, ""Profits Over Principle"" and let me know what you think! http://youtu.be/IKR-_eK0Y4A #flgov #bill2010"
16710463764,2010-06-21 17:52:26,Orlando Sentinel: McCollum ups the debate ante: http://bit.ly/dAeAXj ~staff
16699388251,2010-06-21 14:57:23,I am happy to have the endorsement of former House Maj. Leader and FreedomWorks Chairman Dick Armey. http://bit.ly/dyIhMY
16642263537,2010-06-20 20:21:56,"As families around the state gather to honor Dads, Ingrid and I wish all Florida fathers and grandfathers a Happy Father’s Day."
16577203801,2010-06-19 23:19:46,Today I attended the grand opening of the Sarasota GOP HQ and had a chance to sign the candidate wall.  http://twitpic.com/1y9cf2
16520045643,2010-06-19 03:54:19,It was humbling to be with so many supporters at tonight's reception at the RPOF Quarterly meeting.  Thanks to everyone who attended.
16487543200,2010-06-18 17:56:15,In Tampa for the Republican Party of FL quarterly meeting.  Looking forward to catching up with supporters.
16416849056,2010-06-17 20:49:42,Proud to have FL Christian Coalition founder and State Rep. Dennis Baxley supporting my campaign. http://bit.ly/9akMHh
16197536988,2010-06-15 03:18:38,Watch my interview with Greta on the Obama Administration's response to the #gulfoilspill here: http://youtu.be/0cuhBLNFOiE
16193360886,2010-06-15 02:04:41,In the studio about to talk to Greta Van Susteren about the Gulf oil spill. Tune into Fox News to watch!
16144562591,2010-06-14 12:48:24,I am pleased to have the endorsement of former Mass. Governor Mitt Romney.  http://bit.ly/asyx1s
16038482541,2010-06-13 00:23:09,Enjoyed a great evening with the Florida Federation of Young Republicans. The future of our party in Florida is in good hands.
15965545798,2010-06-12 00:22:17,Happy to have endorsement of the FL State Firefighters Association. Enjoyed speaking at tonight's annual awards dinner. http://bit.ly/cUSv66
15805486163,2010-06-09 22:25:49,It was great meeting with 1st responders and reps from a FL-based hi-tech company in Winter Garden today. http://yfrog.com/mv7awj
15503029536,2010-06-05 18:07:29,Spending a great day in Central Florida - just left the Brevard County Republican Picnic. I appreciate all of the support
15426699406,2010-06-04 16:18:01,Today I addressed AIF's 2010 Water Forum and announced my plan to manage FL's water supply and grow the state’s economy http://bit.ly/d3Rauh
15338987178,2010-06-03 17:07:48,This morning I talked to Steve Doocy on Fox & Friends about the Gulf oil spill.  Watch here: http://youtu.be/89WxEi24y-0
15284069618,2010-06-02 23:22:14,"Today, I discussed the Obama Admin's response to the Gulf oil spill with Neil Cavuto. http://youtu.be/KhoR-QopbMc"
15254354868,2010-06-02 14:19:34,I thank Bill Herrle and the Florida NFIB for supporting my legal challenge to the new health care laws. http://bit.ly/9LhQfD
15127845153,2010-05-31 19:34:44,"This morning in Gotha, I attended a memorial service for heroes who died defending our freedom. Today, we honor all vets for their service."
14934810274,2010-05-28 22:02:36,God bless the men and women who died for our freedom as we recognize them this Memorial Day weekend.
14925066302,2010-05-28 18:45:05,"As Governor, I plan to reinstate the Florida Hurricane Preparedness Sales Tax Holiday. Read my plan here: http://bit.ly/9lrEZ1."
14833665425,2010-05-27 13:17:19,Happy Nat'l Fed. of Independent Businesses supports my efforts to challenge new health care laws. Read here: http://bit.ly/ao9XzA
14776868566,2010-05-26 17:19:42,Happy to have support from FL @NFIB in my legal challenge to constitutionality of new health care laws. http://youtu.be/KBjzdoYDLgk
14761171024,2010-05-26 12:56:22,Welcoming crew of Atlantis back to Cape Canaveral after its final voyage. FL must remain home to manned space flight after shuttle program.
14644056598,2010-05-24 20:00:49,"In Jacksonville for the day, where we just announced the second phase of our economic agenda. Read it on our website: http://bit.ly/9yP0EH"
14637952548,2010-05-24 17:54:13,I congratulate Senator Paula Dockery on running an enthusiastic and substantive campaign for Governor: http://bit.ly/bY6ROw.
14584671407,2010-05-23 23:10:05,Looking forward to a full day of events tomorrow in Northeast Florida talking about the future of our state's economy. #sayfie #flgov
14516268118,2010-05-22 21:03:08,Northwest Florida Beaches International Airport now officially open for business. Great for our state and economy: http://bit.ly/cDFMU2
14506925034,2010-05-22 17:40:04,Enjoyed a great talk and Q&A session with attendees at the Florida Liberty Summit 2010 via Skype this morning: http://bit.ly/codsgR
14395571639,2010-05-21 00:59:55,"Tomorrow morning our campaign will make a big announcement. To be the first to know, join our team at http://bit.ly/2nPSpT."
14376769139,2010-05-20 17:59:26,Just finished touring HEICO Corp's HQ in Hollywood - one of the largest aerospace companies in Florida: http://bit.ly/codsgR
14265045381,2010-05-19 01:47:59,Thanks to the members of the Miami-Dade County REC for hosting me at tonight's meeting. Hope to be back soon.
14107843329,2010-05-16 16:39:07,"Our prayers are with the family of FHP Trooper Patrick Ambroise, who was killed in the line of duty last night: http://bit.ly/bJQtpH"
14057489127,2010-05-15 20:38:34,"Proud to announce our Sportsmen for McCollum leadership team, headed up by Commissioner Charlie Bronson: http://bit.ly/d15Po6"
14054113809,2010-05-15 19:15:16,"On Armed Forces Day, we honor the brave military men and women serving our country. Thank a soldier or veteran today: http://bit.ly/9GVSW8"
14040149962,2010-05-15 14:33:59,We're about to walk into the Southern Classic Gun and Knife Show in Orlando. Looking forward to meeting some of Florida's finest sportsmen.
14004503069,2010-05-14 23:44:10,Heading to see my alma mater Hernando High take on the Dunnellon Tigers in the Class 4A Baseball Regional Finals. Go Leopards!
13992903478,2010-05-14 19:22:36,Reuters: Small business group joins health reform lawsuit: http://bit.ly/aK1047
13939571648,2010-05-13 22:56:16,I’m in Miami for the evening. Enjoyed my talk with Univision's Jenny Padura on the important immigration issues facing our country.
13870758627,2010-05-12 20:40:31,I congratulate the great city of Tampa on being selected as the host of the 2012 Republican National Convention. Exciting news for Florida.
13755643358,2010-05-10 23:52:21,"Bill McCollum campaigns at Orlando's BusinessForce, discusses plan to create 500,000 jobs in 6 years: http://bit.ly/d7HZjh ~staff"
13752703847,2010-05-10 22:54:13,A great day at the grand opening of the new Holiday Inn in Perry – a real boost for the local economy.  http://tweetphoto.com/21924943
13749303625,2010-05-10 21:41:46,"Attorney General McCollum, Governor Crist Announce Launch of Oil Spill Legal Advisory Council: http://bit.ly/9EvuSG ~staff"
13684673657,2010-05-09 19:49:23,"As families gather in celebration of today's special holiday, Ingrid and I wish all FL mothers a happy Mother’s Day: http://bit.ly/91rbGX"
13620258352,2010-05-08 17:34:30,We just held our second Miami forum on housing issues. Helping Floridians suffering from this severe foreclosure crisis is a top priority.
13582260383,2010-05-08 01:47:07,Thanks to the Republican Party of Pasco County for hosting a great Reagan Day Dinner celebration tonight.
13569328804,2010-05-07 21:00:53,"Had a great afternoon speaking to BusinessForce’s ""Insider's Briefing"" event about my plan to create 500,000 new Florida jobs in six years."
13504396552,2010-05-06 19:39:13,"Announcing our African Americans for McCollum Steering Committee, led by Representative Jennifer Carroll: http://bit.ly/bsl8si."
13446428839,2010-05-05 20:45:39,"Palm Beach Post: McCollum, Gulf state AGs seek assurances from oil companies: http://bit.ly/9sZHXm ~staff"
13437983734,2010-05-05 17:26:22,"PNJ: McCollum warns of dangers of scam artists, ensures officials he will hold BP responsible for cleanup: http://bit.ly/bk9Dc5  ~staff"
13427756468,2010-05-05 13:57:54,Headed back to the Escambia EOC for a morning briefing on the Deepwater Horizon oil spill in the Gulf.
13389501753,2010-05-04 23:01:27,More meetings with local officials and business leaders tomorrow in the Panhandle on preparedness and response to Deepwater Horizon spill.
13375724392,2010-05-04 17:43:45,Headed to the Unified Command Center in Mobile to meet w/ state and federal officials on the oil spill following visit to the Pensacola EOC.
13316274539,2010-05-03 17:19:10,PB Post: Florida officials are ramping up preparation for the massive oil spill looming off the state’s Panhandle: http://bit.ly/a1u3rJ
13272135706,2010-05-02 23:21:54,Just arrived back in Tallahassee from meeting with Attys General of Southeastern states. Gulf oil spill is a serious threat to Florida.
13208354018,2010-05-01 21:03:43,"To learn more about Attorney General McCollum's 2010 Legislative Accomplishments, visit http://bit.ly/chp8Ke. ~staff"
13161255843,2010-05-01 01:14:21,"As session ends, I thank the Legislature for helping us increase transparency, promote public safety and protect the rights of Floridians."
13094812792,2010-04-29 22:59:46,Statement by Bill McCollum on Governor Crist’s Decision to Leave the Republican primary: http://bit.ly/aYPO19 ~staff
13070708400,2010-04-29 14:12:12,Enjoyed my time in Pensacola - dinner last night at the Fish House and breakfast at Lisa's Deli. Good food and great Floridians.
13021905890,2010-04-28 18:45:53,Also toured the Andrews Institute at Baptist Hospital. Gulf Breeze is home to one of the finest sports medicine facilities in the world.
13019729900,2010-04-28 17:57:37,A great day campaigning in the Florida Panhandle. Thanks to all the supporters who came to breakfast in Santa Rosa Beach at the Donut Hole.
12677293789,2010-04-23 02:26:26,"Congratulations to Gators Joe Haden, Markice Pouncey and Tim Tebow on being drafted in the first round. Go Gators!"
12648821993,2010-04-22 16:38:19,Thank you to the members of the Tampa Interbay Rotary Club for hosting me at lunch. I enjoyed sharing my Roadmap for Florida's Future.
12573167248,2010-04-21 12:22:39,It was great to join Trey Radel this morning on WINK radio in Naples. Our support in Southwest Florida is strong and growing. #sayfie
12473660749,2010-04-19 20:12:32,"ICYMI: 500,000 New Jobs for Florida: http://bit.ly/dm5Na3"
12292481868,2010-04-16 16:37:41,Thanks to all of the friends and supporters who joined us at Versailles in Miami this morning to discuss my Roadmap for Florida's Future.
12010697438,2010-04-11 21:28:19,Had a good talk today with Steve Forbes on the challenges facing Florida's economy. We agree it must get easier to do business here.
11946851789,2010-04-10 17:14:51,"About to join Lauren Book-Lim on part of her walk across FL. To learn about her efforts to prevent child abuse, visit www.laurenskids.org."
11855123789,2010-04-09 01:28:19,"Just left the Seminole County Golden Eagle Dinner, celebrating 100 years of Scouting - what a great crowd and cause."
11787914417,2010-04-07 21:38:47,Bill McCollum on Merit Pay Legislation Rewarding Florida Teachers: http://bit.ly/aUtbko. ~staff
11722037875,2010-04-06 22:26:45,"Thanks to our donors and their generous upport of our campaign, we raised nearly $1.4 million this quarter: http://bit.ly/bNSGvi."
11659914298,2010-04-05 20:50:06,Toured the Everglades today – one of Florida’s greatest treasures. Thanks to the S. FL Water Management Dist. staff for their hospitality.
11643150688,2010-04-05 14:31:54,ICYMI: “ObamaCare: Public sees that lawsuit makes plenty of sense”: http://bit.ly/bS7TT4 ~staff
11553116069,2010-04-03 21:08:57,Ingrid and I share our best wishes for a happy Easter: http://bit.ly/dvFQHy.
11496043947,2010-04-02 19:08:33,"Attorney General McCollum Files Injunction, Freezes Assets In Alleged $23 million Ponzi Scheme: http://bit.ly/aynAPL ~staff"
11485355366,2010-04-02 15:20:23,ICYMI: Wall Street Journal: “ObamaCare and the Constitution”: http://bit.ly/cb3uAV ~staff
11451015437,2010-04-01 23:49:54,"Had a great, productive meeting with my economic advisory committee earlier today. Putting Floridians back to work is my #1 priority."
11436910104,2010-04-01 17:54:24,Why Florida sued Washington over the new health care law: http://bit.ly/bTUFIA
11382350968,2010-03-31 19:18:14,"With just hours to go before the end of the fundraising quarter, will you please go to www.BillMcCollum.com and stand with us?"
11320823849,2010-03-30 18:04:10,What They’re Really Saying: “Bill McCollum Gains Steam”: http://bit.ly/cdeXJF ~staff
11280020709,2010-03-30 00:40:19,"As Jewish Floridians across the Sunshine State gather to observe Passover, Ingrid and I share our best wishes for a peaceful holiday."
11260557315,2010-03-29 17:30:32,"Had a great visit to the Port of Miami, where we were able to present more than $500,000 from a recent price-fixing settlement."
11170266345,2010-03-28 00:55:53,"As proud parents of an alumnus, Ingrid and I are pleased to join Lt. Gen. Hagenbeck for Central FL's West Point Founder’s Day Celebration."
11092225152,2010-03-26 14:37:14,With 12.2% of our residents out of work - the highest unemployment rate on record - we must do everything possible to foster job creation
10995380594,2010-03-24 19:56:47,What They’re Really Saying: Bill McCollum Leads Charge to Challenge Democrats’ Health Care Reform Plan: http://bit.ly/cpNHy5 ~staff
10957190514,2010-03-24 02:11:04,"At 10:30 p.m., Attorney General McCollum will discuss Florida's lawsuit challenging health care reform live with Greta Van Susteren. ~staff"
10835263836,2010-03-21 19:51:45,Bill McCollum will join FOX News' Neil Cavuto at 4:20 pm and Special Report later tonight to discuss the health care reform vote. ~staff
10728079038,2010-03-19 15:40:57,"ICYMI: AP (SC): McCollum, McMaster to file federal lawsuit if health care reform legislation passes: http://bit.ly/9zHJB5 ~staff"
10689182806,2010-03-18 21:00:55,Visited Dais Analytic today in Tampa – a growing company that is creating jobs for Floridians and developing cutting edge technology.
10630881836,2010-03-17 17:27:05,ICYMI: Irish-American Republicans endorse Bill McCollum for Governor: http://bit.ly/cF7uUN ~ staff
10628827508,2010-03-17 16:31:27,Our comprehensive statewide gang reduction strategy will make Florida a safer place to live: http://bit.ly/c802hl
10585643435,2010-03-16 20:16:00,Herald-Tribune: McCollum renews vow to sue over federal health legislation: http://bit.ly/bcOQwj. ~staff
10469208360,2010-03-14 13:30:39,"Had a great weekend in Miami. At yesterday's Housing Crisis Community Forum at FIU, we provided assistance to hundreds of homeowners."
10393209293,2010-03-12 22:32:01,Heading out from a great visit at Versailles with Rudy Giuliani and Mario Diaz-Balart.  http://tweetphoto.com/14157647
10375148944,2010-03-12 14:56:19,Palm Beach Post: Rudy Giuliani touts McCollum as fiscal hawk in West Palm Beach: http://bit.ly/9lEdDX ~staff
10340451236,2010-03-11 21:27:04,The new Florida Mezz Fund will play a crucial role in helping the state’s young companies grow: http://bit.ly/aT8hox
10323628698,2010-03-11 14:14:37,"Palm Beach Post: McCollum slams Obama, Pelosi, Reid, Sink, health care overhaul: http://bit.ly/bxOZcI ~staff"
10290600097,2010-03-10 21:53:31,Florida Can’t Afford President Obama’s Economic Policies: http://bit.ly/diwmQ0. ~staff
10235359139,2010-03-09 19:58:03,"If you live in the Daytona area, join us for Breakfast with Bill tomorrow 
http://bit.ly/9RF7UR ~staff"
10186788821,2010-03-08 20:36:37,Had a great day full of events in Plant City at the Florida Strawberry Festival. Visit our Facebook page for pictures: http://bit.ly/b1zjIO
10149912701,2010-03-08 02:43:18,Just arrived in Lakeland for the Florida Strawberry Festival tomorrow. Hope to catch part of the Oscars tonight.
10044639715,2010-03-05 22:16:14,Florida’s Top Priority Must Be Job Creation: http://bit.ly/ddk3L5. ~staff
9993128407,2010-03-04 22:09:20,I was pleased to join Florida TaxWatch earlier today to address innovative ways to save taxpayer dollars.
9985580751,2010-03-04 18:48:49,Bill McCollum applauds Florida’s selection as one of 16 Race to the Top finalists: http://bit.ly/9qWPyJ. ~staff
9939908472,2010-03-03 20:44:35,Met today with Kennedy Space Center Director Bob Cabana. We must take action to ensure Florida remains a leader in the aerospace industry.
9896739155,2010-03-02 23:26:16,Bill McCollum on the Commencement of the 2010 Florida Legislative Session http://bit.ly/bw5Dp9 ~staff
9886442652,2010-03-02 18:53:15,Tallahassee Democrat: Bill McCollum: Standing up for our Second Amendment Rights: http://bit.ly/dokh0D ~ staff
9750449685,2010-02-27 23:24:36,NBC/ABC Jacksonville: AG McCollum and the Jacksonville Sheriff's Office help senior citizens avoid fraud: http://bit.ly/cVHiBI ~staff
9700336456,2010-02-26 22:44:10,"We had a great day of events in Jacksonville, including breakfast with friends and supporters at the Whiteway Deli."
9645242843,2010-02-25 21:57:05,Bill McCollum on the White House Health Care Summit and the decision to exclude governors: http://bit.ly/9rnrAD ~staff
9637679013,2010-02-25 18:36:11,Attorney General McCollum Highlights 2010 Legislative Priorities: http://bit.ly/96c0gJ ~ staff
9599276239,2010-02-24 23:55:19,A special thank you to William Large and the FL Justice Reform Institute for their support on our transparency in contracting initiative.
9587274823,2010-02-24 18:37:32,Enjoyed joining the Florida Chamber's CEO Roundtable Breakfast today as part of the Chamber's annual Capitol Days meeting.
9560925932,2010-02-24 04:23:17,"Final score tonight: University of Florida 75, Tennessee 62 - a big win for the Gators in the final stretch of the regular season."
9559704397,2010-02-24 03:53:30,A great crowd at the O’Connell Center. Florida Gators now up by 20 points on Tennessee with less than 5 minutes to go in the game.
9553481107,2010-02-24 01:31:18,Had a great visit with the U.S. Chamber of Commerce Board this morning. Now headed to the University of Florida basketball game.
9483406973,2010-02-22 16:50:05,ICYMI: VILLAGES DAILY SUN: “McCollum addresses Lincoln Day crowd”: http://bit.ly/adiJpF ~ staff
9401390124,2010-02-20 22:22:29,"Congratulations to the Republican Party of Florida's new leadership, Chairman Thrasher and Vice-Chairwoman Cox-Roush: http://bit.ly/bma5rk"
9246970299,2010-02-17 19:14:51,"I had the opportunity to address the Florida Retail Federation today. Florida's 100,000+ retailers employ nearly 20 percent of our workforce"
9202002701,2010-02-16 21:10:07,"Just toured Chromalloy Casting, a manufacturing plant based in Tampa that is providing jobs for hardworking Floridians."
9068312392,2010-02-13 20:03:25,"Looking forward to addressing the Palm Beach County GOP's Lincoln Day Dinner, just one day following our 16th President's 201st Birthday."
9031966780,2010-02-13 00:02:46,ICYMI: Wall Street Journal: Progress on Pay to Play: http://bit.ly/curBfk ~ staff
9015930915,2010-02-12 16:40:38,Just finished a great meeting with Newsmax staff in Palm Beach. Look for the interview soon at www.Newsmax.com.
8974489349,2010-02-11 19:36:47,Lincoln Diaz-Balart's expertise and passion for service will continue to serve the people of Florida well. I wish my friend the best.
8962253303,2010-02-11 14:16:28,Thanks to all of our supporters who turned out at Mel's Diner in North Naples this morning for breakfast.
8905318333,2010-02-10 15:22:47,"If you live in the Naples area, join us for Breakfast with Bill tomorrow: http://bit.ly/bMDI2O  ~staff"
8828665665,2010-02-08 22:58:39,"As the proud father of 3 Eagle Scouts, I congratulate the Boy Scouts of America on their historic 100th anniversary."
8781081090,2010-02-07 22:11:40,Looking forward to watching the Super Bowl tonight. One big winner is host city Miami. Share your game prediction: http://bit.ly/d5aapr
8677369920,2010-02-05 13:44:55,Great crowd this morning at Lenny's in Clearwater. Thanks to Mayor Hibbard for the intro http://tweetphoto.com/10470001
8636601141,2010-02-04 15:41:47,"If you live in the Tampa Bay area, join us for Breakfast with Bill tomorrow: http://bit.ly/bIq5Mo ~ staff"
8565969367,2010-02-03 00:47:37,Enjoyed a great evening with the Naples Chapter of the Republican Jewish Coalition. Look forward to being back in Naples next week.
8547520614,2010-02-02 16:02:03,Had a great visit to the WQBA studio in Miami this morning to visit with Bernadette Pardo and our friends at Univision Radio.
8468408740,2010-01-31 22:21:50,"Bill had a great time attending the Ye Mystic Krewe Gasparilla Breakfast in Tampa. To see photos, visit Facebook http://bit.ly/d5aapr ~staff"
8435771083,2010-01-31 02:44:50,"I was honored to receive the Cuban American Bar Association's annual ""Amigo Award"" tonight. CABA does a lot of great work in Florida."
8382804731,2010-01-29 20:33:22,"Cong. Lincoln Diaz-Balart, Mario-Diaz Balart and Ileana Ros-Lehtinen @IRL to lead our campaign in Miami: http://bit.ly/bbp2Bw. ~staff"
8378622525,2010-01-29 18:31:35,Check out photos from my visit to the Highlands County Fair http://bit.ly/bGIlNv
8374011642,2010-01-29 16:28:31,I’m very grateful to the Charlotte County Republican Executive Committee for their endorsement last evening.
8346103660,2010-01-29 00:50:47,Rep. Denise Grimsley and I are visiting with Floridians at the Highlands County Fair. Junior Livestock Show and Auction was very impressive.
8328000267,2010-01-28 16:09:06,"Today I joined the Board of Directors of Enterprise Florida. To learn more about the group's plan to create jobs, visit www.eflorida.com."
8294919272,2010-01-27 21:21:40,Looking forward to Pres. Obama's State of the Union. What thoughts/ideas do you want to hear from the Pres? Share here: http://bit.ly/9Ra0Ml
8294655347,2010-01-27 21:14:16,Looking forward to Pres. Obama’s State of the Union. What thoughts/ideas do you want to hear from the Pres? Share here:http://bit.ly/9Ra0Ml
