id,created_at,text
2121924477,2009-06-11 20:49:44,"I'm taking being called ""Mr. Substance"" as a compliment! http:/tinyurl.com/nffvex"
2120484018,2009-06-11 18:49:47,Driving home from an exciting and busy week in Tallahassee. Headed to the Magic game tonight!  Hope to see you there! Go Magic!
2095504659,2009-06-09 22:34:52,"As an avid baseball fan, this article caught my eye this morning: http://tinyurl.com/lpjjgo"
2092072346,2009-06-09 17:36:31,I enjoyed seeing my good friend John Walsh today. He is helping make Florida a safer place by going after cyber predators.
2083589789,2009-06-09 00:47:47,I'm looking for suggestion.  I recently purchased an iPhone and need to know what app to use for twitter.  Thoughts?
2082240577,2009-06-08 22:38:07,"Thanks for the support. RT @aaalex32 BMC 4 GOV! @GOPMichael Pls support our statewide, FL Senate & FL House, county & local candidates!"
2044769933,2009-06-05 16:48:01,Florida Statewide Survey Results. Click here to download the full memo: http://tinyurl.com/r7d292
1996176473,2009-06-01 21:39:21,Proud to have the support of more than 60 state legislators for the campaign:  http://tinyurl.com/kqo9bz
1977129646,2009-05-31 03:10:23,What an exciting game!  Congratulations to the Eastern Conference Champion Orlando Magic!
1976334430,2009-05-31 00:06:04,Tuning in to Game 6 of the NBA Eastern Finals.  Cheering for the hometown #Magic to win and advance!  @Orlando_magic  @DwightHoward  #nba
1971109148,2009-05-30 13:14:26,Travel Day.  Headed to Naples and Sarasota.
1970950384,2009-05-30 12:45:44,This has been a very good week making calls to supporters.
1930647286,2009-05-27 01:36:25,Visit our newly launched campaign website at www.BillMcCollum.com to keep up with the latest news.
1926968585,2009-05-26 19:26:58,"After a great Memorial Day weekend in FL, I’m just about in the car on my way back to Tallahassee for a cabinet meeting.  #Bill2010"
1864901912,2009-05-20 23:28:53,"Just announced my finance team. I am honored to have the support of such a diverse group of business, civic and comm. leaders #Bill2010"
1862883879,2009-05-20 19:57:50,I have been getting a lot of calls from supporters asking how they can help. #BM2010 #BillMcCollum
1855342938,2009-05-20 03:21:06,"To view the results of today's Mason-Dixon poll, you may download this PDF: http://tinyurl.com/mdpoll. #Bill2010"
1855320713,2009-05-20 03:18:46,"A new Mason-Dixon poll released today shows me leading Alex Sink in the race for governor 40% to 34%. With your help, can achieve victory."
1852002528,2009-05-19 21:44:29,Are you on Facebook? Please take a moment to check out my page and join me as a supporter. http://tinyurl.com/qg5obm #Bill2010
1840222851,2009-05-18 21:32:37,Did you miss today's announcement? Watch a recap at www.BillMcCollum.com. #Bill2010
1836789021,2009-05-18 15:36:29,About to have lunch with my great friend @VernBuchanan who has endorsed me for Governor #Bill2010
1836390176,2009-05-18 14:54:44,We’re going to win. Please stand with me: www.billmccollum.com.
1835806442,2009-05-18 13:47:25,Preparing to join many of my great friends to announce my candidacy for Governor of the great state of Florida #Bill2010 #tcot
1835491461,2009-05-18 13:06:48,On my way to the Embassy Suites Downtown—San Juan III Boardroom in beautiful Orlando. #Bill2010
1830120037,2009-05-17 23:09:20,About to enjoy a Sunday evening jog.
1826402166,2009-05-17 15:25:31,Let's go Magic!
1817920218,2009-05-16 17:08:43,Big announcement Monday morning. Stay tuned...
1813165472,2009-05-16 03:00:32,This is the official Bill McCollum 2010 Campaign Twitter account.
