id,created_at,text
27941577479,2010-10-20 15:34:23,Good to see everyone who joined us in Cookeville this morning. Strong support on the plateau. #tngov
27870401143,2010-10-19 21:35:42,Crissy and I early voted at the City County Building just a little while ago - hope you'll do the same before early voting ends on 10/28!
27860280783,2010-10-19 19:07:40,Good to see so many old friends & meet new ones in Lenoir City today. Heading back to Knoxville to early vote! Have you early voted? #tngov
27854773514,2010-10-19 17:48:15,Big thanks to Congressman Duncan for his gracious introduction to a great crowd at the Maryville courthouse. http://ow.ly/i/4I4P
27848264244,2010-10-19 16:22:10,Packed house at Maryville Kiwanis: http://twitpic.com/2z17tr Heading to the 1:00 rally at the courthouse in just a bit!
27839714073,2010-10-19 14:46:06,The Early Voting Bus Tour makes some stops in East Tennessee today - http://bit.ly/bLTQSK - come out and join us!
27584024732,2010-10-16 23:23:37,It was a real honor to help dedicate the newly renovated home in Columbia for People Helping People Together this PM http://ow.ly/i/4Dk7
27566227730,2010-10-16 18:47:43,At the Chili Cook-Off in Leiper's Fork & ran into some cyclists participating in the Adoption Tour Ambassador Classic: http://ow.ly/i/4D0w
27559296982,2010-10-16 17:12:49,In Nashville with a huge crowd at the Hermitage House Smorgasbord. Great to have Gov. Dunn joining us. http://ow.ly/i/4CSt
27473211323,2010-10-15 19:54:40,In Morristown earlier at a stop along the Early Voting Bus Tour - Early Voting is happening now through the 28th - http://twitpic.com/2xuu03
27446688307,2010-10-15 14:34:10,Add a sticker to your picture today and help us pass 200 supporters! It's easy and greatly appreciated: http://twb.ly/bB7MZZ Please RT!
27355259983,2010-10-14 16:13:58,"Huge crowd of 100+ at the Sullivan Co. GOP HQs, and everyone's enthusiastic about early voting and 11/2 #tngov http://twitpic.com/2xkhn2"
27347238645,2010-10-14 14:45:01,Back on the bus tour: addressing TN Fire Services Coalition this a.m. and I appreciate their endorsement #tngov http://twitpic.com/2xjqp0
27273717877,2010-10-13 20:26:53,Show your support - add a @BillHaslam #twibbon to your avatar now! - http://twb.ly/bB7MZZ
27271080493,2010-10-13 19:47:28,Off the bus to knock on doors in Athens. Encouraging everyone to early vote. #tngov  http://twitpic.com/2xcbvo
27264803939,2010-10-13 18:14:47,"Always great to have my dad on the trail with me, and Crissy has been with me every step of the way #tngov  http://twitpic.com/2xbpj7"
27251151510,2010-10-13 15:23:09,Down at Wally's in Chattanooga and seeing the results of hard work of volunteers with big crowds. #tngov  http://twitpic.com/2xafbh
27232849493,2010-10-13 11:40:34,Early voting is here with a great crowd at Long's. Appreciate the hometown support to kickoff the bus tour #tngov http://twitpic.com/2x8p0k
27203348226,2010-10-13 02:56:26,This has to be a first - thx for your support (& vote)! RT @DKINGJR: Camping out in downtown Nashville to early vote for @billhaslam #tngov
27183510993,2010-10-12 23:23:03,Early voting starts tomorrow! Find a location near you with this tool: http://bit.ly/b3bAIt
27164797295,2010-10-12 18:52:56,http://twitpic.com/2x22hq - Hearing some great comments and feedback at Nashville Entrepreneur Center #tngov
27080179634,2010-10-11 23:44:30,Let's keep working hard to get out the vote - the only poll that matters is November 2nd! http://bit.ly/8ZRRED
26858846998,2010-10-09 16:48:01,http://twitpic.com/2w23su - Knocking on doors in Munford and they don't call it running for office for nothing. #tngov
26847517949,2010-10-09 14:33:11,http://twitpic.com/2w0t8d - Big crowd at the Old Country Store in Jackson b4 heading to Memphis for a knock and debate. #tngov
26657132140,2010-10-07 15:10:57,Rob has a great idea! Check out his wall post. Anyone else planning to camp out??? http://on.fb.me/aymOj6
26653329549,2010-10-07 14:27:24,http://twitpic.com/2ves65 - Meeting with two great law enforcement groups today and enjoyed my time TN Sheriffs Assoc #tngov
26582553510,2010-10-06 20:30:46,Appreciate Rep. Blackburn @votemarsha making calls with our Williamson Co. team today  http://twitpic.com/2v7m7g
26578543522,2010-10-06 19:29:22,"A Quick Blog Post from our Campaign Manager, Mark Cate: http://blog.billhaslam.com/2010/10/06/1-week-from-today/"
26551976297,2010-10-06 13:41:09,"Enjoyed meeting with WWII veterans this morning at McGhee Tyson - we're heading up to D.C. aboard ""Honor Air"" - http://twitpic.com/2v4mdc"
26483391377,2010-10-05 19:21:38,"Proud to accept the designation of ""Bicycle Friendly Community"" earlier today from the League of American Bicyclists - http://bit.ly/8Z8A7J"
26374205069,2010-10-04 15:47:57,Tennessee's Voter Registration Deadline is Today - http://bit.ly/bl6xDh - #tngov
26100866846,2010-10-01 17:35:22,Crissy's busy schedule continues - she really enjoyed attending this ladies luncheon in Blount Co. earlier today:  http://twitpic.com/2topzv
26093618571,2010-10-01 16:07:18,Making TN the No. 1 state in the SE for quality jobs is my top priority- that's why it was important to help Franklin. http://bit.ly/deKRK9
26011592298,2010-09-30 20:19:05,@nashvillehhgmag Yard signs are available at regional offices across the state: http://bit.ly/cSJ6it - Thanks for your support!
26010980368,2010-09-30 20:09:56,It's been a busy day for Crissy - she's now making calls with volunteers at the GOP office in Murfreesboro:  http://twitpic.com/2tfa2d
26005540091,2010-09-30 18:49:48,Crissy reading to a co-op classroom at Mitchell-Neilson Primary school in Murfreesboro.  http://twitpic.com/2teq0q
25996249601,2010-09-30 16:42:54,Tonight at midnight is our FINAL quarterly filing deadline. Will you help us reach our goal? http://bit.ly/cY9pN6
25988335314,2010-09-30 15:12:24,Crissy speaking to a great group of ladies in Dickson this morning:  http://twitpic.com/2td1jp
25901322739,2010-09-29 17:09:55,At the Mayors Caucus - enjoy talking with Mayors b/c they deal with the reality of balancing the budget. http://twitpic.com/2t42bf #tngov
25881510757,2010-09-29 13:15:30,http://twitpic.com/2t26dj - Grateful for NFIB's endorsement this morning and small business support across Tennessee. #tngov
25789417028,2010-09-28 14:28:51,"Thanks for your support, John! RT @johnnavin: Vid thoughts on @billhaslam running for Gov of TN http://youtu.be/G7qXckvSWEw"
25780024707,2010-09-28 12:34:40,In Lenoir City this morning speaking to folks at Cracker Barrel about my plan for Tennessee  http://twitpic.com/2srv0f
25704776270,2010-09-27 17:08:39,"Speaking to the fine folks of Decanter Machine, Inc. in Johnson City  http://twitpic.com/2sk24i"
25702356905,2010-09-27 16:37:39,TN's voter registration deadline is next Monday - is your registration up to date? Find out now: http://bit.ly/bmGbPa
25420163463,2010-09-24 16:39:10,Show your support for Bill via a video endorsement: http://bit.ly/d1eGle Please RT - thanks all!
25311681328,2010-09-23 14:27:10,On my way up to the Tri-Cities for a couple of stops including the TN Tourism Forum and knocking on doors this afternoon. #tngov
25245241320,2010-09-22 21:05:25,RT @mosdkids: Crissy Haslam came to visit MOSD! We were thrilled to show her all the little miracles done everyday (@BillHaslam) http:// ...
25229089926,2010-09-22 17:05:48,"http://twitpic.com/2qx9ja - The tour @ the Nat'l Civil Rights Museum is well done, ending with the balcony and Room 306  #tngov"
25227101054,2010-09-22 16:40:00,Sorry I missed you @HannahDudney - Signup for email updates at http://bit.ly/c5Ro7s and we'll notify you of events in your area!
25211698253,2010-09-22 13:35:42,"http://twitpic.com/2qvimb - Starting the day @ U of Memphis, then UTHSC, Civil Rights Museum, Tipton Cty and Brownsville #tngov"
25162723170,2010-09-21 23:42:36,"New Poll: http://bit.ly/clhO7g Great news, but lots of work still needs to be done. Get involved by emailing volunteer@billhaslam.com - Thx!"
25154924725,2010-09-21 21:56:10,http://twitpic.com/2qp3iq - Great to be out knocking on doors in Jackson! #tngov
25150068891,2010-09-21 20:43:31,http://twitpic.com/2qoltp - In Jackson discussing economic development in rural TN after talking to CPAs in Middle TN #tngov
25145164388,2010-09-21 19:27:11,Haslam Talks Rural Economic Development In West Tennessee - 9/21/2010 - http://bit.ly/cHDmGc
25073611510,2010-09-21 00:45:54,Meet Retired Officer Norm Rickman of the KPD: http://www.facebook.com/TeamHaslam
25067681807,2010-09-20 23:27:22,Visited Hardin Co. earlier & met with officials from ISR - great to see a company like ISR settling in rural TN  http://twitpic.com/2qfptn
24789993919,2010-09-17 20:36:50,Glad to see GM expanding production at the Spring Hill plant: http://blog.billhaslam.com/2010/09/17/gm-expands-production/
24784461799,2010-09-17 19:07:59,Looking forward to the MTSU v. Memphis game tomorrow - we'll be at the new “Tiger Lane” before the game - stop by if you get a chance!
24706787898,2010-09-16 23:24:26,http://twitpic.com/2p38ng - Heard terrific questions and had a thorough chat w/ students @ St. George's in Collierville #tngov
24693636117,2010-09-16 20:09:55,http://twitpic.com/2p1qmh - Really enjoyed the tour and hearing about how Warren Apartments has been turned around #tngov
24679214971,2010-09-16 16:38:02,http://twitpic.com/2p0235 - Great stops at TN Realtors and Youth Villages; now talking safety w/ Gen. Gibbons and others #tngov
24597893748,2010-09-15 19:39:05,Toured Wright Medical just a few minutes ago - great example of a region leveraging local assets  - http://twitpic.com/2oqhdc
24594145077,2010-09-15 18:41:58,"Great lunch w/ Memphis area ministers - furthered my understanding of the unique challenges they face, but also some exciting opportunities!"
24568039757,2010-09-15 13:08:46,Haslam Strikes Gubernatorial Tone in Cookeville Debate - 9/14/2010 | Bill Haslam for Governor of Tennessee - http://t.co/cgifIsO
24515271087,2010-09-14 22:41:52,Don't forget to tune in to your local CBS affiliate starting at 8:00 Eastern / 7:00 Central for live coverage of the debate @ Tennessee Tech
24484420631,2010-09-14 15:20:19,Enjoyed meeting with the Tennessean's ed board this morning http://twitpic.com/2odqt0 & looking forward to tonight's debate at @ttunews
24410395190,2010-09-13 19:51:23,Grateful for the support of elected leaders all across our state: http://bit.ly/cvehSW
24224934201,2010-09-11 20:49:34,In Maury Co. & had a chance to speak to some hunters before their dove hunt - http://ow.ly/i/3LQi
24217037846,2010-09-11 18:37:28,Spoke to an outstanding group of YRs at Vanderbilt earlier today - http://ow.ly/i/3LIy
24198890229,2010-09-11 14:36:37,Today We Remember: http://bit.ly/bKH4D4
24137303259,2010-09-10 21:04:41,"In St. Clair talking jobs, education and budget management where Tennesseans live, work and play #tngov http://twitpic.com/2n4n15"
24132396822,2010-09-10 19:42:04,Discussed with press my regional economic development plan to leverage local assets and grow jobs after a tour of Koyo Automotive #tngov
24124433638,2010-09-10 17:39:06,Just visited Volunteer Blind Industries which makes helmet covers for the Marines. Well run operation #tngov  http://twitpic.com/2n2y7t
24118307971,2010-09-10 16:19:21,Huge crowd of students at Sullivan South and they were very in tune with the challenges facing the state. #tngov http://twitpic.com/2n27vd
24106306759,2010-09-10 13:56:35,Signing in @ Yancey's Tavern. Had a great talk about infrastructure and jobs with Tony Shipley and Ron Ramsey  http://twitpic.com/2n0v2l
24043529477,2010-09-09 21:07:56,Looking forward to spending the day campaigning with Crissy in Northeast TN tomorrow
23944007944,2010-09-08 20:11:27,Crissy enjoyed meeting the fine folks @Soles4Souls today in Old Hickory - they give away a pair of shoes to someone in need every 7 seconds
23257856115,2010-09-07 17:48:35,"Watch our latest TV spot: ""No Income Tax = More Jobs"" http://bit.ly/daZ9FX - and @ reply with your thoughts..."
22992638265,2010-09-04 17:35:53,It's a great day for football - Stop by the Bill Haslam for Governor tailgate before the UT game - across from Gate 21 in Lot 9 from 3-6p!
22838558823,2010-09-02 23:18:07,http://twitpic.com/2kngwz - Tailgating before the Minnesota - MTSU game & meeting some great folks in the process!
22824410315,2010-09-02 19:35:01,Thx to everyone who came out to our event in Franklin - If you missed us: we'll be tailgating @MTSU at 5:30 btwn the stadium & Greenland Dr.
22797798321,2010-09-02 13:28:18,"Middle, TN folks: we'll be at The Community Room in Franklin from 1:15-2:15 p.m. today - feel free to stop by and say hello!"
22712462867,2010-09-01 14:36:46,Busy day campaigning in Chattanooga - looking forward to a couple of tailgate events at MTSU tomorrow and UT Saturday!
22636572611,2010-08-31 17:47:16,almost to Nashville and looking forward to tonight's Student Town Hall hosted by Tennessee's First Lady Andrea Conte
22289052842,2010-08-27 18:37:14,Some thoughts on the tough times we're facing: http://bit.ly/9byT3e I would love to hear your ideas too!
22175453992,2010-08-26 13:01:42,Looking forward to campaigning in Nashville & then heading to Chattanooga this afternoon for a few more events
21928534092,2010-08-23 17:03:19,"Thanks so much for all of the emailed, tweeted, and posted birthday wishes - it's been a great day so far in West Tennessee!"
21705794663,2010-08-21 00:09:39,Gentlemen Start Your Engines!!! @BMSupdates Food City 250
21704278486,2010-08-20 23:42:51,http://twitpic.com/2glwpu - My beautiful wife on the track at Bristol Motor Speedway right before the start of the Food City 250
21689594585,2010-08-20 19:36:35,"We're getting close to 30,000 facebook fans - jump over to http://bit.ly/bUoLmu  to help - we'll post an exclusive video when we hit 30k!"
21686172445,2010-08-20 18:38:12,Heading to Bristol to preside as the Grand Marshall of the Food City 250 - looking forward to this race and tomorrow's under the lights!
21605338289,2010-08-19 20:25:38,"A great day in West, TN today - met with lots of elected officials and business leaders -will be in Middle & East, TN tomorrow!"
21532538245,2010-08-19 00:14:37,The Darrell Waltrip endorsement is live at http://www.facebook.com/TeamHaslam - Thanks for your endorsement Darrell!
21501738548,2010-08-18 16:10:19,Former Nascar Winston Cup Champion Darrell Waltrip Endorses Haslam For Governor - 8/18/2010 | http://t.co/SYmpSX2
21342085683,2010-08-16 20:20:27,Looking forward to a M&G this evening at Chuy's Restaurant in Murfreesboro at 6:00 p.m. CDT - come out and join us if you're in the area!
21160455053,2010-08-14 16:06:35,"As promised, an exclusive sneak peek of our latest tv spot is now live at http://facebook.com/TeamHaslam"
21095654948,2010-08-13 21:10:07,Exclusive preview of our latest TV spot around 12:00 p.m. EDT tomorrow at http://facebook.com/TeamHaslam
21077223921,2010-08-13 16:24:25,Enjoyed being a part of the ribbon cutting ceremony for the new cutting edge Knoxville Station Transit Center on Church Ave.
20995260254,2010-08-12 18:12:45,Currently at Miller industries in Greeneville learning about their towing equipment business http://twitpic.com/2e21yz
20990151087,2010-08-12 16:54:56,Great Crowd of 100+ at the Little Dutch Restaurant in Morristown! http://twitpic.com/2e1gfq
20904702656,2010-08-11 17:55:26,Ag. is very important to our state's economy- spoke at the Farm Bureau President's Conference Luncheon earlier - http://twitpic.com/2dr6xv
20836259155,2010-08-10 23:47:26,Press Release: Haslam Expands Lead On Unproven Opponent - 8/10/2010 - http://bit.ly/adDIFi
20820533605,2010-08-10 19:51:01,Great events in Blount County earlier today - now knocking on doors in Lenoir City – it’s hot - a cloudburst would be nice about now!
20805876630,2010-08-10 16:04:36,At Subs & Such in Alcoa - headed to Tomato Head in Maryville in just a few minutes - come out and say hello! http://twitpic.com/2dfm08
20736059189,2010-08-09 20:50:46,Truly appreciate the support Crissy and I received in Hamilton Co. and many thanks to them #tngov #realdeal http://twitpic.com/2d7bi6
20729231891,2010-08-09 18:51:32,Great crowd at Northeast State and honored to be with Rep. Phil Roe! #tngov #realdeal  http://twitpic.com/2d6hgs
20714291976,2010-08-09 15:00:03,And I appreciate Shelby County District Attorney General Bill Gibbons joining me in Memphis and announcing his support. #tngov #realdeal
20714075602,2010-08-09 14:57:06,Had great stops in Jackson and Memphis to say 'thank you' to supporters and tell them we'll keep working hard for them. #tngov #realdeal
20564080450,2010-08-07 16:44:00,TNGOP's Unity Day at the Union Station Hotel in Nashville http://twitpic.com/2ci95o
20482425096,2010-08-06 16:37:59,Bill Haslam : Primary Night Remarks &lt;Video&gt; http://youtu.be/u1ehVfV1bvY!
20435663831,2010-08-06 03:02:47,Thank you all so much for your support! On to November!!! #teamhaslam #tngov
20405814352,2010-08-05 17:57:38,Primary Day JoggleBug message from Bill: http://www.jogglebug.com/bill-haslam/1040
20402856238,2010-08-05 17:10:05,"Your support has been humbling throughout this campaign, but please make sure you make it to the polls and Vote before 8 Eastern / 7 Central"
20400679465,2010-08-05 16:37:55,Had some chocolate pie from Wright's and then onto Nashville and a door knock. Go vote if you haven't! #tngov  http://twitpic.com/2bv32z
20386839960,2010-08-05 13:15:04,"After 19 months of campaigning, today is the day! If you haven’t already, please take some friends along and head to the polls to Vote!"
20322999948,2010-08-04 18:12:05,About to arrive at the Hunter Museum in Chattanooga for an event and then heading up to the Tri-Cities
20302998048,2010-08-04 13:08:29,At Gibson's Donuts in Memphis earlier this morning - now headed to the Madison County Courthouse for a rally
20250212935,2010-08-03 21:08:31,Huge crowd @ Wingers in Manchester- now on the road to Chattanooga for another event with Coach Pearl - then up to Aubrey's Maryville @ 7:30
20237970222,2010-08-03 17:34:12,In Columbia at the outstanding Farmer's Family Restaurant speaking to all sorts of folks during their lunch hour http://twitpic.com/2barq4
20235215151,2010-08-03 16:50:10,Thanks to Williamson County - a great rally on the courthouse steps in downtown Franklin! We appreciate the strong support 4 our campaign.
20227117547,2010-08-03 14:50:11,@DanielBlog We'll be at 5250 Virginia Way in Brentwood from 10:00 - 10:30 a.m. - hope you can come out and join us!
20226643108,2010-08-03 14:43:07,"With Congressman Duncan, Coach Pearl and family this morning and just made great stops in Hendersonville and Gallatin. Headed to Brentwood."
20171386476,2010-08-02 22:12:22,Fun day on the trail with family and friends. Just left great group of supporters in Clarksville and headed to Nashville for event w/ Pearl
20160193902,2010-08-02 18:54:32,Just met with a large crowd of supporters in Jackson with Coach Pearl. Thanks to those who were able to join us! On our way to Dickson.
20028685454,2010-08-01 00:36:09,Thank you Cumberland County GOP for a great event tonight. Crissy and I appreciated all of the strong words of support!
20021401125,2010-07-31 22:17:25,Made some fun stops along the trail this afternoon at the Smith and Putnam county fairs and historic Cumberland county playhouse.
20003306553,2010-07-31 16:33:36,Great day in Middle Tennessee - lots of stops this morning with some great breakfast crowds - knocking on doors & then heading East!
19999982639,2010-07-31 15:43:56,RT @ChipBoyd: Door knocking for @BillHaslam! Hit &gt;250 doors b4 we got rained out! Phone calls next! Visit us in JC next to Vitamin Shoppe!
19999608469,2010-07-31 15:38:20,"Met some great folks at our bfast stops at Puckett's, Dotson's, Puffy Muffin and now Pancake Pantry in Nashville. Heading to knock on doors."
19941141733,2010-07-30 21:38:01,Just met some great new folks at various stops in Dickson and now headed to Ashland City.
19937938644,2010-07-30 20:41:08,In Knoxville? Come out and join us for an Election Eve Rally the evening of Aug. 4th - details: http://bit.ly/9NcOmh Hope to see you then!
19912300624,2010-07-30 14:12:40,Great stops this morning in Shelby county! Appreciate strong group of supporters at our early morning rally and folks we met at Moma's BBQ.
19847927983,2010-07-29 19:01:20,"Crissy, Annie, Leigh and I just voted. Early vote! Looking forward to the final push to Aug. 5. #tngov http://twitpic.com/29scyw"
19840150899,2010-07-29 16:54:39,Enjoyed shaking hands + meeting voters in Morristown and visiting the new fire station in Jefferson City. #tngov  http://twitpic.com/29rdtk
19826363062,2010-07-29 13:38:52,It's a great day to vote! First stop in Dandridge with 30-plus supporters and then onto Morristown and back to Knoxville to vote. #tngov
19762223739,2010-07-28 18:47:37,"Great stops with even better crowds in Athens, Englewood and Madisonville and now back to Maryville. #tngov http://twitpic.com/29hypn"
19739963285,2010-07-28 13:21:28,"Look forward to today in Knox, Blount, Loudon and Monroe, and a great crowd to start at Jewelry TV! #tngov  http://twitpic.com/29feat"
19676974008,2010-07-27 18:28:00,I'll always stop to sign our plan to make TN the No. 1 location in the Southeast for jobs: Jobs4TN.com #tngov http://twitpic.com/297ktj
19675942870,2010-07-27 18:10:28,I appreciate the support of the 100 folks who came out to our stop in Rogersville. A good number of them early voted! #tngov
19667851425,2010-07-27 16:06:34,"Could've spent extra hour at Mahoney's in Johnson City, and after education conference in Kingsport, onto Chef's and Pal's for lunch! #tngov"
19656664120,2010-07-27 13:30:58,Spoke to supporters at IHOP in Johnson City and now I'm meeting with a great crowd of 35 in Elizabethton #tngov http://twitpic.com/2959nx
19591441006,2010-07-26 17:57:30,"Crissy and I really enjoyed meeting everyone at Sevierville City Hall, police station and County Election System. Now to Wears Valley #tngov"
19588858462,2010-07-26 17:14:37,Had a great lunch in Pigeon Forge and now we're working the counter at Frank Allen's in Sevierville. #tngov http://twitpic.com/28wsxc
19443421221,2010-07-24 19:56:28,"Tour continues... So far we've been in Hamilton, Bradley, Monroe, Loudon, and Roane Co.  today - headed to Crossville in just a minute..."
19438726546,2010-07-24 18:21:44,Just stopping by the Dinner Bell in Sweetwater - on to the Lenoir City Wal-Mart after this...  http://twitpic.com/28a6fz
19430360817,2010-07-24 16:01:59,JOBS4TN - the right plan for Tennessee - just signed a few copies outside of SteviB's Pizza  http://twitpic.com/288xwi
19428050677,2010-07-24 15:26:56,Busy morning - now in Cleveland speaking with folks at SteviB's Pizza - packed house!  http://twitpic.com/288md7
19423485453,2010-07-24 14:17:11,In East Ridge now meeting some great folks at the Home School Expo -  http://twitpic.com/287yw2
19417804731,2010-07-24 12:35:29,Having breakfast with a great group of folks in Chattanooga at the Country Place Restaurant! http://twitpic.com/28726k
19379105813,2010-07-24 00:09:36,http://twitpic.com/280hnk - At a Rally in Franklin at D1 Athletics!
19369930673,2010-07-23 21:29:03,"Great stop at Farm Bureau, spoke to 50 people about ag and now we have huge crowd in Columbia helping Crissy and I knock on doors! #tngov"
19361122954,2010-07-23 18:51:56,Sat down with a couple of teachers and a police officer while at Chick fil-A in Murfreesboro. Grabbed a chocolate milkshake too!
19357526150,2010-07-23 17:48:00,"Hamburger steak, baked potato and salad -- good lunch @ City Cafe before door-knocking and a rally later. #tngov http://twitpic.com/27xha0"
19355368621,2010-07-23 17:15:52,"The Early Voting Tour stops in the City Cafe in Murfreesboro, a must-stop and great catfish #tngov http://twitpic.com/27x7su"
19273692973,2010-07-22 18:11:23,Came across this beautiful 1931 Ford Model A Truck in Clarksville - it's even sporting a Haslam bumper sticker!  http://twitpic.com/27mokz
19261068587,2010-07-22 15:01:47,"We've got a great team, but in the final two weeks let's turn up the volume online! Here's the plan: http://bit.ly/bY1Q9K"
19259315608,2010-07-22 14:37:47,Great stop in Milan at the No-Til Agriculture breakfast and festival. A terrific program for folks across the state to participate in.
19108630870,2010-07-21 22:02:45,Great Meet & Greet at Henderson City Hall earlier today - Don't forget: Early Voting is happening now through July 31st!
19007906067,2010-07-20 16:54:41,Spoke to 100 people at Lincoln's Sports Grille in Oak Ridge. As #tngov we'll leverage unique regional assets to grow jobs across the state.
19002893348,2010-07-20 15:42:15,Made an impromptu stop at the Emory Valley Center in Oak Ridge during our Early Voting Tour. Next up: Lincoln's! http://twitpic.com/271m4i
18996444891,2010-07-20 14:13:30,The two plants we visited at England employ 700 people in New Tazewell. Great to shake hands with them. #tngov  http://twitpic.com/270vgn
18993895215,2010-07-20 13:37:12,"Having a great stop at New Tazewell's England, Inc. Company has been here since 1964. #tngov"
18955713546,2010-07-20 00:54:38,We'll be making stops in East & Middle TN tomorrow - Come out and join us at a stop along the Early Voting Bus Tour! http://bit.ly/9N9oB9
18773195331,2010-07-17 15:28:39,A Campaign of Ideas - not an exchange of attacks - Watch the new TV spot: http://bit.ly/cpIGgQ
18715757299,2010-07-16 21:06:57,Stopped at one of my favorite places on the trail - @chickfila - this pic is from their Germantown location http://twitpic.com/25w25r
18708456970,2010-07-16 18:55:56,At the Home Builders Association lunch in Cordova - another packed house! http://twitpic.com/25v0s2
