id,created_at,text
371703338124861440,2013-08-25 18:39:16,Equal opportunity in education not the reality in America. There are too many kids today trapped in failing schools. http://t.co/n1ErXlQJ35
371703062051577859,2013-08-25 18:38:10,Giving every child the opportunity for a great education is the next great civil rights fight. http://t.co/n1ErXlQJ35
371428946568429570,2013-08-25 00:28:56,".@BarackObama and Eric Holder - please, watch this video and you will understand why we have to give parents a choice http://t.co/xR2WZliTSQ"
371297179433857024,2013-08-24 15:45:20,We will fight like heck to preserve our reforms in LA that give scholarships to low-income students who are trapped in failing schools.
371296896469315587,2013-08-24 15:44:13,Giving every single child – no matter their race or their income – the opportunity to get a great education is a moral imperative.
371296710397394944,2013-08-24 15:43:28,Parents should not have to ask permission from the federal government to enroll their kids in the school of their choice.
371296496240455682,2013-08-24 15:42:37,The DOJ has filed a petition attempting to deny equal opportunity in education and take away LA parents choice in education for their child.
370947657587363840,2013-08-23 16:36:28,These great rankings show our reforms are working.  Every day Louisiana is becoming a better place to start a family and start a business.
370947399906111488,2013-08-23 16:35:26,2 separate rankings this week name Baton Rouge and Lafayette #1 in U.S. for economic growth! http://t.co/HoFtkm5Fxz; http://t.co/wTof07gDK7
369847356323155968,2013-08-20 15:44:15,"Tapping new energy produces prosperity, creates jobs, gives more choices. Leaders in D.C. need to approve Keystone. http://t.co/g0FKIvwsP3"
369846683632291840,2013-08-20 15:41:35,"Democrats are party of energy austerity. They want govt to tell us to live in smaller houses, drive smaller cars, use thermostats less."
369846145553416192,2013-08-20 15:39:27,"No good arguments against keystone-just liberal ideology blindly and unscientifically opposing all energy not ""green.""http://t.co/g0FKIvwsP3"
369845144532439042,2013-08-20 15:35:28,Meeting with Canadian business leaders today talking about the importance of building the Keystone XL Pipeline. http://t.co/g0FKIvwsP3
369184642277990400,2013-08-18 19:50:52,Here is the final draft board #FantasyFootball http://t.co/9R0mDT2VEa
369184321694740480,2013-08-18 19:49:36,And the #FantasyFootball draft is complete. Hopefully it's a good year for the Super Slades
369183396930404352,2013-08-18 19:45:55,Our final pick: Hauschka for kicker. What a name! #FantasyFootball
369180378956697600,2013-08-18 19:33:56,Zach Miller is our back-up TE. Last pick coming up. It has to be a kicker. Who should we pick? #FantasyFootball
369176733238321152,2013-08-18 19:19:26,The commish (my son) runs a tough #FantasyFootball league. We r required to have 2 kickers
369175729893687296,2013-08-18 19:15:27,2 more picks left. We need another tight end and a kicker. Sleeper ideas for TE #FantasyFootball
369175525274554368,2013-08-18 19:14:38,We went with Hartley for the kicker. #Saints #FantasyFootball
369174976760258560,2013-08-18 19:12:28,It's getting late into the draft. We need a kicker. Ideas? #FantasyFootball
369174525927108608,2013-08-18 19:10:40,We picked Jordy Nelson as our second next wide receiver.  #FantasyFootball
369172545154453504,2013-08-18 19:02:48,"We need another wide receiver. Still avail: Jordy Nelson, Eric Decker, James Jones, Anquan Boldin, Steve Johnson #FantasyFootball"
369171039063793665,2013-08-18 18:56:49,We picked up the Bucs D. #FantasyFootball
369169977330245632,2013-08-18 18:52:36,"Btw. Great #FantasyFootball team names in league: phllly cheesesteaks, Super slades, two dat!, supertroopers, breaux bridge ballers"
369168914371969024,2013-08-18 18:48:22,"Defenses still available (among others): Giants, Fins, Bucs, Raiders. Who should we pick? #FantasyFootball"
369168500880707586,2013-08-18 18:46:44,We picked up Maurice Jones-Drew. We need a solid Defense. #FantasyFootball
369168088802934784,2013-08-18 18:45:05,@bdomenech @NathanWurtzel That's who we picked
369167031213387777,2013-08-18 18:40:53,"Still need another RB for #FantasyFootball. Still available: Maurice Jones-Drew, Demarco Murray, David Wilson, Ryan Matthews among others"
369165973703516160,2013-08-18 18:36:41,@NathanWurtzel @bdomenech Ball is gone. May be Lacy.
369164305217769474,2013-08-18 18:30:03,Halfway through the draft. Here is the board #FantasyFootball http://t.co/SV48lvQ3Nm
369160667774734336,2013-08-18 18:15:36,We need a running back in the next round. We need a sleeper. We're getting late into the draft. Who should we pick? #FantasyFootball
369159069812023296,2013-08-18 18:09:15,Our materials for #FantasyFootball http://t.co/nLPiGWaqST
369158836982018048,2013-08-18 18:08:20,We picked up Joe Flacco as our back-up QB #FantasyFootball
369158596484812802,2013-08-18 18:07:22,This is the third year we have done the #FantasyFootball draft
369157001655222272,2013-08-18 18:01:02,Team Super Slades #FantasyFootball http://t.co/BKG6GLIE2q
369155213698953216,2013-08-18 17:53:56,"By the way, about 20 people at the house for the fantasy draft, and we have folks on Skype and speaker phone also drafting"
369154939328528385,2013-08-18 17:52:50,We picked up WR Vincent Jackson in the fourth round. What position should we go for next?
369154354550288384,2013-08-18 17:50:31,"And of course, we have food on hand for the fantasy draft. http://t.co/f413tk1tfy"
369153891591417857,2013-08-18 17:48:41,The scene right now at the fantasy football draft. http://t.co/fBv9sdmpbK
369153663941361665,2013-08-18 17:47:46,The fantasy football draft board. Shaan takes his job of league commish very seriously http://t.co/95lWFSYXBz
369152599770939393,2013-08-18 17:43:33,My son Shaan is teamed up with a LA State Trooper. Shaan is the commish of the fantasy league. Team name: The Knights
369152396946984961,2013-08-18 17:42:44,My daughter Selia and wife Supriya are also playing fantasy football. Team name: The Firesticks
369152012715180032,2013-08-18 17:41:13,Who should we pick in the fourth round for fantasy football draft?
369151904405671936,2013-08-18 17:40:47,Second round fantasy football draft pick: Alfred Morris. Third round: Jason Witten
369151246428434432,2013-08-18 17:38:10,Our first fantasy draft pick: Andrew Luck
369151032871223297,2013-08-18 17:37:19,"Draft is under way. 14 teams. Made up of mostly family and friends. I'm teamed up with my son Slade. Team name: ""Super Slades"""
369136383329189889,2013-08-18 16:39:06,"Click favorite to vote for @drewbrees, retweet to vote for Ray Rice."
369118724365619200,2013-08-18 15:28:56,Got my fantasy football draft today with family &amp; friends.  Who should I take in the 1st round?  The Saints are going to fly off the board.
368800081115242496,2013-08-17 18:22:45,GOP needs to fight like heck to repeal Obamacare.  I have opposed expansion of Obamacare in LA - will do everything I can to work for repeal
368799841133948929,2013-08-17 18:21:48,.@marylandrieu comment is just another example that the left sees Obamacare as path to socialized medicine. http://t.co/lVwbhqY4YL
368799405568049152,2013-08-17 18:20:04,"Whoa! @marylandrieu agrees with Obama. She's ""embarrassed"" that America doesn't have socialized medicine like Europe! http://t.co/lVwbhqY4YL"
367772602636328960,2013-08-14 22:19:56,Huge news for the RGA. Nearly doubling the DGA in fundraising.  Will help elect more GOP governors who are driving America's comeback!
367736672844144640,2013-08-14 19:57:09,Thanks for the shout out Willie. @DuckDynastyAE number 1 show on TV. My kids love it. CC: @williebosshog http://t.co/aA05mzYFD6
366921957322665984,2013-08-12 13:59:46,The troubling details of 'navigator' program are another example of poor planning and implementation of Obamacare. http://t.co/HkgRQ5XElt
366921644364668929,2013-08-12 13:58:31,"'Navigator' is a clever name, but is nothing more than taxpayer $ to hire community organizers to sell Obamacare. http://t.co/HkgRQ5XElt"
366920928636055552,2013-08-12 13:55:41,Read my column calling on President Obama to halt the lucrative grants to the 'navigator' program in Obamacare. http://t.co/HkgRQ5XElt
366632432272801792,2013-08-11 18:49:18,"Many thought Nola would never recover, but we have proved them wrong. Our progress since Katrina is truly remarkable. http://t.co/pzavBvaXcE"
366632177494007808,2013-08-11 18:48:17,Read my column about how we have worked together to turn New Orleans into America's comeback city. http://t.co/pzavBvaXcE
365558093297364993,2013-08-08 19:40:15,Great talk with students in NOLA to announce LA charter schools near top in the country for reading… http://t.co/lY7RYxs3NJ
365552498200682496,2013-08-08 19:18:01,It's about each and every child getting a great education so they can get great jobs. http://t.co/sBzAlTSzNN
365551236902166528,2013-08-08 19:13:01,"For too long, we've had too many kids trapped in failing schools. http://t.co/sBzAlTSzNN"
365547076244869121,2013-08-08 18:56:29,"Proud of recent study showing LA is leader in student achievement at charter schools, ranking near the top in both reading and math gains."
365226263381680130,2013-08-07 21:41:41,"My wife made a ""best-dressed"" list in Vanity Fair! Something I will never accomplish. Smart and beautiful woman! http://t.co/Fw1VkhQCj9"
364204568919293954,2013-08-05 02:01:50,En route to Opelousas to assess the scene of a potentially hazardous train derailment.  Will be providing an update from the ground at 9:15.
363816813341065216,2013-08-04 00:21:03,Great to see Gov. Branstad. Fantastic leader for Iowa. Congrats on signing largest tax cut in Iowa history this year! http://t.co/dUwkADv2vk
363777335591305216,2013-08-03 21:44:10,More great economic news for Louisiana--our capital city has been named tops in the US for economic growth potential! http://t.co/Fap1fAXplE
362675160605667328,2013-07-31 20:44:31,Great to be back at Rocky &amp; Carlo's in Chalmette!  Important meeting highlighting hurricane preparedness efforts. http://t.co/ddCoE9mZex
362621726208696323,2013-07-31 17:12:11,Watch this report on our announcement yesterday on the largest AP exam score improvement in Louisiana history. http://t.co/s3TiwRTUPh
362613107845111809,2013-07-31 16:37:56,Our hard work is paying off! @AmericanPress says stellar business news continues to flow seemingly unabated for LA. http://t.co/v9F0fucHZq
361946526873960449,2013-07-29 20:29:11,"By allowing families and kids to choose courses that are best for them, Louisiana kids can pursue their dreams. http://t.co/umjMXjLhUJ"
361945766673137664,2013-07-29 20:26:10,"In Louisiana, we're teaming up w/ job creators to educate tomorrow's workforce. http://t.co/umjMXjLhUJ"
361944641433636867,2013-07-29 20:21:41,Another public-private success story in Louisiana. Teaming up w/ the private sector to educate Louisiana's children. http://t.co/umjMXjLhUJ
360820690410151936,2013-07-26 17:55:30,My wife is a pretty good shot #firstinstagrampost http://t.co/KQW41REDu6
360429450149642241,2013-07-25 16:00:52,"Louisiana is entering a new era of health care to improve care, reduce costs, and better prepare future doctors http://t.co/ZIZPIYyaC1"
360416770525364225,2013-07-25 15:10:28,"Obamacare was a bad idea from the start, and the American public never supported it. Let’s repeal it. http://t.co/ZAvUTq8AZe"
360416425564844032,2013-07-25 15:09:06,Obamacare is unworkable. The wreck is coming. Let’s repeal it. http://t.co/ZAvUTq8AZe
360414712564940801,2013-07-25 15:02:18,Read my op-ed with @ScottKWalker on why Obamacare is unworkable and it should be repealed. http://t.co/ZAvUTq8AZe
359782163304022016,2013-07-23 21:08:46,Louisiana reaches another all-time high in a biz climate ranking. No. 4 in the country. We're not stopping here. http://t.co/kVBXpI51g6
359781325944791040,2013-07-23 21:05:27,Fight over Medicaid expansion is a microcosm of @BarackObama's push towards centralized government control http://t.co/E9V01OMqGd
359780877913440256,2013-07-23 21:03:40,Why I oppose Obamacare's Medicaid Expansion http://t.co/E9V01OMqGd
358633431996964864,2013-07-20 17:04:07,"By reducing burdensome taxes, reining in govt spending, and passing ed. reforms, LA is new frontier for job growth. http://t.co/nclPRK491Y"
358633239226761216,2013-07-20 17:03:21,Check out this editorial from @AmericanPress. So proud of LA's climb in national ranks of best states for business. http://t.co/nclPRK491Y
357962979486081025,2013-07-18 20:39:59,"LA reaches all-time high in a biz climate ranking! Since '08, LA up 26 spots, most improved in nation over 5 yrs. http://t.co/WBxignSlbN"
355800084681728000,2013-07-12 21:25:25,Great to be on @SteveDeaceShow talking about religious liberty and support for the Bossier Sheriff. http://t.co/eypUoHZoqQ
355740855690207235,2013-07-12 17:30:04,"Great to be with Peyton, Eli, Cooper, and Archie Manning to announce new investment for Manning Passing Academy in LA http://t.co/2TI3znBJ79"
354674995227672576,2013-07-09 18:54:43,I believe that virtually all Americans will embrace immigration reform compassionately when our borders are secure. http://t.co/07vDxIiNDj
354674632739127296,2013-07-09 18:53:16,"If D.C. truly wants to solve the crisis of 11 million illegals, they will get serious on securing border right now. http://t.co/07vDxIiNDj"
354674156010348545,2013-07-09 18:51:22,"Increase legal immigration by a lot, especially for skilled workers. Need to stop educating the world’s best and not allow them to stay."
354673543646162944,2013-07-09 18:48:56,"Immigration reform should be done in 3 steps: 1.Secure the border; 2.Once border secure, create guest worker visas; 3. Increase LEGAL immig!"
354672190299447298,2013-07-09 18:43:34,"1,000 pages of pork, regs, and power for govt bureaucrats is not a solution any more than Obamacare is HC solution. http://t.co/07vDxIiNDj"
354670625660477440,2013-07-09 18:37:21,"As son of immigrants, I’m unapologetic advocate for immig. That's why it's troubling to see D.C. mess up reform again.http://t.co/07vDxIiNDj"
354669719514660864,2013-07-09 18:33:45,Read my column about how D.C. is botching immigration reform again and what should be done to achieve true reform. http://t.co/07vDxIiNDj
354338449001676800,2013-07-08 20:37:24,@GovernorPerry has served TX w/ great honor &amp; distinction.He put TX on path 2 prosperity w/countless accomplishments. Wish him all the best
352953920894693376,2013-07-05 00:55:47,"Had a great time w/ @TheLeeGreenwood, Sheriff Whittington and 100's of Louisianians at today's rally! http://t.co/XGrOXIOWQq"
352920596125982720,2013-07-04 22:43:21,"Happy Independence Day! Everyone have a fun and safe July 4th, and remember all those who made incredible sacrifices for our freedom."
352906804667236352,2013-07-04 21:48:33,I don't know if we can convince D.C. to continue funding this great program. But I know we are not going to give up our religious freedom.
352906521123893248,2013-07-04 21:47:25,The First Amendment was written to protect people of faith from government officials. And we are going to hold on to that freedom.
352906267645313026,2013-07-04 21:46:25,The simple fact is that these Washington officials want our faith and worship bottled up inside churches where it can’t infect others.
352906089261568002,2013-07-04 21:45:43,"D.C. will say they're not stopping you from praying.  They just want you to do it at the right time, in the right place."
352905908206043136,2013-07-04 21:44:59,Thrilled to be at today's In God We Trust Rally w/ Sheriff Whittington to take stand against the fed govt denying funding for youth program
352433562798145536,2013-07-03 14:28:03,You know things are bad when you can’t even successfully implement your own bad ideas.
352433280060100608,2013-07-03 14:26:56,"Congress passed the employer mandate into law, but the exec branch is refusing to enforce it.  Bureaucrats run this government."
352432667687522306,2013-07-03 14:24:30,Obamacare is poorly conceived and unworkable. Why should business and corporations get relief and individuals not get relief?
352431781745655811,2013-07-03 14:20:59,Pres. Obama is delaying implementation of Obamacare regulations on business but not delaying them for individuals? http://t.co/LCizSGdW9q
349630593102913538,2013-06-25 20:50:03,More people than ever before in Louisiana are now being served by programs for people with developmental disabilities http://t.co/llgh1UTzcv
349630164507959297,2013-06-25 20:48:21,Read my letter to the editor about the state budget and funding for people with developmental disabilities. http://t.co/llgh1UTzcv
348118115701370880,2013-06-21 16:40:01,Medicaid expansion is very expensive counterfeit compassion.Real compassionate solution is reform-not expand-Medicaid.http://t.co/BY0oje8zfm
348117287221473280,2013-06-21 16:36:43,"Sen. Coburn and I wrote a column on the importance of fixing the Medicaid program, not expanding it. Read it here: http://t.co/BY0oje8zfm"
347013396912304128,2013-06-18 15:30:15,"Americans will rise up against this new era of big govt. In the meantime, GOP needs to stick to our principles. http://t.co/6rFrLqYkNX"
347012988294795264,2013-06-18 15:28:38,GOP should take all the energy being spent on autopsies and focus it on painting a picture for the American public.  http://t.co/6rFrLqYkNX
347010248139214848,2013-06-18 15:17:44,Read my column on how the GOP needs to get back to fighting for a prosperous U.S. future and stop the navel-gazing. http://t.co/6rFrLqYkNX
347005893977731072,2013-06-18 15:00:26,I wrote this for Politico so all the DC insiders will read it. It’s time for GOP operatives to stop the self loathing.http://t.co/6rFrLqYkNX
346676036274106368,2013-06-17 17:09:42,"Since I entered office, I’ve been fortunate to visit every parish multiple times and I look forward once again to visiting these communities"
346675638960271364,2013-06-17 17:08:07,Louisianians shouldn't have to come to Baton Rouge to see their Governor.
346675383015440384,2013-06-17 17:07:06,"Today,I launched a statewide tour to visit all 64 parishes. I want to hear from Louisianians firsthand about issues that matter most to them"
346278403047038977,2013-06-16 14:49:39,"Happy Father's Day to my dad, a good man who had the courage to chase the American dream."
345218328119345153,2013-06-13 16:37:17,Will be traveling to Geismar plant site to meet with first responders and local officials
345218042839584768,2013-06-13 16:36:09,Holding Unified Command Group in 30 mins. to get an update on Geismar plant explosion.
345217648881176576,2013-06-13 16:34:35,Praying for those affected by the Geismar plant explosion.
344935938323001344,2013-06-12 21:55:10,".@marylandrieu supports Bloomberg's bckgrnd checks, praises him in @nytimes.  what next...helping him ban big gulps? http://t.co/m3hVV4HBRq"
344181706217123840,2013-06-10 19:58:08,@MikeHasten Thanks Mike
344177759859376129,2013-06-10 19:42:27,@EWErickson Thanks Erick
344170103094538240,2013-06-10 19:12:01,Thanks to everybody for the birthday wishes. #blessed
344169156377202688,2013-06-10 19:08:15,@MMillhollon Thanks Michelle!
344169008888705025,2013-06-10 19:07:40,@Reince Thanks Reince!
344114174898622464,2013-06-10 15:29:47,"Also glad we rejected Oba­macare, would have been too costly and moved some citizens from private ins. to Medicaid.http://t.co/Kf0Zo2IYdw"
344113612765421568,2013-06-10 15:27:33,"Thrilled to give our teachers a raise, they deserve it. Incredible progress in our schools over last few years. http://t.co/Kf0Zo2IYdw"
344113380036059136,2013-06-10 15:26:37,"Our budget is balanced, doesn’t raise taxes, and includes near­ly $70 million in increased funding for K-12 ed. http://t.co/Kf0Zo2IYdw"
343576863165255680,2013-06-09 03:54:42,.@LSUbaseball is off to the College World Series! #geauxtigers #LSU
342785271034699776,2013-06-06 23:29:11,2013 saw another successful #lalege session that will continue to make Louisiana stronger for future generations.
342784507352580097,2013-06-06 23:26:09,"The budget invests in K-12 education, protects our education reforms, rejects #ObamaCare &amp; doesn't raise taxes."
342783961535217664,2013-06-06 23:23:59,"Proud to work w/ #lalege on a responsible, balanced budget that's good for Louisiana families."
340991668159389697,2013-06-02 00:42:03,Proud of teachers working hard to implement reforms. Excited State Senate put $50 million in budget for bonuses for teachers #lalege
340587118596345857,2013-05-31 21:54:31,It is pathetic to try to reduce every issue down to race. http://t.co/gqNYwZs24n
340586624826089473,2013-05-31 21:52:33,"There are many people in Louisiana, in both parties, who disagree with Obamacare, and it has nothing to do with race.http://t.co/gqNYwZs24n"
340203894510592000,2013-05-30 20:31:43,.@seanhannity is right. There are plenty of reasons to oppose Obamacare and none of them are about racism. http://t.co/UPK2POvciK
340129422613045248,2013-05-30 15:35:48,We aren't racist. We just disagree on Obamacare. We can express our opinions without name calling. http://t.co/KeIjn5ybVa
340129085588140032,2013-05-30 15:34:27,The LA Dem Party Chair is wrong to call Louisianians who oppose Obamacare racist. http://t.co/KeIjn5ybVa
339488892631789571,2013-05-28 21:10:34,Great to meet with Coach Mainieri and @LSUbaseball players to congratulate them on their 10th SEC title! http://t.co/6oRM3z8mpl
339074403247718400,2013-05-27 17:43:32,"Today, and every day, we should honor these heroes and their families for the sacrifices they made in the name of freedom."
339074180786040832,2013-05-27 17:42:39,That freedom was earned by the brave men and women in our Armed Forces who put their lives on the line…
339074017443053570,2013-05-27 17:42:00,"In America, we enjoy more freedom than any nation the world has ever seen…."
338824251563991041,2013-05-27 01:09:31,What a win over Vandy. Congrats to @LSUbaseball on winning the #SEC baseball tourney. #geauxtigers
337955897311633409,2013-05-24 15:38:59,Maybe Pres. Clinton can pronounce the 2nd end of the era of big govt? It's time for Big Brother to be put down http://t.co/bWUGBm4KCj
337955326752067587,2013-05-24 15:36:43,Big government breeds Big Brother and scandal. http://t.co/bWUGBm4KCj
336596597494382595,2013-05-20 21:37:37,Our thoughts and prayers are with the people of Oklahoma
335768836374687744,2013-05-18 14:48:23,I will be speaking shortly to the Virginia GOP convention. Click here to tune in: http://t.co/08hFFvBmAn
335530754186563584,2013-05-17 23:02:20,We need leaders who have more confidence in American people and more skepticism for big government
335515908057485313,2013-05-17 22:03:20,The era of big government is strangling our freedom
335501135576190976,2013-05-17 21:04:38,Bigger government and more power in the hands of a few means the interests of the public will be violated
335485003179892736,2013-05-17 20:00:32,"Look at liberalism across every issue, from healthcare 2 spending, 1 thing crystal clear, they don’t believe in dynamic power of freedom"
335470109378347008,2013-05-17 19:01:21,"IRS, AP, Benghazi, Obamacare problems aren’t failure of an individual,but failure of system in which liberals put too much trust in big govt"
335454883547320320,2013-05-17 18:00:51,"IRS, AP, Benghazi, Obamacare problems cut at core of @BarackObama Presidency and liberalism that big government is good"
335439678666854400,2013-05-17 17:00:26,".@BarackObama problems on IRS, AP, Benghazi, Obamacare more than just DC scandal. Speaks to philosophy of big vs. small govt"
335421061392904192,2013-05-17 15:46:27,"Obama Presidency based on not trusting American people, belief that big gov better 4 people. Latest scandals show why liberalism doesnt work"
335392372554862592,2013-05-17 13:52:27,"IRS, AP, Benghazi, Obamacare. All seemingly unrelated, but all related in that problems arose b/c of lack of trust in the American people"
334805831709237248,2013-05-15 23:01:45,Proud to join hundreds of students at the capitol today to support school choice. http://t.co/uQylyenCdL
334306271132020736,2013-05-14 13:56:40,.@BarackObama should fire all employees involved in this case of big brother come to life. http://t.co/jo3Q4AaI2v
334305892428308481,2013-05-14 13:55:10,.@BarackObama should appoint special prosecutor to investigate IRS for un-American targeting of conservative groups. http://t.co/jo3Q4AaI2v
334061929830154242,2013-05-13 21:45:45,Relieved to hear of Gosnell verdict. Sick &amp; saddened by what occurred in his clinic. Story should be wakeup call to promote culture of life.
333579900894191617,2013-05-12 13:50:20,"Happy Mother's Day to my mom and to my wife Supriya, my best friend and incredible mother of our 3 kids."
333309837628825600,2013-05-11 19:57:12,First @BarackObama tried to wreck #2ndAmendment. Now he uses IRS to attack #1stAmendment too http://t.co/LSVcJP8vFA
331859871278444544,2013-05-07 19:55:33,We are committed to making sure this program continues and we will fund it through the budget.
331859425402945536,2013-05-07 19:53:47,The court ruling today means that the Scholarship Program is alive and well.
331859298806280192,2013-05-07 19:53:17,Our Scholarship Program has given children hope.  It has given parents a lifeline.
331578865510146048,2013-05-07 01:18:56,We hear Louisiana legislators are cooking up a secret plan to raises taxes by at least $1.3 billion over 4 yrs with no public input
331531479739936768,2013-05-06 22:10:38,"If you’re sending more money to the govt than you were before, that’s a tax increase. http://t.co/lnMlUfLLAz"
331528717392310272,2013-05-06 21:59:40,"Raising taxes by $100s of millions on Louisiana families and biz is wrong, especially when it's done in secret. https://t.co/MP6D831I5G"
