id,created_at,text
361645415046709250,2013-07-29 00:32:40,Mourn passing of Bud Day most decorated war hero of WWII Korea  Vietnam   One of longest POW of Nam war.
361130288253898752,2013-07-27 14:25:44,"This wk prezObama ""pivots"" back to jobs(again) in speech in Illinois Why wld he pivot bk Why he take eye off ball w  constant7.5%joblessness"
361113487587549184,2013-07-27 13:18:59,"Beware of ""transnationalists"" If u don't want UN to compromise our Constitution read abt JohnKyl in WSJournal oped 7/20/13"
360814401105833986,2013-07-26 17:30:31,"PresObama 5yr in office has focus his presidency on reducing inequality rather than increasing growth THINK Kennedy""risingTIDE liftsALLBOATS"
360813044718247937,2013-07-26 17:25:08,Pres obama has to learn that b4 the govt can redistribute wealth the private economy has to create it. His policy aren't helping to so cre8
360792463520174081,2013-07-26 16:03:21,"Obama speech:""Washington has taken its eye off the ball... This needs to stop"". Since when isn't he part of ""Washington""?  He needsToEngage"
360497969495158784,2013-07-25 20:33:08,I intro. bill this week 2protect ID of farmers after EPA released 80000 names&amp;addresses Need more common sense atEPA. Sen Donnelly cosponsor
360459516590034944,2013-07-25 18:00:20,4groups of young people I had meetings w this morn: GirlsNation BoysNation FFA  and BoyScouts glad to hv Q&amp;A
359655519482429441,2013-07-23 12:45:32,I'm having bfast w 10 law student clerks of judiciary comm
359654978266210304,2013-07-23 12:43:23,w 10 law clerks of my judiciary comm
359465985742344193,2013-07-23 00:12:24,Pres Obama Jesse Jackson Al Sharpton.  Watch first ten min of O Reilly when it reruns in two hrs  he puts a real challenge to u
359435472461774850,2013-07-22 22:11:09,"Happy birthday to Bob Dole Outstanding senator, war vet and friend."
359305184721121281,2013-07-22 13:33:26,SO.. Obama will speak abt jobs. Abt time. After job killing taxes ObamaCare over regulation largest deficits in history
359303260685225984,2013-07-22 13:25:47,SO... Finally this week Obama is going speak abt jobs and economy not guns and immigration. Finally speak abt issue most people60pc want
359295050268041216,2013-07-22 12:53:10,"Japanese on issue of defense""China's aggressive and US is already weak"" so Japan must revise Constitution IT IS SAD PEOPLE ABROAD C US WEAK"
358763792613654528,2013-07-21 01:42:08,I spoke tonight at Iowa DeMolay Banquet  THe group honored First Responders  DeMolay members are next generation of MasonicLeaders
358654197140422658,2013-07-20 18:26:38,Secy.ofAg JimWilson 1897/1913 Longest ever His hometownTraer had celebration for him Vilsack and I spoke there Northey too
358280177219932161,2013-07-19 17:40:25,Sen Cruz speech in des Moines covers 2pts:defense of Constitution and promoting growth and  opportunity
358273184820236289,2013-07-19 17:12:38,I'm having lunch @Chris_Moody  talking abt no history on history channel
356866756926640129,2013-07-15 20:03:59,"Congrats2 Floyd Hammer&amp;Kathy Hamilton, Union IA Named 5000th Point of Light 4 Xceptional volunteerism.They help feed kids in 14 countries+US"
356056380572053505,2013-07-13 14:23:51,If u want history u won't get it on the History Channel rite now. So turn to Iowa public TV and u can get history of Austro-HungarianEmpire
356051218914738178,2013-07-13 14:03:20,33:59 My time 5K BeaverCreekDays festival at newhartford  Iowa. Donations went to FoodBank
355896192468652032,2013-07-13 03:47:19,Name of SEAL hero Rockford honored w statue is Jon T (JT) Tumilson  this was life size statue of JT and dog Hawkeye
355892974367936512,2013-07-13 03:34:31,Rockford Iowa honor SEAL hero killed in action w Bronze Statue of him and dog Hawkeye in local park I attended funeral months ago
355890595958501378,2013-07-13 03:25:04,Tonite attended opening ceremony of Butler County Relay for Life(fight cancer) inAllison  Barbara Grassley  is a survivor  both of us help
355468722791657472,2013-07-11 23:28:42,I'm visiting w @WiseSoph bc she does not blieve I do my own tweets.  We at DCA
355434066809585665,2013-07-11 21:10:59,"If Senate Majority ldr calls nuclear option vote next wk, he'll go down in history as ""destroying"" Senate by his own definition from 2009."
353522657444106241,2013-07-06 14:35:44,"Those of who want to lead must remember ""Democracy means constantly outperforming yourself or you are out on your backside """
352956818793836544,2013-07-05 01:07:17,Just finished Iowa Falls parade  longer route and more people  walked w @patgrassley  beautiful weather and friendly spectators
352884390432477184,2013-07-04 20:19:29,Just finished July 4th parade in Reinbeck  I walked w @patgrassley  perfect weather  onto Io Iowa Falls for last parade of day
352448770614624256,2013-07-03 15:28:29,"Production, Supply, Price of ethanol are not affected by Morsi, Egypt or Suez.  Choose homegrown ethanol."
352436230144794628,2013-07-03 14:38:39,"Audubon TM 29 ppl Topics: DoD Reg/Bibles, ExecOrders, Pipeline, Judges, ethanol, SS, debt, Student loans, Immigration,IRS,farm bill,Benghazi"
352209474691403777,2013-07-02 23:37:37,Speaking in Ames tonight Discussing US/Australian relations w/Australian farmers&amp;ag leaders including farm&amp;trade policy
352208990366744577,2013-07-02 23:35:41,"Harlan TM 55 ppl Topics: credit union tax, highway bill, Older Americans Act, Medicaid, student loans, immigration"
352133884915355648,2013-07-02 18:37:15,"Atlantic, 45 ppl Topics: Obamacare, tax reform, immigration, student loans, farm bill, IRS, estate tax, NSA surveillance, partisanship"
352133472397176833,2013-07-02 18:35:36,"Council Bluffs mtg, Griffin Pipe mfg, Employee town meeting&amp;plant tour.  Very nice visit."
352072003332743169,2013-07-02 14:31:21,"Logan TM 48 ppl Topics: FEMA, F&amp;F, Obama travel, Obamacare, foreign aid, college loans, Syria, flat tax, gay marriage, Benghazi, guns"
352071814861692928,2013-07-02 14:30:36,"Glenwood TM 72 ppl Topics: Immigration, Obamacare, FEMA regs, guns, DHS buying bullets, campaign finance reform, jobs, F&amp;F, Benghazi, IRS"
351833909782265856,2013-07-01 22:45:15,"Sidney TM-32 ppl Topics: Obamacare, Cancer, Farm Bill, SNAP, debt, F&amp;F, Veterans, IRS, Benghazi, immigration"
351832175492079617,2013-07-01 22:38:22,"Clarinda TM- 52 ppl. Topics: jobs, Immigration, Obamacare, EPA regs, Guns, Crop insurance"
351744673792000000,2013-07-01 16:50:39,"Corning TM- 49 ppl Topics: SNAP, Immigration, Deficit, climate chg, Syria, UN guns, F&amp;F, Obamacare, Partisanship, gay marriage, TermLimits"
351743660582375424,2013-07-01 16:46:38,"Bedford TM, 26 ppl Topics: Immigration, Benghazi, IRS, F&amp;F, ExecOrders, FreeCellphones, Guns, Obamacare"
351743315894484993,2013-07-01 16:45:16,Senate in recess so holding meetings in IA.  I tweet topics asked about for press &amp; Iowans wanting to know what grassroots asking about
351333685951340545,2013-06-30 13:37:32,U just been waiting for RESULTS!! My time 33:31 5K SturgisFallsDays. That is original name of CedarFalls Iowa
350666522076790785,2013-06-28 17:26:28,Surprise. Still more history on history channel.  Now.   Cleopatra
350655453300129794,2013-06-28 16:42:29,History on the history channel.  Yes history.  Attila the Hun   Rite now
350343686313353217,2013-06-27 20:03:38,I two minutes senate votes on immigration reform.  Senators told by Leader to vote fr desk rather than milling around bc of historic vote
349666202940997632,2013-06-25 23:11:33,"RT @Sen_JoeManchin: Pres. Obama’s proposal will have disastrous consequences for not only the coal industry, but also American jobs and the…"
348501440018391040,2013-06-22 18:03:12,At Frederickburg Iowa marking grave of CongMedalOfHonor recipient LeroyVokes Great Program especially StSenator Black history of suchSoldier
348256131816243202,2013-06-22 01:48:26,Att General didn’t disclose FBI drones in answer 2 me. He gave DEA&amp;ATF specifics but no FBI which has been using since 2010. Just forgetful?
348147992961892354,2013-06-21 18:38:44,CBO says immigration bill will reduce illegals entering U.S. by only 25%. See p. 23 of cost estimate  Shows need to secure border 1st.
348147586538024960,2013-06-21 18:37:07,"Don’t be sucked into believing corker/hoeven secures border. As explained, it’s still legalization b4 border security"
347841944514342912,2013-06-20 22:22:36,If u want border security as#1 goal of immigration reform we will hv to look to the House b/c the Senate bill is only legalization first
347841128478932992,2013-06-20 22:19:22,Too bad House didn’t pass farm/nutrition bill. It’s a step forward in important reforms. Farmers need certainty.2of2
347840860379029504,2013-06-20 22:18:18,"House did right thing passing rep. Fortenberry payment limits amend. Saves $$, helps small/medium &amp; beginning farmers, closes loopholes.1of2"
347112851158216704,2013-06-18 22:05:27,Why do senate democrats not want a secure border. Border shld b secure b4 legalization. Polls show ppl want secure border
346623120934830080,2013-06-17 13:39:26,I'm a legislator not a delegator. Congress delegates too much. Progressives like 2delegate 2executive We had rule of law Now rule of lawyers
345723518383710208,2013-06-15 02:04:44,"Friends of Sharon Juon had nice retirement party for her in Waterloo 
She retires fr director INRCOG regional govt organ Happy Days Sharon"
345650952650502144,2013-06-14 21:16:23,Groupof8 well intended but misguided abt securing border b/4 legalizing. Imm. bill legalizes b4 border secure. Can’t make illegal once legal
345566260735643648,2013-06-14 15:39:51,If u r interested in business problem of patent trolling read SenSchumers article WSJournal June13  This is real problem Congress must deal
345554099300876289,2013-06-14 14:51:32,"Today is FlagDay. Fly Stars&amp;Stripes a symbol of liberty and freedom,,,a Beacon of Hope  Fact:Millions come here legal yearly 4OPPURTUNITY"
345244749659250690,2013-06-13 18:22:17,Majority move to table my border security amendment shows they don’t want 2 vote 2 actually secure border. 2of2
345244502841253888,2013-06-13 18:21:18,Border Security needs beefed up or 2013 leg. will make same mistakes as ‘86 law. 1of2
345235896586625024,2013-06-13 17:47:06,"April 25 I sent 24Qs to SecNapolitano
 asking how immigration bill wld work Legitimate policy Qs 49 days later NO ANSWER Where answers?"
344087826427699200,2013-06-10 13:45:05,Just read:UNI may drop in fall enrollment .. HS grads&amp; non-traditional students sign up for a very good education at UNI  u will love it
342416817064669184,2013-06-05 23:05:05,Big turnout at Richard Bender's retirement. Longtime staff for Sen Harkin. Thanks 4 service to ppl of Iowa.
341384851175395328,2013-06-03 02:44:25,Seems Assad winning  Time to ask Q we Asked '51 a la GeoSantayana (don't repeat mistakes). Who lost China?Now who lost Syria?
341382987386064896,2013-06-03 02:37:01,"Why isn't President Obama ""reset""policy w Russia working?  He has tried so hard and Putin ""thumbs his nose"" at our President."
340951641329127424,2013-06-01 22:03:00,"I will be at gala tonight in cedarRapids
 for opening of new USCellular convention center   I will b one of 3 or four short speeches"
340940237549207552,2013-06-01 21:17:41,Ran 5k at MyWaterloo Days this Morning- strong turnout despite weather.  Ran 35:30 by my watch
340521762456473600,2013-05-31 17:34:49,"Martha Moore of USA TODAY said I wasn't 
Tweeting enough   So I will try to do more often"
340278458229874689,2013-05-31 01:28:01,"61 ppl-Webster City mtg. Qs: Crop insurance, Obamacare, guns, debt, budget, IRS, flat tax, Tricare, Keystone pipeline, F&amp;F"
340278184207601664,2013-05-31 01:26:55,"109 ppl- Clarion mtg. Qs Need answers 4 Meinkes on Immigration status, truck weights, Tax cuts, Israel, WRDA, Guns, FarmBill, Too Big 2 Fail"
340152790649286658,2013-05-30 17:08:39,"38 ppl Algona Qs: EqualPayforWomen, Pipeline ,Taxes, F&amp;F, Gun Control, MinWage, VA, Syria,DC Judges, FannieMae, farmbill, Immigration, Fed"
339912843975593984,2013-05-30 01:15:11,"Emmetsburg- 38 ppl.  Qs aboutF&amp;F, Holder, Dodd-Frank, Benghazi, Common Core, TRIO.  SocSec, guns, Obamacare, immigration, taxes"
339860831187636224,2013-05-29 21:48:31,"46 ppl- Pocahontas. Qs GunControl, student Loans, FarmBill, CropIns, filibuster, WRDA, CommonCore, Postal, Immigr, IRS, Obamacare, pipeline"
339835556102037504,2013-05-29 20:08:05,"Dakota City- 47 ppl Qs CampFin, IRS investigation, Seal Team6, F&amp;F, FarmBill, Obamacare, CropIns, Hobby Lobby, immigr, Congress covrd/laws"
339801056647196673,2013-05-29 17:50:59,"Fort Dodge- 90 ppl Qs Benghazi, Farm bill, FoodStmps, Immigr, GunControl, MilitarySexual abuse, ChainedCPI,Debt, SocSec, GMOs,IRS, CyberSec"
339799854677114880,2013-05-29 17:46:13,"Rockwell City- 34 ppl Qs abt Farm bill, VA, Gas Prices, REC loans, Gun control, Education, Filibuster, Abortion"
339797383275757568,2013-05-29 17:36:23,"This AM Jefferson Kiwanis 48 ppl Issues: Immigration, IRS, FlatTax, Energy, CyberSec, Debt, Fillibuster, MyJogging, Ag, EPA Regs, Obamacare"
339025604626219010,2013-05-27 14:29:37,Rain canceled my speech at Aplington cemetery to honor fallen military  If interested go to my Facebook to read it
339003261115838464,2013-05-27 13:00:50,Rain caused  the cancelation of Aplington Memorial Day ceremony honoring fallen servicemembers I cld not speak but rain/shine we honor all
338256911117983745,2013-05-25 11:35:06,I compliment PrezObama speaking out abt military sexual assault at Naval Academy speech It help when ComnderInChief  highlites problem
337941570697457665,2013-05-24 14:42:03,My good colleague senator harkin has chosen Drake U to receive his papers.  I'm glad to hear he chose an Iowa institution. I chose UNI in'86
337939693121458177,2013-05-24 14:34:36,"Sad day for Iowa, WHO radio fans, UofIowa Hawkeyes b/c Jim Zabel died. Still at 91 he was analyzing sports for Iowans. We will miss Jim"
337236440910012418,2013-05-22 16:00:07,Immigration out of committee 13/5  I voted for '86 changes and it didn't stop illegal migration..my goal NOW make sure we secure borderFIRST
337018226665992192,2013-05-22 01:33:01,Public shld hv full story- who involved in legal Conf set-up to reveal IRS targeting. I asked IRS&amp;Treasury in ltr last wk. ?s in hrg this AM
336192707863126016,2013-05-19 18:52:42,Why would Pres Putin keep our Sec of State wait 3hrs for a meeting if he wants to seek common ground w US  sounds like old Soviet way!!
335949290625171456,2013-05-19 02:45:27,@patgrassley informs the Iowa Legislature has not adjourned bc democrat majority in senate can reach consensus on final issues
335888126260170752,2013-05-18 22:42:24,Nixon used IRS to intimidate political foes. One of his impeachment articles. People in this administration ought study history What works??
335887413824090112,2013-05-18 22:39:34,"In '98 I served on IRS restructuring
 Commission  Intimidation of IRS toward small business Same thing only now directed to political groups"
335760271022899200,2013-05-18 14:14:21,We need to stop funding PLO as long as their schools teach hatred toward Israel
335757624127676417,2013-05-18 14:03:50,Congress! Don't b fooled by CBO projected decline in deficit All bc of capital gains taken last yr bc of'13 tax increase Same thing as 1986
335754966012686336,2013-05-18 13:53:16,US has no foreign policy. We shld remember what happened th last time we had no foreign policy. It was Sept 1939 Hitler started WWII Poland
335746737631277056,2013-05-18 13:20:34,MrSeib Wall st Journal left 1 important statistic out of his Tues article that Senate slowing judge approval: #approved187 defeated2
335423786633531393,2013-05-17 15:57:17,Is motivation of IRS investigating Tea Party groups b/c they fight BigGovernment and govt employes want more govt?
335423092979535872,2013-05-17 15:54:31,Gas prices shooting up rapidly in Iowa b/c two refineries shut down in Chicago for repair
335419713712689152,2013-05-17 15:41:06,Treasury IG investigation of IRS makes clear the agency tried to dampen political speech of groups opposed to Dems during last election
335417713134563328,2013-05-17 15:33:09,The Ways&amp;Means Comm hearing on IRS intimidating conservative group abt tax exempt status shows how chilling the agency can be on pol activty
334722341512806400,2013-05-15 17:29:59,My time for 3mile annual Capitol Challenge charity race 32:30 here in DC
333564030377684994,2013-05-12 12:47:16,"Since IRS started investigating Tea Party tax exempt application IRS is now ""InvestigateRepublicanSupporters""  A return to NixonIntimidation"
333217739290341376,2013-05-11 13:51:14,My nay vote on Marketplace Fairness Act is now more legit w info that perhaps 600 entities cld b auditing business. Told only states audit
332949537394143232,2013-05-10 20:05:30,IRS targeting Conservative groups in Obama reelect yr demands Full accounting. Violates 1st amendment. Admission stunning&amp;2 little 2 late.
332546137896669185,2013-05-09 17:22:32,Great deal of pride&amp;strong tradition Leadership shown- lg. delegation to DC with Greater Des Moines Partnership #DMDC2013
332445794374397952,2013-05-09 10:43:48,"Mr.Hicks gave powerful testimony 4 answers&amp;accountability w/ Benghazi &amp; Re. spin fr WhiteHouse, Susan Rice&amp; Secy. Clinton."
331928431900106752,2013-05-08 00:27:59,Sec of homeland security Napolitano has not answered Qs submitted to her after immigration hearing. How can we markup bill Thurs wo answers
331832068071895041,2013-05-07 18:05:04,Thanks to Microsoft bill gates for briefing republican caucus on his foundation efforts eradicate polio in world  quite humanitarian he is
330741163415969795,2013-05-04 17:50:12,#UNIPanthers The University The cedrFalls/Waterloo community  thanks  Pres &amp;Pat Allen for your service. Enjoy retirement
330685829221584896,2013-05-04 14:10:20,"""Ike""-W'loo saysThe problems we face today are there because the people who work for a living are outnumbered by those who vote for a living"
330521394767093761,2013-05-04 03:16:55,#UNIPanthers THE NEW PRES Ruud arrives in CedarFalls May30
330517664793493505,2013-05-04 03:02:06,"#UNIPanthers I enjoyed ""Imagine the Impact Campaign"" celebration honoring leadership and donors of most successful $158mcpaign+prezAllen bye"
330092228984860672,2013-05-02 22:51:34,"66 ppl at Boone town meeting. ?s abt Globalwarming,FoodStamps, Medicare,Immigration, F&amp;F, SmBiz, Biodiesel,Guns, BringTroops Home, Obamacare"
330048193830207488,2013-05-02 19:56:36,"Q&amp;A w/30 employees Burke Corp-Nevada. ?s abt tax, budget, Common Core, Obamacare, Immigration, Farm bill, DoddFrank, furloughs, foreign aid"
330015139665420288,2013-05-02 17:45:15,"65 ppl - Marshalltown town mtg- ?s abt Immigration, budget, Obamacare, Insider trading, Benghazi, No Child Left Behind, rural transportation"
330013890761068544,2013-05-02 17:40:17,"38 ppl at Eldora town mtg- ?s abt guns, Immigration, mental illness, Infrastructure, sequester, debt, gay rights, Obamacare, NKorea."
329932908951384066,2013-05-02 12:18:30,Justice Dept appeal of unfettered access to Plan B is right thing to do.
329583662813286400,2013-05-01 13:10:43,EPA trying for 2nd time to clawback farmers personal info it released to environ activists. Xposure= accountability. EPA put farmers at risk
329295343839756289,2013-04-30 18:05:02,Great experience w QandA w 41 students at UNI human relations class under tutelage of prof Oakland
328908528670617600,2013-04-29 16:27:58,Read Monday WSJournal editorial abt Congress trying to escape my amendment to ObamaCare requiring us to be in it  it relates my history here
328657521223036928,2013-04-28 23:50:33,Jay Grassley SixPack Volleyball Club team made it to nAtional meet again this yr. Those who follow his 20 yrs of coaching are not surprised
328210134297882624,2013-04-27 18:12:48,At funeral for MarvDiemer Long time Rep St Rep fr CedarFalls. Everybody referred to his very strong aggressive handshake his trademark
326865457472749570,2013-04-24 01:09:32,Reform of student visa program missing in Immigr bill.  Reform needed to stop sham schools&amp; fraud discovered after9-11.
326686753224265729,2013-04-23 13:19:26,Congress shld learn fr Obamacare 2 legislate more&amp;delegate less 2 exec branch w Immigr reform.
326446801269960705,2013-04-22 21:25:57,Nobody disputed at Immig hearing that border won't b secured b4 legalization.
326137709099884545,2013-04-22 00:57:43,"Ways and means chr camp who runs tax writing comm says tax code longer than HolyBible but there is no ""Good News"" in tax code"
326073547090972672,2013-04-21 20:42:46,Imm bill req. DHS Sec to submit plan ONLY on border sec b4millions legal. Then only secure 90% of highrisk areas of S. border b4 citizenship
325690371726245888,2013-04-20 19:20:10,There r 100s opportunities 4 Secretary waive certain provisions in Immigration proposal. Shld that much power b delegated to ExecBranch?
325655729241481217,2013-04-20 17:02:30,If u want save Medicare&amp;$ and give consumer choice read former Sen Daschle  washPost 4/18/13 oped
325399162734645249,2013-04-20 00:03:00,Our judiciary hearing on immigration went well w witnesses other than Secy napolitano b/c she had to b at command qtrs for Boston siege
325213234502180864,2013-04-19 11:44:11,Today start consideration of immigration w Secy Napolitano B4 Judiciary Comm for hearing only
325211222305800192,2013-04-19 11:36:12,So far w respect to the Boston bombing the excellent work of FBI is paying off w apprehension &amp;/or death of one suspect
324118278333157376,2013-04-16 11:13:14,In previous tweet I meant to say it is Ogden HS 42nd annual trip to DC
324117476092817408,2013-04-16 11:10:02,I'm glad to hv bfast w the Ogden HS 42 yrs in row
323249644777902080,2013-04-14 01:41:35,"Beretta in Md
Magpul in Co
Colt in Conn each gun manufacturing c antigun leglation in state MOVE TO IOWA we r not antigun welcome rite to wk"
322841719425077248,2013-04-12 22:40:38,"If u care abt world peace &amp;PaxAmericana read Mark Helprin WSJournal 4/10/13 ""Decline of US Military Strength"""
322840776541347840,2013-04-12 22:36:53,"Glad Obama Admin supports Japan entry TransPacificPartnership-  Markets 4 ag, manufacture&amp; biz. TPP=forum 2 push against restriction on beef"
322815044754747393,2013-04-12 20:54:38,Senate confirming Obama judicial noms: 181-2. Obstruction complaints fr WH don't hold up  Facts in my YouTube address 2day.
322804649822388224,2013-04-12 20:13:20,At the Cedarvalley nonprofit awards luncheon Iowa Lt. Gov. Kim Reynolds gave an outstanding keynote address
322804106731347969,2013-04-12 20:11:11,At the Cedarvalley nonprofit awards luncheon I had the privilege of sharing a table with  MayorJohn Crews of Cedar Falls.
322803447235739648,2013-04-12 20:08:34,Just attended the ninth annual Cedarvalley nonprofit awards luncheon at the University of Northern Iowa
321747194430509057,2013-04-09 22:11:23,I just finished skyping w my university UNI Prof Oakland HumanREASource class  gr8  Qs.  How come Kathy didn't tell me of her operation
321367763492941824,2013-04-08 21:03:40,I really enjoyed skyping wDrWigton public relations class at ISU. Study hard and don't tweet anything I wld not Assume u study hard
321262521073930241,2013-04-08 14:05:28,Sec of State Kerry must get whistleblower Wasserstrom his full award granted by UN panel Paltry 65000 sends signal don't blow whistl at UN
321237966204829696,2013-04-08 12:27:54,"GreatBritain is a greater nation today  from MargaretThatcher leadership.she saved the island fr its Socialist economy 
&amp;gaveMORALleadership"
321007387634974720,2013-04-07 21:11:39,In my 30 town meets last wk VA lack of treating mental issues came up. I'm glad to report VA will hire 1600 to help resolve backlog
320603216456871936,2013-04-06 18:25:37,Congrats to NYCity police for reduce murders. If rate now was what it was in'90 40000 NewYorkers wld b dead
320601957192589312,2013-04-06 18:20:37,As senate starts debate of guns remember: the history of gun control has been compliance by virtuous citizens and cheating by wicked ones
320598509592129537,2013-04-06 18:06:55,"Watch ""FrackNation"" documentary for another pt of view"
320173932944703489,2013-04-05 13:59:48,#99countymeetings I didn't use this hash tag for my tweets on the 30 different counties but all tweets were abt those meetings
319962771179577345,2013-04-05 00:00:43,"57 ppl- Bloomfield. Qs abt Guns, ATFdirector, F&amp;F, SS, not trusting Pres, UNtreaty on guns, immigration, mil cuts, P.O., EPAregs, drones&amp;VA"
319926727897931776,2013-04-04 21:37:30,"51ppl Van Buren Co hospital. Qs abt EPAregs, Monsanto farm chemicals, 5%salary cut for Congress, Guns, sequestration, Foreign aid"
319925525021868034,2013-04-04 21:32:43,"89ppl- Burlington Kiwanis. Qs abt tax, sequester, NKorea, debt, no budget for three years, SocSecurity"
319924930311503872,2013-04-04 21:30:21,"69 students/teachers- Ft Madison HS. Qs abt getting into politics, Senate, Guns, Obamacare, debt, budg,military/college, drones, term limits"
319881890091921408,2013-04-04 18:39:20,"32ppl at Wapello town mtg- Qs abt SocSecurity, DHS bullets, UNgun treaty, Guns, health insurance, Obamacare, budget, ForeignAid, farm bill"
319855485966749696,2013-04-04 16:54:25,"76ppl at Washington co. TownMtg-Qs abt guns, drones, Sequester, VA, Benghazi, Obama vacations, UNtreaty on guns, Animal Welfare Act, Immigr."
319854704177856512,2013-04-04 16:51:18,Auditor Vaught will be greatly missed in IA b/c his willingness 2speak out 4fiscal responsibility. Did Xcellent job&amp; I'm sorry to see him go
319561398504009728,2013-04-03 21:25:49,"Q&amp;A w employees- MackayMitchell envelope co. in Mt Pleasant. Qs abt Postal Service reform, job growth, health care, Rep Party, taxes/budget"
