id,created_at,text
506813264488333312,2014-09-02 14:37:53,"Rockwell City town mtg 49ppl Topics-iA pipeline, immig, VA, inversions, ChildCustody, cancer rsch, sec 179, EPA, debt, ForeignAid, IRS, ISIS"
504716392948846593,2014-08-27 19:45:39,Toured Grandview Christian School in DesMoines Met several classes and attended faculty meeting of 37
504093142690594817,2014-08-26 02:29:05,Spoke at field day for Iowa Corn Growers near Dunkerton  Message: 2% of US grow food for 98% That 2% big job to Xplain farming to city ppl
504089845829226496,2014-08-26 02:15:59,Bfast w Pro Wayne Svoboda CUNY School of Journalism  First conversation since he covered me in 1980 for DesMoines Reg
503701056678019073,2014-08-25 00:31:04,Over 600 ppl came to centennial of JewishFederation of Greater DesMoines   Actor Richard Dreyfus was speaker
502252484354899968,2014-08-21 00:34:58,Today we did 44miles onSandhill Journey It was a windshield tour of famous Sandhills of Nebr hiway 2 To farm tomorrow &amp; town meetings
501869658694496256,2014-08-19 23:13:45,Our last stop today was Devil'sTower   Quite geological rarity. NativeAmericans considered it and black hills sacred
501795821583880192,2014-08-19 18:20:21,"BTW we saw half Iowa vacationing in SoDak. So to b truthful it's nice to hv Iowans come up and say""r u chuck Grassley "" when u not in suit"
501789606304829440,2014-08-19 17:55:39,We r in Hulett Wy eating and viewing biggies collection off Wild Bill Hickok at a museum by that name This was not a stop on honeymoon
501533439162855424,2014-08-19 00:57:44,After MtRushmore mrs G and I went to Crazy Horse monument Started in 1948 u can now see head of Chief When finished it will be worldLargest
501531484990488576,2014-08-19 00:49:58,Continuing revisit of honeymoon trip after 60yrs Rushmore faces same but environs improved beyond xpectation  Foundation is gr8 nonprofit
501457580502577152,2014-08-18 19:56:18,Our visit to Mitchell SD took us also to Sen Geo McGovern Library. It was closed wkends. So barb and I just took our picture beside GeoStatu
501172915954778112,2014-08-18 01:05:09,"WallStJournal ""we union members oppose new(EPA )anti carbon rules that will cost jobs and endanger the grid"" That is electric workers union"
501156623742930944,2014-08-18 00:00:24,60th anniversary.  Now at famous Wall Drug Wall SD
501122207251439617,2014-08-17 21:43:39,Like we did 60 yrs ago on honeymoon we visited Mitchell SD famous CornPalace The corn murals were many more than in '54  and jus as butiful
501094208040865793,2014-08-17 19:52:23,Retracing our honeymoon of 60 yrs  we are now in SoDak Badlands
499716819620741121,2014-08-14 00:39:08,"Humboldt town hall w 51 people Topics-immig, voter ID, Obamacare, foreign aid, Israel, Sec179 expensing, Iraq, IRS, min wage, EPA regs"
499666599339913217,2014-08-13 21:19:35,"Pocahontas town hall w 38 ppl Topics-immig, Congo adoptn, terrorism, Iraq, EPA, debt, welfare, Obamacare, Benghazi, IRS, Reid running Senate"
499623545081974784,2014-08-13 18:28:30,"Q&amp;A w 46 ppl at Iowa Great Lakes Rotary Topics-Reid impeding House passed bills, Iraq, aiding Kurds, immig, housing, debt, Israel/Hamas"
499598642286956544,2014-08-13 16:49:33,"Estherville town hall w50 ppl Topics-worry abt Reid/Senate, Ukraine, tax extenders, IRA, coal, Iraq,Syria, immig, military/faith, TermLimits"
499570134055665665,2014-08-13 14:56:16,Toured cellulosic part of POET Emmetsburg ethanol plant. Had Q&amp;A w 25 employees on what U might expect...ethanol
499340278814502912,2014-08-12 23:42:54,"Spencer town hall mtg w 28 ppl Topics-pipeline, electric trans lines, med marijuana, wind energy, immig, Iraq, fast&amp;furious, min wage, debt"
499307361832828928,2014-08-12 21:32:06,"Sheldon town hall mtg w 32 ppl Topics-  Debt, VA, Bergdahl, Lewis and Clark water, Hamas funding, guns, Obamacare, GMO labeling, immig"
499276020424654848,2014-08-12 19:27:34,"Sibley Town hall mtg w 36 ppl Topics-inversions, EPA regs, tax hikes?, immig, partisanship, energy, Russia, term limits, common Core"
499247144747155456,2014-08-12 17:32:49,"Rock Rapids Town Hall mtg w 46 ppl Topics-EPA regs, IRS, immigration, Common Core, Lewis and Clark, Iraq, pipeline"
499214791203127298,2014-08-12 15:24:15,"Sioux Center town hall mtg w 49 ppl Topics-immigration, Obamacare, Lewis and Clark, EPA regs, min wage, Israel/Hamas"
499186863576731650,2014-08-12 13:33:17,"Q&amp;A w Le Mars Kiwanis 29 ppl Topics-natl debt, immig, marijuana, partisanship, Iraq, VA, 2016 president election"
499007631412187136,2014-08-12 01:41:05,I'm in Lemars Iowa overnite to do 10county meetings in NW Iowa Tues&amp;Wed. After this wk I will hv 11counties to finish 99counties for 34th yr
498975840290357248,2014-08-11 23:34:45,I talked w Dan Looker Successful Farming at farm abt crops on Grassley farm see iview at http://t.co/Cp81zv9DPf
498586237226057728,2014-08-10 21:46:36,Went to Memorial service for Bob Formanek my HS baseball coach WWII veteran. Life long educator Lots of NewHartford ppl celebrated his life
498201616953393152,2014-08-09 20:18:16,Obama Trade Representative Froman visited Iowa State Fair Besides walking fair he had meeting 21 ag leaders for discussion of trade update
498112552665358337,2014-08-09 14:24:21,At IA State Fair. Barbara cancer survivor. Works for cancer cure. Don't believe me just as me http://t.co/twrqolCVWv
498105907893792768,2014-08-09 13:57:57,Enjoyed seeing butter cow at state fair this morn @whohd http://t.co/Fal85BrTl2
498102940817965056,2014-08-09 13:46:10,Famous IA State corn dogs. Great: if you don't believe me just ask me. http://t.co/2OYz0mOon3
498096133814513666,2014-08-09 13:19:07,Second day at the IA State Fair. Famous butter cow: if u don't believe it just ask me. http://t.co/ZA2HIrerQm
498095130679980032,2014-08-09 13:15:07,Second day at the great Iowa State Fair. Great: if you don't believe it just ask me. http://t.co/SMdroXBCt3
497911272374300673,2014-08-09 01:04:32,First of two days at Iowa St Fair Perfect weather resulted in masses attending Had lots of Qs as I walked among constituents
497863464564432897,2014-08-08 21:54:34,Update the BIG BOAR 2014 Iowa State Fair http://t.co/4l1I8wngUZ
496866171980107776,2014-08-06 03:51:41,Between 2010&amp;2013 the number of terrorist or those w connections to same in the govt data base more than doubled to a million
496777279058767872,2014-08-05 21:58:27,"Tour and Q&amp;A at Edgewater Retirement Community 116 ppl Topics-taxes &amp; debt, Medicare, health care reimbursement"
496744623155712001,2014-08-05 19:48:41,Finished tour and discussion Primary Health Care in Des Moines w  27 patients doctors medical residents about health care policy
496330585183625216,2014-08-04 16:23:27,I urge all Americans to take to heart the warnings of 2014 on 10th anniversary of the Terror Comm report 5/5
496329487827890176,2014-08-04 16:19:05,"According to WSJ, Terror Comm Chair Kean said “the sense of alarm surprised me. I have not heard this much concern since 9/11” 4/5"
496328616847093762,2014-08-04 16:15:38,10 yrs ago Terror Comm feared Iraq wd become failed state New report says “that nightmare scenario may now becoming to pass.” 3/5
496328012296884225,2014-08-04 16:13:14,Terror Comm sees cybersecurity as major threat which govt needs 2 address 2/5
496327418853212160,2014-08-04 16:10:52,Terror Commission say 10 yrs after 1st report US faces more threats&amp; public is complacent &amp; doesn’t realize potential 4 danger 1/5
496133325472669696,2014-08-04 03:19:37,10yrs after the 9/11 commission reported members gathered for a review on status&amp;threat of terrorism  Conclusion: worse than expected
496031535334981633,2014-08-03 20:35:08,Talk abt income inequality!!Obama'sFedReserve printing$$(creating asset bubble) causing the income inequality Assume Dems approve Heips 1%
496028998649257984,2014-08-03 20:25:03,Why not same outrage when Arabs kill Arabs OR ISIS militants killing Christians in Mosul as there is disapproval of Israel defending itself
495584426676748288,2014-08-02 14:58:29,"Just ran 5K in Dike Iowa famous Watermellon Days celebration   ""Dike,, a Slice of Iowa """
495301586311446529,2014-08-01 20:14:35,Dem Majority Leader says US Sen will debate the Democrats’ constitutional amendment to LIMIT FREE SPEECH when Senate returns in Sept. SCARY
495259962692874241,2014-08-01 17:29:11,Just had lunch at Joensys in CenterPoint Had famous tenderloin The Qs fr customers were mostly abt returning young migrants Control border!!
493209101070266368,2014-07-27 01:39:47,Quite lucky.  Tonite there is actually history on the channel w that name.  Finally!!!
493195520840445952,2014-07-27 00:45:49,I just tried History Channel.   Hurry. It's showing WWI
493061492216844288,2014-07-26 15:53:15,I urge Iowa 40plus institutions of higher ed to read 2day WStJournal abt what Pres Daniel of Purdue is doing to get more bang for $$HELPKIDS
493060275633782784,2014-07-26 15:48:24,Parents Governors Boards of Trustees shld read 2days WStJournal article abt PresDaniels effort to make  PurdueU more$$$$ value education
493043175187947521,2014-07-26 14:40:27,Israel military protects civilians/seeks to not harm noncombatants On contrary Hamas uses civilians as human shields as they go4 Israelis
492760138822868992,2014-07-25 19:55:46,Just at funeral of fmrStSenator 96yr28 yrs a legislator I servd w him Knew him as least partisan Democrat Ppl b4 Partty that's Berl Priebe
490262886535942146,2014-07-18 22:32:35,Hamas=terrorist org 4 destruction of Israel. Israel defending against Unprovoked attacks/Israel hs right 2defend citizens&amp; survival of State
490180954258800640,2014-07-18 17:07:01,If at first u don't succeed sky diving is not for u
489542684508700672,2014-07-16 22:50:45,Just heard at admin brief on border issue that HHS pays b/n $250 &amp; $1000/day to house each undocumented border crosser. Seems ridiculous!
488985706644398080,2014-07-15 09:57:32,2day SenateJudiciary will have hearing on Demo sponsored bill that wld strike practically all all state laws putting restrictionsON abortion
488982394272514048,2014-07-15 09:44:22,Considering the large drop in price of corn in last two weeks I expect corn price to go up considering autumn weather in Midwest this week
488808221692678144,2014-07-14 22:12:16,Listened 2 Charles Krauthammer speak to Senate interns 2day. Presentation was very good. My 1st time hearing him in person. Very impressed
488709355500748800,2014-07-14 15:39:24,U of Minn Stephen Parente study shows that in 10yrs there will be 40million uninsured under obamacare roughly 10% mote than today
488704760129019904,2014-07-14 15:21:09,"Pres bush CIA director said""al Qaeda is on the verge of strategic defeat in Iraq""  At that time PresObama took command"
488694739903217664,2014-07-14 14:41:20,"When confronted w info fr any""computer model"" any congressman should ask if the model is for cause of advocacy or search for truth"
486091019860344832,2014-07-07 10:15:04,Friends in Russell garage said stop in see them.  BTW when do u start Uber?
485140281914716160,2014-07-04 19:17:11,Happy Independence Day    Thank God for the enlightened ppl 239yrs ago who declared the establishment of an ExceptionalNation.
485126023399215105,2014-07-04 18:20:31,Just finished well established/attended Clear Lake 7/4th parade I walked w St Rep Linda Upmeyer One mile route but Two miles of participants
485124665845637121,2014-07-04 18:15:08,David Oman did very well substituting for jan Michaelson on WHO radio this morn
484759640992153600,2014-07-03 18:04:39,"Q&amp;A w West Branch Lions Club 39 ppl Topics-Immigration, college loans, energy, farm bill, mental health, Obamacare, EPA regs"
484459425143750656,2014-07-02 22:11:42,"Q&amp;A w 49 people Air Control Inc-Clinton Topics-Obamacare, SocialSecurity, TermLimits, taxes, ExIm Bank, ExecOrders, Gitmo prisoner release"
484406229876629504,2014-07-02 18:40:19,"Q&amp;A w Mt Pleasant Noon Rotary 29 ppl Topics-Hwy bill, immigration, SCOTUS rulings, Welfare, confidence in govt, SGR"
484365176431714304,2014-07-02 15:57:11,"Muscatine Town Meeting 58 ppl Topics-immig, foreign aid, VA, EPA/coal, taxes, pipeline, navigable rivers, regs, common core, partisanship"
484102983668760576,2014-07-01 22:35:20,"Columbus Junction Town Meeting 35 ppl Topics-SNAP, impeachment, VA, college loans, IRS, pipeline, UN Gun Treaty, NLRB"
484068438739283970,2014-07-01 20:18:04,"Q&amp;A w Keosauqua Rotary Topics-Tax reform, estate tax, partisanship, term limits, min wage, keystone pipeline, Obamacare"
484040806412476416,2014-07-01 18:28:15,Traveling across Iowa for my county meetings I see tremendous damage done by wind and flooding  Tremendous downpours/dangerous driving
484008740568694784,2014-07-01 16:20:50,"Q&amp;A/tour w 200 employees Siemens in Fort Madison Topics-wind production tax credit, IRS/EPA regs, Iraq, VA, Obamacare, immig, welfare reform"
483978136582119425,2014-07-01 14:19:14,"Mediapolis town mtg 43 ppl Topics-flat tax, immigration, foster care, war powers, IRS, VA, Common Core, PLO, debt, Senate majority ldr"
483578250984038401,2014-06-30 11:50:14,"Somebody tell bloomberg News that their format for ""TopNews"" is awful. I assume u r suppose to read it."
483238907127934977,2014-06-29 13:21:48,Almost 800 runners in 5K/half marathon at CedarFalls (SturgisFalls )celebration   I ran 5K
482950130174152705,2014-06-28 18:14:18,Kept invite to be in SturgisFalls parade very large crowds  SturgisFalls is original name for CedarFalls .Four day annual celebration
482689439374647298,2014-06-28 00:58:24,Tonite I spoke at celebration of completion of Conrad Iowa MainSt Revitalization project  StRep Pat Grassley also spoke Beautiful downtown
482581995478720512,2014-06-27 17:51:28,There is history on the History Channel rite now  Tune in before they go to swamp man
480046692008747008,2014-06-20 17:57:04,Fed govt needs better oversight of research money- worried about tax $ lost to fraud&amp; too few held accountable
479020726121684992,2014-06-17 22:00:15,met veterans from Cass County honor flight at WWII Memorial Thanks for service Honor to meet these Patriots
479015561834553344,2014-06-17 21:39:44,Appreciate Sec Vilsack keeping AG frnt&amp;ctr in trade talks w EU Must have substantive progress on ag B4 approved…TPA KEY to everything
478708756771905536,2014-06-17 01:20:36,1/many needs of foster kids is help w managing $  Eddye Vanderkwaak-Ankeny&amp; former foster youth spread word today inDC
477839361396862976,2014-06-14 15:45:56,"Iraq today... Yes PresObama Osama ben Laden is dead But al Qaeda is no longer"" on the run"""
477838211125760001,2014-06-14 15:41:22,WhiteHouse reportsVPBiden on top of Iraq events in SutuationRoom I'm reminded that then SenatorBiden had a plan to split Iraq into 3 parts
477619517212745729,2014-06-14 01:12:21,LoisLerner of IRS will never be prosecuted by tHolder So I don't understand why they destroyed 2yrs of her emails abt nonprofit politicals
477617684482240514,2014-06-14 01:05:04,REALLY!!!The IRS says they lost 2yrs of her emails How convenient when IRS is under investigation for unconstitutional action agstConservtve
476430109109256192,2014-06-10 18:26:04,Thursday is Pres Geo H W Bush 90th birthday. Thank u for service as President and  especially for defending freedom as airman WWII
475467277794832384,2014-06-08 02:40:07,Finally history on History Channel. Learn abt challenges facing Allies 2month after DDay
475284193778233344,2014-06-07 14:32:36,"Five K race at ""BeaverCreekDays"" my hometown NewHartford  Time 37:17
Thanks to organizers who occasionally came around said ""U doing well!"""
474950736972099584,2014-06-06 16:27:34,Dday 70th anniversary is another opportunity to thank veterans and military today for sacrifice defending our America and freedoms/liberty
474949869170610176,2014-06-06 16:24:07,I was 10yrs old on Dday Never then appreciate soldiers sacrifice On TV today reminded of the sacrifice We owe so much to GreatestGeneration
473494198508077056,2014-06-02 15:59:48,US manufacturing returning slowly. Chinese labor costs up We hv cheaper natural gas Incude shipping&amp;inventory we compete Germans 2xUS nrg$$
472546413809659905,2014-05-31 01:13:39,"Tour at Al Jon Ottumwa &amp; Q&amp;A w community leaders Topics-hwy funding, Econ development, energy policy, trade, EPA regs, FDA, ExIm banks"
472545453402517504,2014-05-31 01:09:50,"Bloomfield town meeting 13 ppl Topics- EPA regs, VA, Benghazi,govt waste,immig, Marine Mexican jail, RFS,guns, DoD cuts, TaxReform,pipeline"
472451507317510144,2014-05-30 18:56:31,"Q&amp;A tour w 23 ppl Lee Container Centerville Topics-jobs, VA, Obamacare, farm bill, rural development, guns, 1st &amp; 2nd amendments"
472451109555290113,2014-05-30 18:54:56,"Q&amp;A tour w 44ppl RELCO Albia Topics-Obamacare,EducLoans,immig,VA, ExecOrders,GovBailouts, DefenseBudget,welfare,guns,whistleblowers,pipeline"
472387295350247424,2014-05-30 14:41:22,"Pella Town Meeting 48 ppl Topics-VA, EITC, Obamacare, NCLB, debt, immigration, guns, federal reserve, term limits"
472108092810080257,2014-05-29 20:11:55,"Chariton town meeting 26 ppl Topics-GMO labeling, immig, debt, Peace Corps, defense budget, VA, guns, EPA regs, Fast&amp;Furious, Benghazi"
472077537917423618,2014-05-29 18:10:30,"Q&amp;A tour w89 ppl East Penn Manufact Corydon Topics-Obamacare,Crimea, VA, CleanWaterAct, guns, WelfareReform, SocialSecurity, immig, pipeline"
472077389413892096,2014-05-29 18:09:55,"Q&amp;A w 37 students&amp;teachers Central Decatur HS Topics-student aid, livestock disaster help, debt, Rural Dev, Afghanistan, Term Limits, guns"
472021494579863552,2014-05-29 14:27:48,"Q&amp;A tour w 29 ppl at Miller Products Osceola Topics-debt,FEMA, Fast&amp;Furious, FreeTrade,middle class, Obamacare, CorpTaxes, paying fair share"
471822137053835264,2014-05-29 01:15:38,"VA IG interim rpt shws widespread probs. Need to learn if delays led to prevntble deaths. When IG done, need hold people accountable"
471800562380320768,2014-05-28 23:49:54,"Mount Ayr Town Meeting 34 people Topics-Fast &amp; Furious, Benghazi, pipeline, tort reform, Obamacare, guns, EPA regs, partisanship"
471800440397373440,2014-05-28 23:49:25,"Q&amp;A tour w 26 ppl Creston Bean Processing Topics-Ukraine, waterways, trade, debt, partisanship, road funding"
471721435942363137,2014-05-28 18:35:29,"Atlantic Town Meeting 53 ppl Topics-VA problems, Obamacare, Benghazi, Reid, Common Core, Marijuana"
471685627553935360,2014-05-28 16:13:11,"Greenfield TOwn meeting 51 people
Topics-highways, immigration, voter ID, Syria, partisanship, EPA regs, guns, XL pipeline, debt"
471662078822871041,2014-05-28 14:39:37,"Q&amp;A tour w 32 employees Grip-Tite Manufacturing in Winterset Topics- Obamacare, Social Security, partisanship, taxes, gun rights"
471006207348449280,2014-05-26 19:13:25,Every day we shld honor brave Americans who hv given their life to save freedoms we have But especially on Memorial Day  we owe al so much
470668435752747008,2014-05-25 20:51:14,Just attended DikeNewHartford graduation 60 graduated  one of them my youngest grddaughter CarrieGrassley She is UNI bound
469593062701019137,2014-05-22 21:38:05,Russia China energy deal highlites importance of energy security&amp;approving keystone XL pipeline
469584514080337920,2014-05-22 21:04:07,Russia/China Gas deal emphasizes impt USenergy independence 4 economy&amp;natl security-need use resources God gave us+develop alternatives
469533246876049408,2014-05-22 17:40:24,Gr8 Honor Meetng gold star mothers advocate at USCapitol today Susan Simmons from Iowa City check Facebook for photo
469140918692761601,2014-05-21 15:41:25,Ran road race this AM at 3 mi. ACLI Capital Challenge benefits org that gives guide dogs to blind veterans check Facebook later 4 pics
467689585082765312,2014-05-17 15:34:20,Another wkend UNI butiful campus Now MS Charity walkathon Diane Zabel of Sumner invited me She determine to walk w cane she told me BravoDI
467460203295039488,2014-05-17 00:22:52,RT @jcg6pack: Time to mow the yard!   Good ole iowa ingenuity @ChuckGrassley http://t.co/05uJWvQCQs
466704861963505664,2014-05-14 22:21:24,History in Senate tonite Congrats to Diane  Humetewa for become 1st Native American woman to be fed judge
465134448107732993,2014-05-10 14:21:08,At UNI ROTC commissioning ceremony PresRuud was speaker. He was an army captain  His very good advice to new 2ndLt was from his own service
465133453042651136,2014-05-10 14:17:11,Just leaving commissioning ceremony of UNI ROTC 2nd Lt  beautifully quiet campus on gradu8ing day As I walk among older blding MANYMEMORIES
464481022932160512,2014-05-08 19:04:40,Obama should approve keystone for jobs in US- otherwise pipeline&amp; jobs go to china
463783406153641985,2014-05-06 20:52:35,Thx Christine&amp;Lorib for coming to talk to me abt S865 I support this bill It's time to end breast cancer
462369530703265792,2014-05-02 23:14:21,Looks like WH misleading American ppl AGAIN check my website to see Benghazi email on talking points from WHITE HOUSE
461465865771548672,2014-04-30 11:23:30,Congrats 2EmilyBrodie and UNI Dance Marathon for $176000 raise this year 4  UofI Children's Hospital Every Yr the $$get larger KeepUpGoodWk
461267160359514112,2014-04-29 22:13:55,CONTINUED delays by President w/approving Keystone XL=lost job opportunities for Americans. Irresponsible 2keep kicking CAN
459805646360444928,2014-04-25 21:26:23,"Q&amp;A w112 ppl at Nationwide Ins-Topics-national debt, nuclear option, government shutdown, Obamacare, Ukaine, Fast&amp;Furious oversight"
459773100343980032,2014-04-25 19:17:03,"Q&amp;A w 38 students/teachers at Newton HS Topics-termlimits, Ukraine, Tuition INCREASE, Borlaug, tort reform, TWITTER, Military cuts, RFS"
459762268029210624,2014-04-25 18:34:01,I'm at the newton HS
459739301925117952,2014-04-25 17:02:45,"Q&amp;A w 104 students/teachers at Grinnell HS Topics-Partisanship, gay marriage, campaigns/finance, debt, Senate GOP control, filibusters"
459710658226192385,2014-04-25 15:08:56,Good MTG &amp; Q&amp;A w approx 60 Americorps students/leaders/community members in Vinton-1 of 5 campuses in U.S.
459014319179845632,2014-04-23 17:01:56,"SHOULD GOP win Senate, High on  our agenda in 2015 will be Keystone pipeline and more domestic energy"
459003890814287872,2014-04-23 16:20:30,How can IRS gv bonuses 2 employees disciplined/not paying own taxes? More loss of public trust
456471659537395713,2014-04-16 16:38:19,"Q&amp;A w 85 PanoramaHS students-Panora Topics-Obamacare, partisanship, CollegeAid, MinWage, ExecOrders, FBI, approps, advice to 1st time voters"
456438683298578432,2014-04-16 14:27:16,"Audubon Town Hall Topics-email privacy, road funding, Benghazi, F&amp;F, IRS, pipeline, biofuels tax credit, RFS, Rights of Parents"
456206001524736000,2014-04-15 23:02:41,"Harlan Town Hall 31 ppl Topics-Ukraine, PostOffice,Obamacare, GasTax,regs, SocialSecurity, Benghazi,ForeignAid, FlatTax, immig, debt,MinWage"
456181456281542656,2014-04-15 21:25:09,"Woodbine Town Hall 21 ppl Topics-trucker regs, Obamacare, FedReserve, bullets/FEMA, UN guns, Nevada&amp;cattle, debt, immig, EPAregs, CommonCore"
456151418835980288,2014-04-15 19:25:47,"Q&amp;A w 85 Saint Albert HS students-Council Bluffs Topics-college$$$, marijuana, Obamacare, FarmBill, SNAP, gov’t regs, Qs abt being a senator"
456108424829599745,2014-04-15 16:34:57,"Q&amp;A w 100+ Glenwood HS students Topics-flag burning, voter ID, guns, debt, drug testing, CommonCore, GMO, OBamacare, marijuana, college cost"
455830703096492032,2014-04-14 22:11:23,"Hamburg Town Hall-Topics-Flood ins, hospital non-profit, flood control, endangered Species, taxes, EPA navigable river, Ukraine, HeadStart"
455795955305304064,2014-04-14 19:53:18,"Q&amp;A w 83 Clarinda HS students 17 Qs Topics-NSA, deficit, whistleblowers, fiscal policies, process of Senate, how I got involved in politics"
455760900230627328,2014-04-14 17:34:00,"Red Oak HS Topics-GayMarriage, Marijuana, Abortion, Obamacare, SocialSecurity, Guns, MinWage, Ukraine, SNAP, EPA, religion in schools"
455760554498727936,2014-04-14 17:32:38,Q&amp;A w 95 Red Oak HS students-30 Qs Some topics in next TWEET
455731215677804544,2014-04-14 15:36:03,"topics from Bedford-GayMarriage, jobs, MinimumWage,Ukraine, Marijuana, abortion, guns, FarmBill, Obamacare, immig, religion &amp; schools, NSA"
455730892435374080,2014-04-14 15:34:46,Q&amp;A w 190 Bedford Middle/HS students-25 Qs. Some Topicsin next TWEET
455704245866885120,2014-04-14 13:48:53,"Corning Town Hall (there’s SNOW!)-9 ppl-Topics-NCLB, farmers, IRS/Benghazi, IRS refunds, Common Core, partisanship, guns, VA problems"
455039586008174592,2014-04-12 17:47:46,30ppl at Faith Wesleyan church men bfast. Some women too. Q&amp;A  deficit executive orders foreign aid BLM/cattlemen guns freedomOFreligion
452198122073378817,2014-04-04 21:36:48,"Tour/Q&amp;A w 55 employees at Osmundson mfg in Perry Topics: natl debt, immig, renewable fuels, food stamps, farm bill"
452197214371467264,2014-04-04 21:33:11,"Good mtg w ldrs of IA Homebuilders Assn Talked abt tax reform, EPA regs, Fannie/Freddie, home mortgage deduction"
451844607144636417,2014-04-03 22:12:03,Praying 4 Fort Hood families
451844248577781761,2014-04-03 22:10:38,"R&amp;D tax credit helps companies innovate, create jobs Why not small biz too? My amendment passed in FINANCE Com will help"
451843769638600704,2014-04-03 22:08:44,"Biodiesel frm soybean, cooking oils REDUCES greenhouse gasses I helped to restore key tax incentive in FINANCEcom today"
451843272609370113,2014-04-03 22:06:45,"Wind energy =breath of FRESHair FinanceCom approves my amdnt 2extend tax incentives-help support jobs, manufacturing"
450364372150259713,2014-03-30 20:10:08,"Reagan's plan for peace was based on""the vital margin of safety""Not threat of war;a marginal advantage in negotiations Fear of our military"
