id,created_at,text
606503865815547904,2015-06-04 16:52:44,I met with Gilbert Middle School students for a photo and a few questions on the Senate steps. https://t.co/5Bxl3BbP4h
606432691182006272,2015-06-04 12:09:55,First regular meeting of the Iowa delegation this congress-we will do this often https://t.co/p1FjzFFIs7
606199474537558016,2015-06-03 20:43:12,Here I am with the Stilwell's from Des Moines. https://t.co/jIzToYzfyG
606198289264967680,2015-06-03 20:38:29,The Fangman family from Waterloo stopped for a picture after their Capitol tour. https://t.co/8TG0XEySpE
606197984653656064,2015-06-03 20:37:16,This is the Lenz family from Ames. https://t.co/vNtfpsnnkv
606126614649401344,2015-06-03 15:53:40,I met with Sibley-Ocheyeden FFA Juniors and Seniors on the Senate Steps today. https://t.co/LeFLeVFjR0
606075743752364033,2015-06-03 12:31:32,Dr Adam Schwartz Director of Ames Laboratory.  I missed appt w him yesterday bc of senate vote https://t.co/Q5UdMNMkxg
605848829208854528,2015-06-02 21:29:51,Dr. Ed Brown from DSM is being inducted to the American Medical Group Association Hall of Fame. I… https://t.co/ppG2AiI81k
605793353473486848,2015-06-02 17:49:25,Cost of obamacare health plans skyrocketing saysHHS report Ala28%/Ar39%/Ida24%/Ks28%/NM52%/NC20%/Ok44%/Ut58%/Mt23%/Ill38%/Alaska39%SomeXpls
605433523265224706,2015-06-01 17:59:35,Thanks to the Pres for signing the Human Trafficking Bill that came out of my committee 19-0. Did he sign it Fri pm so no one would notice?
604482078344941568,2015-05-30 02:58:52,Mt Pleasant town mtg Topics-Benghazi VA/Mental illness AssetForfeiture Sentencing FISA EPAregs Keystone Taxes Trade #99countymeetings
604413070518177792,2015-05-29 22:24:40,#99countymeetings at AccessEnergy Mt pleasant 37ppl Lots Q&amp;A. Mental health discussed more than usual https://t.co/dOAM5JLxKe
604386761167380480,2015-05-29 20:40:07,Keosauqua town mtg 32 ppl Topics-Defense spending Immig Sharia law Patent trolls EPA regs Natl debt Rural pharmacies #99countymeetings
604382636400885760,2015-05-29 20:23:44,#99countymeetings  VanBuren County Courthouse in Keosauqua Great Q&amp;A with constituents! https://t.co/GRB4WI7c5Q
604352987385831424,2015-05-29 18:25:55,EPA danced to tune of BigOil on release of RFS standard cutting back required use of ethanol Why hurt alternative energy?'
604350502126624768,2015-05-29 18:16:02,Keokuk town mtg at hospital 104 ppl Topics-Hospitals/Econ development Medicare fraud Recruiting docs Student loans #99countymeetings
604329800275202049,2015-05-29 16:53:46,#99countymeetings  Keokuk Hospital tour and Q&amp;A with employees. https://t.co/ZXbjMj69zb
604305563573456897,2015-05-29 15:17:28,West Burlington town mtg 37 ppl topics- immig TPP term limits sect 179 patriot act gay marriage Tricare NCLB EPA regs #99countymeetings
604304916807598081,2015-05-29 15:14:54,Ft Madison town mtg. 58 pple topics- Soc Sec disability ntl debt VA COOL Tax extenders Military cuts TPP Whistleblowers #99countymeetings
604042984196313088,2015-05-28 21:54:04,"#99countymeetings  Genesis Health System Davenport, Emergency Department tour and Q&amp;A with employees. https://t.co/ou1q63UMSj"
604017683663818752,2015-05-28 20:13:32,John Deere Corporate HQ Town meeting with employees and live streaming. Lots of good questions https://t.co/xMkUs04YQx
603997609846566912,2015-05-28 18:53:46,DeWitt Lions Club Q&amp;A Topics-ISIS Budget Patriot Act Medicare Obamacare   Taxing credit unions NCLB Trade #99countymeetings
603994394102988801,2015-05-28 18:40:59,#99countymeetings DeWitt noon Lions Thanks for the great lunch!and Q&amp;A https://t.co/jKhy6romSU
603964238890164224,2015-05-28 16:41:10,HUSCO Int. Maquoketa Q&amp;A Topics-Gas tax Min wage Economy Corporate tax Job outsourcing Welfare #99countymeetings
603961316194279425,2015-05-28 16:29:33,#99countymeetings Husco Mfg. Maquoketa Thanksfor the tour and  Q&amp;A with 55 employees. https://t.co/1bcDmM04jW
603934052517838848,2015-05-28 14:41:13,Tipton town mtg Topics-Environment Bipart. Immig WindEnergy Child Dev grants SNAP Israel FCC Taxes ForeignAid Abortion #99countymeetings
603931889569792000,2015-05-28 14:32:37,#99county meeting Tipton 30 ppl  Good questions https://t.co/Fkc8ogmV9k
602493925434068992,2015-05-24 15:18:40,"Justice O'Conner""American students are alarmingly unfamiliar with the essential elements of democracy"" Bad test Try http://t.co/sKDpeRlkWW"
602236084102139905,2015-05-23 22:14:06,Do something to honor fallen soldiers and deceased veterans this weekend. In so doing u and I show appreciation for those defendingFreedom
601923258968055808,2015-05-23 01:31:02,Trade Promotion Authority passes senate 62/37  48republicans14Dems. Can u believe:Republican and Obama together. Very rare
601890895118659585,2015-05-22 23:22:26,CedarFalls/Christians mourned passing of a great Christian pastor Homer Larsen of Nazareen Luthern  today funeral GodBless family&amp;friends
601469245453692928,2015-05-21 19:26:57,Iowa Farm Equipment Dealers--Issues included tax reform &amp; WRRDA https://t.co/Lm6JMGufVu
601400928357523458,2015-05-21 14:55:29,Plsd to be at enrollment ceremony when Speaker Boehmer signs Trafficking Biil that I shepherd thru… https://t.co/m1nkEYzjIm
601139548312199170,2015-05-20 21:36:51,Commissioner David Jeffrey from the Salvation Army. https://t.co/cCPhYN6jav
601126842213470209,2015-05-20 20:46:22,Meeting with Iowans from the American Land Title Association. https://t.co/ym7aFY7hWR
601126081991680000,2015-05-20 20:43:20,This is Robin Walenta from West Music Company with six locations in eastern Iowa. We discussed the… https://t.co/ZikizNnL9U
601116320038526976,2015-05-20 20:04:33,Always nice to see Iowans in town with NAIFA. https://t.co/YHp1CfkuOt
601109533944066048,2015-05-20 19:37:35,I talked with the Council Bluffs Chamber of Commerce https://t.co/XNX2P99jEG
601093977765486594,2015-05-20 18:35:46,Just spoke to the Lions Club International leadership so I brought my vest from home. I'm a member of… https://t.co/NEaFyBLjO1
601054392255684608,2015-05-20 15:58:28,Brandon from Ames High School and his teacher showed me their poster for Project Localize. https://t.co/ItwiMULnLM
601052220013072385,2015-05-20 15:49:50,Seniors from Clear Creek Amana stopped by for a Q&amp;A. https://t.co/axK28Jltbm
601027560064057344,2015-05-20 14:11:51,34th annual ACLI cap challenge was this morn 4 charity. Team Grassley has participated for 14 of the last 16 yrs. 5 staffers and I ran today
600991132068249600,2015-05-20 11:47:06,Team Grassley before the annual ACLI Challenge. We will run three miles to benefit FIDELCO Guide Dog… https://t.co/ye4iwu9BqI
600779089478361090,2015-05-19 21:44:31,I met with Engine Advocacy to hear about their work and views on patent reform. This group represents… https://t.co/Ffra7LDqUr
600764305001291776,2015-05-19 20:45:46,Matt and Mason Reisetter are in town. They are going to see the Yankees play the Nats...Go Cardinals! https://t.co/t1bGE72JpE
600757904673636353,2015-05-19 20:20:20,Nashville Songwriters Association talked copyright with me. Songwriters Marv Green and Troy Verges… https://t.co/dJsIpnUBoc
600743554051346432,2015-05-19 19:23:19,CPAs from Iowa met with me just now. We talked about the IRS and other issues that affect them. https://t.co/yeFCFMPmax
600732993297240064,2015-05-19 18:41:21,Glad house passed trafficking bill Ready 4 president's sig Reported by my Judic Com 19-0 Bill is MUST 2 help victims heal &amp; keep others safe
600692894886981633,2015-05-19 16:02:01,Enjoyed speaking with folks from the Eastern Iowa Honor Flight this morning. It's always a memorable… https://t.co/ZdEgYJxP29
600692196065542145,2015-05-19 15:59:14,Beautiful day at WW2 greeting veterans. I was lucky and ran into my good friend Sen. Bob Dole. He was… https://t.co/xfAmbbLOAy
600389122751082496,2015-05-18 19:54:56,Grateful for the recognition from First Focus Campaign for my work. I am a recipient of the 2014… https://t.co/ObyvD40QkO
600384454834683904,2015-05-18 19:36:23,Iowans with Ducks Unlimited spoke with me about conservation and agriculture. https://t.co/hl5VVS4kYt
599618378677014529,2015-05-16 16:52:16,Troop 207 in Coralville Morrison Park  QandA w BoyScouts. Today https://t.co/xptIJQDbpf
599403350480793600,2015-05-16 02:37:49,Tonight I attended Waterloo Christian School Program wasFreedom it was Patriotic. Picture w one of… https://t.co/OR919dnCRP
598945890498383872,2015-05-14 20:20:02,Dawn Cayton from Marion stopped in to say hi. https://t.co/OreqHIOmYe
598927391902302209,2015-05-14 19:06:32,"These Iowa DNR officers are from Jefferson, Cedar Rapids and Elkader. They are in DC for Police Week. https://t.co/zgRUv5DEHI"
598926412981108736,2015-05-14 19:02:39,The Siehlmann Family from Forest City just stopped by before their Capitol tour https://t.co/c11fgALkJ2
598875226311647232,2015-05-14 15:39:15,I met with May Term students from Simpson College in Indianola on the US Senate Steps today. https://t.co/FgBH7geu6r
598639657497268224,2015-05-14 00:03:11,"Since Senate in session I had staff on site bc of LakeCity tornado Jacob reported""I am totally impressed by town's resiliency &amp; efficiency"""
598599171520724992,2015-05-13 21:22:18,Met with members of Iowa State Police association in town for National Police Week. Thank you for… https://t.co/PlrY42zBCr
598585892714983424,2015-05-13 20:29:32,Met with Pat and Charles Verheul of Altoona https://t.co/wI2fHU8CCT
598585607896625154,2015-05-13 20:28:24,John and Randi Stern of West Des Moines https://t.co/Mi4i8raAjI
598573491324112897,2015-05-13 19:40:15,Just met with the Iowa Pharmacists. https://t.co/P5rkLixxkl
598210822465290240,2015-05-12 19:39:08,Always enjoy seeing professors of medicine from U of Iowa https://t.co/8wZlQjwz3h
598206880771612672,2015-05-12 19:23:29,Iowans advocating on behalf of the ALS Association visited with me today. https://t.co/XGS4CVAVbb
598108981614223361,2015-05-12 12:54:28,Speaking at the Des Moines Partnership breakfast this morning. https://t.co/7evnFfWQmB
597912327292362756,2015-05-11 23:53:02,Barbara enjoying catching up with old friends #dmdc2015 https://t.co/hkl50GlNig
597902216905764865,2015-05-11 23:12:51,Talking w Iowans at DSM Partnership Reception #dmdc2015 https://t.co/eaRzz6nR5Q
597865601156124672,2015-05-11 20:47:21,Met with members of Easter Seals of Iowa https://t.co/TbqAFI07gr
597857577947549696,2015-05-11 20:15:28,History channel surprise! can u believe it? Sunday they had good history on Knights Templar. I really enjoyed it
597080482551959552,2015-05-09 16:47:34,Tories won overwhelmingly in England with a message of their being for working people and against freeloading by both high and low
596685539513765889,2015-05-08 14:38:13,"Reminder to White House of 10 InspectorGeneral vacancies in various depts  get""on the stick"" and get them appointed b4 u complain abt Senate"
596043723064082434,2015-05-06 20:07:52,Iowans with the National ESOP Association stopped by my office to talk about the benefits of employee… https://t.co/JNzkD0Oq8n
596039322605879297,2015-05-06 19:50:23,Enjoyed speaking with Dr. Nashelsky from University of Iowa. https://t.co/bPZY6rHRe4
596035170953728000,2015-05-06 19:33:53,"Gail McGovern, President of the American Red Cross gave me an update on changes within their… https://t.co/75wbpFRKH4"
595978982358659072,2015-05-06 15:50:36,Always nice to see students from the Iowa School for the Deaf. Marcos is from Marshalltown and Cole… https://t.co/IKBqcz1bLT
595715433539436544,2015-05-05 22:23:21,A friend Jerry Tweeten of Forest City  passed away  he will be missed by family and friends. He was great promoter for north Iowa  He
595680733785673728,2015-05-05 20:05:28,Thanks to Brian Kading for 19 years of service at the Iowa REC https://t.co/JiM7pYAlFu
595679492284223489,2015-05-05 20:00:32,Enjoyed taking Qs from the Iowa Association of Electric Cooperatives this afternoon. Lots of familiar… https://t.co/lmDEimSVKi
595672270145720320,2015-05-05 19:31:50,Thank you to the Cedar Valley Cancer Committee's Beyond Pink Team for recognizing my efforts to raise… https://t.co/964ENAAgsz
595585854615265280,2015-05-05 13:48:27,I met with Iowa Prudential Spirit Community award winners Morgan and Mark https://t.co/17r31wR4Yw
595566174957633536,2015-05-05 12:30:15,Meeting with the Iowa Hospital Association this morning. https://t.co/r5wfSrrkIH
595369434983866368,2015-05-04 23:28:29,In 30 min I will be addressing Lawyers for Civil Justice in DC at their annual meeting
594177469936185344,2015-05-01 16:32:02,This morning visited Des Moines Primary Healthcare to be briefed on their programs and needs. At the… https://t.co/mnc6NgTzWy
593962320839233536,2015-05-01 02:17:07,Met a professor of radiology on the plane and an advocate for children at the university of Iowa https://t.co/peOzPKAMOn
593908233850515457,2015-04-30 22:42:11,Quad Cities Chamber of Commerce is telling me their legislative program during their annual trip to DC https://t.co/Oz3RAhX3Kg
593907785546477568,2015-04-30 22:40:25,I'm addressing the Quad Cities Chamber of Commerce after they presented their legislative program to me https://t.co/62mebcgxoE
593536574102581248,2015-04-29 22:05:21,"I'm with the Mayor of Waterloo, Buck Clark. https://t.co/H8ChKo1LIc"
593520813547991040,2015-04-29 21:02:43,Jeff Jarding with the emergency nurses association met with me earlier this afternoon. https://t.co/RY9yaW15NI
593518406441144320,2015-04-29 20:53:09,"The Hofer family from Grimes visited with me during their trip to Washington, D.C. https://t.co/iFlBT1sbHw"
593514955422339072,2015-04-29 20:39:27,"With Deans from the University of Iowa's School of Law, Continuing Education and Engineering. https://t.co/2h2TKeZtp6"
593513792757043201,2015-04-29 20:34:49,Nice to see students from Iowa State advocating on behalf of fraternal communities at colleges and… https://t.co/Y0jCJQHkSa
593490193061117953,2015-04-29 19:01:03,With the Cedar Valley Coalition https://t.co/zkDSXWOBTn
593484310637842432,2015-04-29 18:37:40,I'm speaking with the Cedar Valley Coalition https://t.co/KvgIFqu7on
593481619484344320,2015-04-29 18:26:59,Press conference on the bipartisan PATENT Act we're introducing today to end abusive patent litigation. https://t.co/bKZxZodAHG
593399778702172160,2015-04-29 13:01:46,"As I was walking by the Capitol this morning, this was the view I had. Proud to be an American. https://t.co/t9GFSub8SH"
593394015225008128,2015-04-29 12:38:52,Honored to receive the Spirit of Enterprise Award from the U.S. Chamber of Commerce this morning. https://t.co/VK4MGjWltj
593387917894152192,2015-04-29 12:14:38,Thanks @senjoniernst for letting me drop by your weekly constituent coffee to say hi to more Iowans! https://t.co/Iy0EHya6dO
593160818553925634,2015-04-28 21:12:14,E2 environmental entrepreneurs stopped by to visit with me. https://t.co/H41CJGDheK
593153979191840769,2015-04-28 20:45:03,Always happy to discuss benefits of the RFS with the Iowa Renewable Fuels Association. https://t.co/KfXw1rddAM
593138887465250816,2015-04-28 19:45:05,The Iowa Wholesale Beer Distribution Association visited with me about tax reform in my office. https://t.co/p1ho2IeTGq
593133955139948545,2015-04-28 19:25:29,Nice to see folks from Iowa representing the American Dental Association. https://t.co/mAR8FdvoBm
593131927529459712,2015-04-28 19:17:26,The Child Welfare League of America just presented me with the Congressional Advocate of the Year award. https://t.co/T5jkkF0sV7
593067073166675970,2015-04-28 14:59:43,Chairing oversight hrg w/homeland sec Johnson.i asked him about exec actions on immigration &amp; why gang members are getting approved.
592793716299030528,2015-04-27 20:53:30,The Freeman family from Cedar Rapids stopped by this afternoon. https://t.co/mdVfsFquTA
592766153048600576,2015-04-27 19:03:58,I spoke at the National Press Club this morning about the Senate Judiciary Committee agenda. Watch… https://t.co/3YPEGMS7sB
592713712756203522,2015-04-27 15:35:35,Great to see students from HLV school district. That stands for Hartwick-Ladora-Victor which you'll… https://t.co/KlxTth4HqQ
592679773459128323,2015-04-27 13:20:44,At 10am eastern I will be on cspan answer Q at national press club
592099752843595778,2015-04-25 22:55:56,I was speaking at the Iowa Faith and Freedom Coalition today https://t.co/y0apOE0aQO
591321426906505218,2015-04-23 19:23:09,The Independent Insurance Agents of Iowa always bring a big crowd. https://t.co/On8XCEtdaD
591315800855838722,2015-04-23 19:00:47,Chaldon Wooge from Forest City gave me a flag flown on base in Afghanistan during his time serving… https://t.co/AGsFkAfjmI
590991506175057921,2015-04-22 21:32:09,I'm at Capitol during votes on HumanTrafficking visiting desmoines constituents of Forbs Co abt ExImBank https://t.co/1F0MTweiMr
590991413489360896,2015-04-22 21:31:47,Desmoines ppl w Forbs Cco https://t.co/KZAPVFOjGF
590862636704735232,2015-04-22 13:00:04,With North Polk High School seniors on their trip to tour Washington https://t.co/nNaBoJRbKd
590855891349536768,2015-04-22 12:33:16,I w Iowa farm bureau insurance group at senator Ernst bfast https://t.co/ZLd3YXwLGH
590469135349473281,2015-04-21 10:56:26,I took picture the table of Ogden HS students Barbara and I had bfast with. 90 ppl fr Ogden r on the… https://t.co/gCUalBPuOQ
590321470456356864,2015-04-21 01:09:40,I met w Ambassador of South Korea to discuss our FreeTradeAgreement and our mutual defense treaty https://t.co/wJkwTWKdmO
589947033655631872,2015-04-20 00:21:48,I am with 197 pound NCAA champion Kyven Gadson of Iowa State University. https://t.co/nrVIvfm07c
589098736187506688,2015-04-17 16:10:58,I am presenting the Law Enforcement Congressional Badge of Bravery to Trooper Domino in stopping… https://t.co/imKdeLGaKi
589097584624590848,2015-04-17 16:06:23,After awarding the Congressional Badge of Bravery to Trooper Domino at Historical Bldg I took time to… https://t.co/ecog3zSae4
588795001712291840,2015-04-16 20:04:02,I'm introducing Senator McConnell to the Sioux City Chamber of Commerce https://t.co/2oT7WPCGrF
588794335375794176,2015-04-16 20:01:23,@senjoniernst and I with Siouxland community and business leaders. https://t.co/8JDFXSS1b7
588779344216125440,2015-04-16 19:01:49,"Families from West Des Moines, Ely, Park View, etc came by for a photo before their Capitol tour… https://t.co/X2GnZJfGxo"
588738727712808962,2015-04-16 16:20:25,I met w Joy Kelly and daughter   Joy was recognize in Capital as Iowa Asst Principle of the Year.… https://t.co/kIw2u2NxUc
588687508210376704,2015-04-16 12:56:53,Thought my followers might like this pork recipe from Mrs. Grassley. https://t.co/2VZvFJ3qsb
588682513742172160,2015-04-16 12:37:03,Lots of friendly Iowa faces this morning with the Iowa Pork Producers attending the NPPC. https://t.co/Fm9lARPNCS
588680309882892288,2015-04-16 12:28:17,Had the opportunity to speak at the National Pork Producer Legislative Conference. 88 attendees at… https://t.co/bKtOJyF8qy
588474600595529728,2015-04-15 22:50:52,At the Siouxland Congressional Reception. https://t.co/24fLKTxe5m
588434242872442881,2015-04-15 20:10:30,The Iowa Restaurant Association visited with me in my office this afternoon. https://t.co/67af2kXnIv
588427859246641155,2015-04-15 19:45:08,Glad to meet with the Iowa State Bar Association and touch base on Senate Judiciary Committee issues. https://t.co/PMhCuljstS
588419632417153024,2015-04-15 19:12:27,These students are attending the national 4-H conference representing Iowa https://t.co/CTDmJ7fq1n
588088291905380353,2015-04-14 21:15:49,Just met Iowans who are advocating for the Epilepsy Foundation https://t.co/YNJtFufPCw
588063723119628289,2015-04-14 19:38:11,Got to meet with the Iowa Chapter of the American Student Dental Association today #ASDA https://t.co/wka3DJCTxn
588059423274364928,2015-04-14 19:21:06,Brad Duffy of Davenport popped by my office this afternoon to say hi. https://t.co/2KCMENZsHa
587716749585416192,2015-04-13 20:39:27,Members of the Iowa Optometric Association visited my office this afternoon to speak on issues that… https://t.co/dA4EZWFORw
587633939147264000,2015-04-13 15:10:23,"I'm live on KSCJ radio with Mark Hahn. They're broadcasting from DC, visiting with Siouxland Chamber… https://t.co/sE1aXuNLcL"
586191239122419714,2015-04-09 15:37:36,I'm at Professor Oakland's Human Relations class at UNI! https://t.co/W0DxppNKnL
585916673900830721,2015-04-08 21:26:35,West Hancock High School-Britt 175 ppl Issues-Marijuana FreeCommunityCollege Abortion Gay Rights Welfare School Lunches Death Penalty Guns
585909267460263936,2015-04-08 20:57:09,"Today I visited Britt, Iowa.  Home of the national Hobo convention and Museum.  You need to come here in August. http://t.co/45Gp5FLeEZ"
585868327051866112,2015-04-08 18:14:28,#99countymeetings   Meeting with students at Bishop Garrigan HS.  Approximately 220 students.  Topics… https://t.co/LB1ocazLPb
585839984000630784,2015-04-08 16:21:51,ForestCityHS 300Students Iran Welfare Energy Guns/Schoolviolence budget$$ Immigration Minimumwage Cannibis LGBT #99countymeet
585830870180880384,2015-04-08 15:45:38,#99countymeetings   Taking questions from students of Forest City HS.  Around 300 students.  Topics… https://t.co/USrk5gn22k
585811529813065728,2015-04-08 14:28:47,I visited ADA ENTERPRISES in Northwood for Tour Ana Q&amp;A w employees who find it difficult to come… https://t.co/lBtCJi7xih
585811409814089728,2015-04-08 14:28:18,Q&amp;A/tour ADA enterprises Northwood 30ppl Issues: Immigration RFS 2016 Pres race Pipeline Healthcare Pres Obama overreach #99countymeetings
585525240677199872,2015-04-07 19:31:10,I was interviewed by @brentroske by @taylorpavlock for 'Roske on Politics' ch23 1130am Sunday https://t.co/WLVbAPawEj
585199451590889472,2015-04-06 21:56:36,Good news for granddaughter Shirley Speckerman She was accepted into UofIowa School of Social Work for this fall
584788809784504320,2015-04-05 18:44:51,"A recent tweet was singled out for""Google Alert"" /Commentary doesn't clarify when I report on a town meeting that I must use 1word per issue"
584441636337414144,2015-04-04 19:45:19,Attending medal ceremony in Greene for Walter Wunch.  He received the silver star posthumously. https://t.co/RxkwxzILAq
583793615299817472,2015-04-03 00:50:18,"I answered questions sponsored by the Harkin Institute,named after Sen. Harkin. The 10 students asked… https://t.co/qnNDoo0NN3"
583764182002233344,2015-04-02 22:53:21,"Pella Corp Q&amp;A Issues: cong. gridlock, global warming, ExIm bank, Obamacare, Iran, IRS, veterans, Benghazi #99countymeetings"
583763617138479105,2015-04-02 22:51:06,"Interpower Corp in Oskaloosa Issues: Iran, Ex-Im Bank, Obamacare, veterans’ mental health, term limits, pipeline #99countymeetings"
583753100860743680,2015-04-02 22:09:19,The 76 employees at Pella Corp asked a lot of great and varied questions during my Town Meeting in… https://t.co/JBEz4qWKie
583727046020489217,2015-04-02 20:25:47,I received a very educational tour at Interpower in Oskaloosa. Then answered questions from 29… https://t.co/6TkCRTpYKf
583700773051244544,2015-04-02 18:41:23,"Keota HS Issues: interaction w/ President, typical day, ISIS, govt shutdown, Obamacare, budget, farm bill, gas pRices, IRS #99countymeetings"
583696505887924225,2015-04-02 18:24:26,"Kinze Manuf Williamsburg 96 ppl Issues:Military pensions, TPA, Iran, Food guidelines, FarmEcon,Pipeline,Tax reform,Patents #99countymeetings"
583694402167697408,2015-04-02 18:16:04,"Thanks to Keota High School's invite.  Although school was closed for break, the 11 students willing… https://t.co/PooefSg2Dq"
583614979527614465,2015-04-02 13:00:28,Sen. Ernst reading Old Testament scripture at Iowa Prayer Breakfast  Os Guinness was featured speaker https://t.co/wfz0CeQXd2
583420515072741376,2015-04-02 00:07:44,I hah pleasure of reception sponsored by Iowa BAR ASSOC on my being Chair of Senate Judiciary Comm… https://t.co/AdZgHoTRRp
583379528178900992,2015-04-01 21:24:52,I spoke to 83 folks attending the annual IowaBio Partnering for Growth Forum in Ankeny. https://t.co/0vZFXZERxy
583347909195882496,2015-04-01 19:19:14,"Albia town mtg Issues:Obamacare Asset forfeiture ExecOrders 2nd Amend Budget ISIS MiddleEast Fast&amp;Furious, Taxes Pipeline #99countymeetings"
583342696414199808,2015-04-01 18:58:31,Thanks to Albia area Chamber for hosting my Monroe County Annual meeting. 38 folks asked a variety of… https://t.co/ASf7ghIOOx
583313601777295362,2015-04-01 17:02:54,"Centerville HS Issues: discussion of represent. govt, process, start in politics, ISIS #99countymeetings"
583312921725431808,2015-04-01 17:00:12,"Mtg this am-Corydon town mtg 37 ppl Issues: SocialSecurity Medicare, ISIS, Cuba EstateTax,VA, Defense $, Debt, Iran, Trade #99countymeetings"
583307432622964736,2015-04-01 16:38:23,About 350 Centerville High School students attended my town mtg in Appanoose County. #99countymeetings https://t.co/WDm6TWtPqp
583075051324370944,2015-04-01 01:14:59,"Chariton town mtg Issues: cannabis, Iran, patent trolls, SCOTUS, doc fix, pres election, exec orders, pipeline, tax reform #99countymeetings"
583043913252003840,2015-03-31 23:11:16,Good turn out for town meeting in Chariton.  36 people turned out in friendly Lucas County. https://t.co/h5SUpKqLUg
583021937133297664,2015-03-31 21:43:56,"Boyt Harness, Osceola Q&amp;A w16 emp. Topics: guns, budget, EPA/clean h2o, Lynch nom, exec orders, oil refineries, military #99countymeetings"
583015129740103680,2015-03-31 21:16:53,I received a tour of Boyt Harness Company and met several of their employees at their Osceola… https://t.co/tu9AM2GIfG
