id,created_at,text
24730405808,2010-09-17 04:35:00,"STAFF: Boxer voted for Small Business Jobs Act to provide tax credits, loans to small businesses.  Fiorina opposes it. http://ow.ly/2FBGd"
24578550236,2010-09-15 15:15:21,Thank you to the fabulous HRC volunteers who are helping us phonebank! http://ow.ly/2EEtd
24415800397,2010-09-13 21:17:43,"STAFF: Boxer's 1st TV ad, ""Made in America"", highlights CA jobs, key accomplishments. Watch: http://www.barbaraboxer.com/tv #p2 #casen"
24399621540,2010-09-13 17:04:20,"""'Pulitzer Prize for semi-fiction,' is how NBCLA Analyst Sherry Bebitch-Jeffee characterized the anti-Boxer ad"" http://ow.ly/2Dv2j #casen"
24308353332,2010-09-12 19:03:45,"STAFF: Many reasons to support Boxer - share with friends! ""Boxer-Fiorina contest sets up stark differences"" http://ow.ly/2D2qR #casen #p2"
24217161198,2010-09-11 18:39:16,STAFF: Fiorina supports rollback of CA global warming law: http://ow.ly/2CObe
24139870061,2010-09-10 21:46:27,STAFF: Senator Boxer visits Palm Desert to talk about her support for the Small Business Jobs Act http://bit.ly/azJxWC
24137779007,2010-09-10 21:12:42,"RT @CA_Dem: Check out the newer, bolder, faster and much improved www.cadem.org !! #cagov #caVote2010 http://bit.ly/dz4OZA"
23952308255,2010-09-08 22:13:26,STAFF: Democracy for America went to bat for Barbara today; encourage MoveOn.org to join them: http://ow.ly/2Bqee
23923803556,2010-09-08 15:30:10,"STAFF: Fiorina's has ""soft spot for China... opened plants and 'right-shored' manufacturing jobs in the PRC."" http://ow.ly/2AVGG"
23863391390,2010-09-07 23:44:45,ROSE: Thanks to the thousands of Boxer supporters who made our first money bomb successful! http://ow.ly/2APLs
23253958907,2010-09-07 16:56:17,STAFF: LA Times on yesterday's labor rally: http://ow.ly/2AD7K
23190620256,2010-09-07 00:30:42,"STAFF: Vote for Barbara in the MoveOn.org Progressive Heroes survey, and encourage MoveOn to go to bat for Boxer in 2010: http://ow.ly/2AfYk"
22854591609,2010-09-03 03:07:43,STAFF: Debate watch party photos: http://ow.ly/2ySgG Thank you to all the supporters who tuned in!
22767444233,2010-09-02 03:35:06,"STAFF: SacBee: ""Boxer finishes stronger in debate"" http://ow.ly/2yi3z"
22767142152,2010-09-02 03:30:30,"STAFF: 11,500+ money bomb donations! New goal: 12,000. 3.5 hours to go. Make your contribution here: http://www.barbaraboxer.com/moneybomb"
22764540586,2010-09-02 02:52:51,Read more about Senator Boxer's record supporting Law Enforcement. http://bit.ly/9LnJmm #casen
22764022914,2010-09-02 02:45:26,Find out more about Senator Boxer's record on the environment. http://bit.ly/dkQds9 #casen
22763427211,2010-09-02 02:36:34,More about Senator Boxer's record on women's issues here http://bit.ly/8YQbem #casen
22763173230,2010-09-02 02:32:42,One hundred Boxer provisions are on our website here: http://bit.ly/aaFktR #casen
22763024185,2010-09-02 02:30:28,Learn more about Senator Boxer's LGBT record http://bit.ly/a0uL8i #casen
22761787205,2010-09-02 02:11:56,Find out more about Senator Boxer's record supporting veterans http://bit.ly/1GzSq #casen
22761662687,2010-09-02 02:09:43,Read more about Senator Boxer's record on Jobs and the Economy http://bit.ly/c9FqaE #casen
22756737499,2010-09-02 00:58:19,"RT @markos @ravenb New Boxer goal is 12K, already smashed through 10K http://www.barbaraboxer.com/moneybomb | Stand with Barbara! #casen #p2"
22752670898,2010-09-02 00:01:45,"STAFF: Join us for tonight's debate - 7pm, broadcast nationwide and streamed on the web. See how to watch here: http://ow.ly/2yeo2"
22744069039,2010-09-01 21:58:28,"STAFF: Over 9,500 donations to today's money bomb. Barbara Boxer will call the 100,000th donor.  Show your support! http://ow.ly/2ybRY"
22737261208,2010-09-01 20:13:57,Great show of support for today's money bomb. Less than 900 donors away from 100K. Help out and donate: http://ow.ly/2y8Tt
22651175015,2010-08-31 21:40:07,STAFF: Join us for the Boxer/Fiorina debate tomorrow night at 7pm PDT - follow link to see where to watch live: http://ow.ly/2xA8I
22561277936,2010-08-30 22:22:46,STAFF: Ashley Judd pledged to be part of our 9/1 money bomb. Join her & 3616 others & counting: http://ow.ly/2x0Vh
22465448671,2010-08-29 20:34:44,"STAFF: 2,843 people have pledged to be part of our 9/1 money bomb. Help us reach 3K tonight! Add your name to the pledge: http://ow.ly/2wrCP"
22395260838,2010-08-29 00:32:04,"STAFF: We have over 2,456 pledges to reach 100K strong for Boxer. Pledge to join the @boxer_2010 Sept. 1 money bomb: http://ow.ly/2wfJi"
22382446309,2010-08-28 20:53:50,"STAFF: Thanks, we've reached 2,234 RT @LaurieJacobson Join the ""money bomb"" to keep @Boxer_2010  fighting for us! #p2 http://ow.ly/2w0io"
22305570399,2010-08-27 23:04:03,"STAFF: Help us get 2000 pledges for the @Barbara_Boxer 9/1 moneybomb before midnight, on our way to 10K by Weds: http://ow.ly/2w0io"
22227343951,2010-08-27 01:34:11,STAFF: Last day to vote for the next member of the @LCVoters People's Choice Dirty Dozen! Cast your vote today: http://ow.ly/2vuIZ
22223061276,2010-08-27 00:32:53,Just passed 1000 pledges toward 10K donations goal for @Boxer_2010 9/1 money bomb! Support Barbara with your pledge now: http://ow.ly/2vtP3
22203935892,2010-08-26 19:38:11,"Fiorina is using her millions. She has deep pockets, but Barbara has us. Be part of 100K strong for Boxer moneybomb: http://ow.ly/2vmRE"
22152454325,2010-08-26 05:14:20,"STAFF:  Karl Rove's group, American Crossroads, launched $1 million in attack ads against Boxer. Help us fight back:http://ow.ly/2uUW8"
22121277139,2010-08-25 21:34:26,STAFF: Sen. Boxer visited Back on the Beach Café & outlined plans to help small businesses & protect CA's coastal economy http://ow.ly/2uPHl
22108575407,2010-08-25 18:11:25,STAFF: Boxer Announces Congressional Gold Medal for Nisei Units - http://ow.ly/2uJ3d
22065547079,2010-08-25 05:49:56,Boxer Supporters in Fresno - Photos - http://ow.ly/2unTP
22037565315,2010-08-24 22:45:02,STAFF: Boxer renews commitment to Villaraigosa's 30/10 transit plan - LA Times - http://ow.ly/2ugWv
21968578283,2010-08-24 03:11:18,STAFF: Don't forget to submit your questions for the September 1st debate! Find out how here: http://ow.ly/2tLbU
21961824567,2010-08-24 01:40:23,Thank you to the Boxer supporters who joined us in Fresno tonight! http://ow.ly/i/3nDl
21944162556,2010-08-23 21:23:17,STAFF: Don't forget to vote for the next member of the People's Choice Dirty Dozen: http://ow.ly/2tEpW
21768910627,2010-08-21 18:28:22,"STAFF: During Long Beach visit, Barbara Boxer pledges support for Boeing C-17 - ContraCostaTimes.com: http://ow.ly/2sS1O"
21724316270,2010-08-21 05:01:42,STAFF: Senator Boxer joined supporters today in Long Beach. Photos: http://ow.ly/2sJIA
21682596913,2010-08-20 17:42:09,STAFF:  Thank you to everyone in Long Beach who joined us for breakfast this morning! Photo: http://ow.ly/i/3jOg
21610563679,2010-08-19 21:51:34,Senator Boxer stands up to Fiorina on protecting our coastal economy: http://ow.ly/2s7R2
21607351665,2010-08-19 21:00:04,STAFF: Business leaders back Boxer - Leaders from around California announce support - http://ow.ly/2s6Am
21535092564,2010-08-19 00:53:49,"STAFF: Army Times story on new Military Family Caucus, co-chaired by Barbara Boxer: http://ow.ly/2rCoS"
21454138413,2010-08-18 02:20:10,"STAFF: CNN story on the new Emily's List campaign, ""Sarah Doesn't Speak for Me"":  http://ow.ly/2r4IT"
21446939897,2010-08-18 00:35:53,STAFF: Check out KQED's This Week in Northern California: Interview with Senator Barbara Boxer - http://ow.ly/2r2Vl
21446425949,2010-08-18 00:28:16,STAFF: Submit your questions for the September 1 debate: http://ow.ly/2r2NS
21316445232,2010-08-16 13:52:09,STAFF: Boxer calls for transparency on Wall Street - http://ow.ly/2q8v1
21190853871,2010-08-15 00:56:48,STAFF: Photo from the OFA event Barbara Boxer attended with Mayor Villaraigosa and the Honorable Hilda Solis:  http://ow.ly/2pHMV
21094271918,2010-08-13 20:47:31,"Barbara Boxer protects a woman's right to choose. Fiorina would take choice away. See the video, stand with Barbara! http://ow.ly/2p1rr #p2"
20997437517,2010-08-12 18:48:55,Nice piece from Dan Morain of the Sacramento Bee comparing Boxer and Fiorina on judicial nominees: http://ow.ly/2oOYB
20936350108,2010-08-12 02:02:20,STAFF: Channel 7 coverage of the groundbreaking for the new transit center in San Francisco: http://ow.ly/2oqt8
20900412469,2010-08-11 16:50:40,STAFF: Earvin “Magic” Johnson Announces Endorsement of Barbara Boxer - http://blog.barbaraboxer.com/?p=1327
20498093274,2010-08-06 20:55:42,STAFF: Boxer-Fiorina debate set for September 1 at St. Mary's College in Moraga. http://ow.ly/2md13
19273830066,2010-07-22 18:13:39,"STAFF: KGO-TV: Boxer, Fiorina have opposing views on green jobs.  Video at www.bit.ly/9hcfw4"
19011021865,2010-07-20 17:43:10,STAFF: Senate votes today on unemployment extension to help people looking for work. Boxer supports. Fiorina opposes. KGO: www.bit.ly/cSGouJ
18614291949,2010-07-15 16:23:54,Fresno's ABC30: Carly Fiorina Fumbles Boxer Criticism http://bit.ly/cKXQY2 #casen
18461790534,2010-07-13 19:48:15,"Real Clear Politics, Field Poll, SurveyUSA, and NPR call our race a toss-up. We need you now! http://bit.ly/bucks4boxer #casen #p2 Pls RT"
18377396780,2010-07-12 19:39:39,Photo taken by a Boxer supporter in Newport Beach on the 4th of July. http://twitpic.com/24qotf
18157777079,2010-07-10 00:17:40,Here's Senator Boxer's CNN interview from last night. http://bit.ly/aocBsZ #casen
18131716691,2010-07-09 16:41:48,"""She has been a very extraordinarily good friend to the port,"" Port Director Rick Aschieris said. http://bit.ly/a0r4OG #casen"
18069914476,2010-07-08 23:10:42,Sen. Boxer on CNN now! Tune in!
18048564119,2010-07-08 16:58:35,Barbara Boxer campaigns in Santa Barbara as part of her Jobs for California Tour. http://bit.ly/9ibQ0l #casen #p2
17994581593,2010-07-08 00:51:09,Senator Boxer visits the Port of Stockton as part of her Jobs for California Tour. http://twitpic.com/23c3gx
17990296042,2010-07-07 23:40:28,New @calitics post by @cruickshank about today's Jobs for California Tour stop in Monterey http://bit.ly/db4xXP #casen #p2
17983594998,2010-07-07 21:43:25,Sen Boxer meets w/ workers today on the Sacramento Airport expansion project during her Jobs for California Tour http://twitpic.com/23astm
17973233447,2010-07-07 19:21:43,"Sen Boxer meets w police officers in Fresno, where Recovery Act has helped hire or retain more than 40 officers http://twitpic.com/239u4o"
17968677398,2010-07-07 18:14:41,Thank you to everyone who joined us this morning at the Monterey Peninsula Center for Change! #casen http://twitpic.com/239cun
17910585206,2010-07-07 01:17:53,Boxer supporters gather in Santa Barbara as part of her Jobs for California Tour. http://twitpic.com/232iq2
17899962186,2010-07-06 22:13:36,Sen. Boxer today with Quallion employees in the Sylmar neighborhood of Los Angeles. #p2 #casen http://twitpic.com/2319d2
17895187419,2010-07-06 20:43:08,"Sen Boxer gets a tour of Quallion, a Los Angeles-based company that manufactures lithium ion batteries. #casen #p2 http://twitpic.com/230n7q"
17890444850,2010-07-06 19:27:57,Sen Boxer at Doyle Dr project: “These are the jobs that are getting California moving again.” http://bit.ly/ckEd9k #casen #p2
17883942928,2010-07-06 17:43:37,"Sen Boxer kicks off her Jobs for California tour in SF at Doyle Dr., recipient of $100 million in Recovery funds http://twitpic.com/22zcxb"
17593314923,2010-07-02 19:07:31,RT @Fiorina_Facts Fiorina would have voted against unemployment bill http://bit.ly/apbIA7 #p2 #casen
17541815296,2010-07-02 03:16:06,"Fiorina opposes assault weapons ban, praises Supreme Court ruling http://bit.ly/bb3sd7 #p2 #casen"
17490893869,2010-07-01 13:05:17,Sen Boxer will be talking energy policy and BP on @KTLAMorningNews near the top of the 7am hour. Tune in! http://bit.ly/Zhch
17459544539,2010-07-01 02:16:50,"More than 4,000 Boxer supporters have stepped up, & we're just $7,000 from our midnight fundraising goal. Pitch in now! http://bit.ly/9mhcBe"
17450916740,2010-06-30 23:55:44,Senator Boxer is counting on us! Help us meet our ambitious fundraising goal by midnight tonight. We're almost there! http://bit.ly/9mhcBe
17445881152,2010-06-30 22:26:31,This is it! A message from Sen Boxer ahead of tonight's crucial fundraising deadline. Help us reach our goal! http://bit.ly/atOPZi
17440266206,2010-06-30 20:41:13,"Sen Feinstein: ""California needs Barbara Boxer in the Senate, now more than ever."" http://bit.ly/d2CHjt #casen"
17291278860,2010-06-29 00:24:47,Check out a special message from Sen. Mark Udall and help us reach our ambitious fundraising goal! http://bit.ly/9pCFOv
17204980315,2010-06-28 00:06:15,Top GOP donors are joining Rudy Giuliani and Michael Steele to fund Fiorina. Help us fight back http://bit.ly/b3Jzyh
17096783157,2010-06-26 15:04:05,"Both of California's senators, Democrats Dianne Feinstein and Barbara Boxer, voted in favor of the jobs and tax bill. http://bit.ly/9Dc0QY"
17053250517,2010-06-26 00:08:16,"""[Boxer] has not only often voted the right way but has been an evangelist...for key tech issues"" http://politi.co/daV7aJ"
16862500794,2010-06-23 16:56:52,Sen. Feinstein stands up for Sen. Boxer http://bit.ly/cwtfbV #p2 #casen
16793598559,2010-06-22 19:38:28,Sarah Palin and Carly Fiorina: Two of a kind. Watch the new video and help run the ad online http://bit.ly/cA7mOB #p2 #casen
16729037586,2010-06-21 23:24:31,"How much is RNC Chair Michael Steele planning to spend on California? ""A lot."" http://bit.ly/cCX1NV #casen #p2"
16717037412,2010-06-21 19:45:11,SacBee on the diversity of judges recommended by Senator Boxer http://bit.ly/coeeOi #casen #p2
16585244584,2010-06-20 02:03:07,Senator Boxer will be on Face the Nation tomorrow to talk about the Gulf oil spill. Tune in!
16573837098,2010-06-19 22:04:11,VP Biden campaigning for Senator Boxer! http://bit.ly/dl4D2x
16505792844,2010-06-18 23:37:19,Sign up for the Be a Boxer program and join us for a special call with Senator Boxer tomorrow afternoon! http://bit.ly/cPOeUq
16476628988,2010-06-18 15:05:56,Fiorina’s HP Mishaps Prompt Technology Executives to Back Boxer http://bit.ly/9yB48g #p2 #casen
16420922370,2010-06-17 22:04:50,Fiorina and Senator Boxer on the Environment. A side-by-side comparison. http://bit.ly/9y9z75 #casen
16262736886,2010-06-15 23:27:52,Senator Boxer received the endorsement of Ocean Champions today http://bit.ly/dl5pGE #casen #p2
16253672085,2010-06-15 20:43:37,Sen Boxer wants to talk to you. Sign up for the Be-A-Boxer program today and join a special call on 6/19 http://bit.ly/99fu6K
16174105424,2010-06-14 20:27:38,"The First Lady, Senator Boxer and Congresswoman Susan Davis visited Camp Pendleton over the weekend. http://bit.ly/9lekqA"
15941518336,2010-06-11 16:43:56,RT @JohnKerry Barbara Boxer gets it done – bam! On to the big fight.
15868706159,2010-06-10 18:20:17,There's a clear choice in this election. Watch the video and get the @Fiorina_Facts http://bit.ly/bUXKMd #p2 #casen
15801509068,2010-06-09 20:50:28,"A message from Sen Boxer: The choice before California is clear, but we need your support today! http://bit.ly/dx0Evu"
15797150869,2010-06-09 19:29:08,"STAFF: Now that Fiorina is officially the nominee, learn about her record at FiorinaFacts.com and @Fiorina_Facts #casen #p2"
15760431209,2010-06-09 05:15:27,The official debate challenge has been issued by @RoseKapol to the Fiorina campaign #casen #p2
15757483547,2010-06-09 04:15:05,AP has called the race for Fiorina. OK- let's go win this thing. #casen #p2
15731913548,2010-06-08 20:57:59,Sen Boxer talks to CA media from DC on Election Day. Senate is working to extend jobs tax credits & unemp benefits http://twitpic.com/1v3xq8
15721610271,2010-06-08 17:47:00,"In less than 10 hours, polls will close and we'll know who our opponent will be. Help us prepare now! http://bit.ly/cOvLaF"
15667484812,2010-06-08 00:32:37,"RT @JerryBrown2010: Those of you in the LA area, please join me tomorrow night at Club Nokia! Please RT - http://bit.ly/dyr8Bs"
15666925758,2010-06-08 00:23:19,Find your polling place and VOTE in tomorrow's primary http://bit.ly/cTb7Jg #casen
15659319526,2010-06-07 22:09:30,It'll be the biggest day yet in the campaign. Help us prepare for the general election as soon as the polls close http://bit.ly/bAVY1Q
15337913933,2010-06-03 16:50:07,RT @marytny: @janieo no one is going to take away my Barbara Boxer!! True champion of women!!
15336656151,2010-06-03 16:29:48,RT @kdgamergirl: @Boxer_2010 my mom and I already voted for you!
15332043823,2010-06-03 15:19:54,RT @Nicotone: @Boxer_2010 Voted for you 2 weeks ago via mail-in ballot!
15301487677,2010-06-03 04:15:08,RT @ahuntre I just love Barbara Boxer.
15300401860,2010-06-03 03:55:52,Visit our action page to get involved & help the campaign http://www.barbaraboxer.com/action/ RT @kali77 @Boxer_2010 how can I help you
15300054115,2010-06-03 03:49:45,RT @gintahar Wake up Californinans we need Barbara Boxer in the Senate
15298922963,2010-06-03 03:30:44,RT @higgs2 Barbara Boxer on Rachel Maddow: Go Boxer Go!
15290464919,2010-06-03 01:12:09,Senator Boxer voting early in the primary this afternoon in Riverside. http://twitpic.com/1tex33
15286148048,2010-06-02 23:59:55,Sen Boxer will be discussing the oil spill on the Rachel Maddow show tonight! Tune in to MSNBC near the top of the 6pm hour (PT) to watch!
15202004293,2010-06-01 20:38:31,Boxer supporter spotted in Fresno! http://twitpic.com/1t3lta
15195240091,2010-06-01 18:23:51,"For even more updates about the campaign and the coverage, follow @rosekapol and like her on FB http://bit.ly/cguRon #casen #p2"
15135536478,2010-05-31 22:20:55,Thank you to all of the Boxer supporters who joined her in San Bernardino today. Special thanks to Carol Robb and  http://twitpic.com/1sv0i3
14882381108,2010-05-28 04:01:43,"RT @kyamamura: Fiorina loaned her U.S. Senate campaign an additional $1.9M since last week, bringing her total to $5.5M so far."
14462359523,2010-05-22 00:36:30,The LA Times finishes a week of coverage on the Senate candidates with a profile of Senator Boxer. http://bit.ly/b4GHjo
14381606807,2010-05-20 19:42:41,"Cloture vote on #FinReg successful, 60-40. You can see the vote results here: http://bit.ly/bNsxr9"
14259533082,2010-05-19 00:12:19,"Sen Boxer will be discussing developments in the gulf oil spill tonight on the Rachel Maddow Show. Tune in at 6pm PT, 9pm ET"
14237746194,2010-05-18 16:42:14,"Tune in today starting at 11:30 PT, 2:30 ET for more hearings on the Gulf oil spill. http://bit.ly/98CvvQ"
13563000418,2010-05-07 18:32:09,Sarah Palin's given her stamp of approval to Carly Fiorina. Help make sure we can fight back. http://bit.ly/bZuS0e
13500901678,2010-05-06 18:15:43,Sen Boxer writes about Wall St reform in @mercurynews. Her reform amendment passed 96-1 yesterday http://bit.ly/c4cTzX
13146331982,2010-04-30 19:27:57,Boxer Amendment ensuring taxpayers won't fund another Wall St bailout leads off #FinReg debate http://bit.ly/biHcaf
13087276106,2010-04-29 20:11:50,"Check out the new video from Barbara, then show your support by pledging to vote on June 8th! http://bit.ly/c2h36W"
13083494526,2010-04-29 18:43:56,Sen Boxer speaking shortly on the floor re: her amendment ensuring that no taxpayer funds can be used to bail out Wall St
13033086081,2010-04-28 22:53:12,Sen. Boxer speaking about Wall St Reform from Senate floor 4pm PT/7PM ET & on Rachel Maddow 6pm PT/9pm ET. Tune in!
12651450625,2010-04-22 17:33:56,Great #cadem2010 recap guest post by two young CA Democratic leaders. http://bit.ly/dmKQ5F
12589461124,2010-04-21 17:51:33,No taxpayer funds for Wall St Bailouts. Read Sen Boxer's letter introducing the amendment http://bit.ly/aKUdB0
12360370940,2010-04-17 20:43:08,Incredible energy at the general session this morning. Great slate of candidates and fantastic grassroots energy! #cadem2010
12351491782,2010-04-17 17:07:38,Great speeches by @dbowen and Secretary Solis revving up the crowd. Senator Boxer up soon! #cadem2010
12346306478,2010-04-17 15:21:58,Senator Boxer will be speaking to the general session at 10am sharp! Don't miss it! #cadem2010
12314416705,2010-04-17 00:53:33,women's caucus is getting started- full of inspiring female candidates for office. #cadem2010
12309162536,2010-04-16 22:57:02,RT @ca_dem #cadem2010 Comp & Internet Caucus meeting feat. presentation on how to raise campaign money online and comply w reporting laws.
12308519546,2010-04-16 22:41:59,"Fresh round of caucuses kicking off. Env, CDC, Comp&Net, Irish-Am, DCCC members. All very important groups this cycle #cadem2010 #cdp2010"
12305961302,2010-04-16 21:41:41,Great conversations about improving education in Children's Caucus and the impact of the Recovery Act in Business & Prof Caucus #cadem2010
12303023254,2010-04-16 20:31:26,Dems from all over the state are streaming into #cadem2010. The Boxer booth is up and running- make sure to stop by!
12233900567,2010-04-15 17:08:00,Just a few more days to enter for chance to see Senator Boxer and @BarackObama in LA on 4/19! Sign up at http://bit.ly/bbnbo
11845906207,2010-04-08 22:07:10,Enter for chance to see Senator Boxer and @BarackObama in LA on 4/19. Sign up at http://bit.ly/bbnbo
11490090604,2010-04-02 16:54:54,Help welcome President Obama to Los Angeles on April 19th! Hope you can join us! http://bit.ly/9BsP5l
11393800586,2010-03-31 23:49:46,A message from Barbara as we hit the fundraising home stretch. Contribute by midnight to help us reach our goal! http://bit.ly/aavQsC
11263310161,2010-03-29 18:30:22,A special message from @JeanneShaheen and @clairecmc. Help us reach our grassroots fundraising goal today! http://bit.ly/aqoxG6
11166792993,2010-03-27 23:26:39,Rhea Perlman and Danny DeVito share why this election is 'no laughing matter.' http://bit.ly/acrSDf
10993390665,2010-03-24 19:06:02,'A landmark achievement' message from Senator Boxer on the passage of health care reform. http://bit.ly/9GMniN
10894807406,2010-03-22 22:55:53,STAFF Check out Boxer's Corner - the campaign's online organizing & fundraising hub. Get connected and get involved! http://bit.ly/96l0PE
10636318738,2010-03-17 20:02:21,"STAFF Sen. Boxer will be on KPCC's Patt Morrison show today at 1:05 PT, 4:05 ET. Tune in or stream online http://bit.ly/OKvMh"
10587610038,2010-03-16 21:07:33,"STAFF Sen Boxer appearing on Larry King tonight about 6:30 PT, 9:30 ET w/ Chelsea King's parents & discussing Violence Against Children Act"
10381173465,2010-03-12 17:18:24,STAFF: The Senate passed a major new Jobs Bill this week. Check out the details.  http://bit.ly/abozwG
10345681000,2010-03-12 00:01:06,STAFF: A thousand conservative activists will be at the California GOP Convention this weekend. Let's match them! http://bit.ly/cVzGdu
9640872555,2010-02-25 20:01:27,STAFF: Appearing just after 1pm PT today on KPCC to discuss jobs bill's impact on California. Tune in or listen online! http://www.scpr.org/
9601652737,2010-02-25 00:52:16,STAFF: Senator Boxer appearing on the Rachel Maddow Show tonight. 6pm PT; 9pm ET. Tune in!
9558091944,2010-02-24 03:14:53,"STAFF: At 7:45 PT, 10:45 ET tomorrow morning following vote, Sen. Boxer will join with Maj Leader Reid and Sen Schumer to discuss Jobs Bill"
9486917669,2010-02-22 18:21:06,"STAFF: Senator Boxer will be speaking about the jobs bill today at 4:30 ET, 1:30 PT. Tune in for the latest updates!"
9352681643,2010-02-19 21:07:07,STAFF: Sen Boxer officially filed for re-election yesterday. Check out photos from the event and join the campaign! http://bit.ly/adLtjV
9306356312,2010-02-18 23:13:11,STAFF: Sen. Boxer signed the letter this morning calling for passing the public option via reconciliation. http://bit.ly/bgTixh
9109396463,2010-02-14 19:38:10,"STAFF: Between Valentine’s Day and Feb 21, buy Boxer apparel and we’ll throw in two free Boxer 2010 bumper stickers. http://bit.ly/a7KfO"
8976023382,2010-02-11 20:20:20,"STAFF: Contribute $10 or more here by 5pm today for a chance to join Sen. Boxer & Al Gore on Sat, air+hotel paid! http://bit.ly/cEsu77"
8340071898,2010-01-28 21:57:46,STAFF: Guest post from @cruickshank breaking down $2.25 billion in new funding for CA's High Speed Rail http://bit.ly/a9xwE3
8312465556,2010-01-28 06:10:28,STAFF: Senator Boxer will be on CBS 5 SF near the top of the 6am hour and KGO radio near the bottom. Hope you can tune in!
8082525814,2010-01-22 20:07:47,STAFF: Senator Boxer announces opposition to Ben Bernanke's reconfirmation as Federal Reserve Chair http://bit.ly/4y9IB0
7916276860,2010-01-18 20:01:34,STAFF: Senator Boxer lands at #2 on the GOP Most Wanted List. Comes with the territory of leading on climate change. http://bit.ly/86YTTa
7837039094,2010-01-16 19:55:19,STAFF: Haiti needs our support. Read the latest message from Senator Boxer and help the Red Cross http://bit.ly/8BxPeA
7720743461,2010-01-13 20:26:39,STAFF: Read Senator Boxer's statement on Haiti: http://bit.ly/8eIJWR
7688075926,2010-01-12 23:49:59,STAFF: A special 'thank you' message from Senator Boxer: http://bit.ly/6lmPth
7638927588,2010-01-11 18:51:37,From Staff: Fiorina lends her campaign $2.5 million http://bit.ly/carlysmoney
7244798229,2009-12-31 19:26:32,"Counting down to the end of the year tonight, a special message of thanks for all you do. Can you help one last time? http://bit.ly/8QCCYY"
7134336116,2009-12-28 20:50:35,"The GOP is ready for a knockdown, drag out fight next year. We need your help to meet our year-end fundraising goal! http://bit.ly/5KlpLJ"
6944578253,2009-12-22 22:53:08,"Discussing Health Care and the countdown to the final vote with guest host Lawrence O'Donnell on Keith Olbermann tonight: 8pm EST, 5pm PST"
