id,created_at,text
6936907992,2009-12-22 18:22:10,"Visiting KPCC's Airtalk today at 11am Pacific, 2pm Eastern. Tune in! http://www.scpr.org/"
6903879907,2009-12-21 20:09:20,"Tune in to C-Span's Senate coverage for a speech on health care. 4:30 Eastern, 1:30 Pacific."
6870338855,2009-12-20 20:37:03,An update from Washington on this weekend's health care breakthrough! http://bit.ly/55D7An
6788493272,2009-12-18 05:32:54,Senate GOP filibuster troop funding; time for a 1am vote. Read the update from DC and help us hit our goal! http://bit.ly/61KCqZ
6710189320,2009-12-15 22:37:15,Prove Karl Rove Wrong. Support the campaign today! http://bit.ly/6KDbiQ
6679795120,2009-12-15 01:02:16,"Chuck DeVore and his Tea Party friends say California is ""ground zero."" Help us fight back now! http://bit.ly/5qIAop"
6580500518,2009-12-11 22:13:26,Tea partiers are getting organized to win in 2010. Help fight back now! http://bit.ly/63BK5v
6509349915,2009-12-09 21:34:58,You can count on Barbara Boxer on tough fights like Stupak. Let her know she can count on you. Donate: http://bit.ly/6JtMjt
6443058926,2009-12-07 21:54:54,On C-SPAN2 now discussing health care reform and women's access to care.
6350651426,2009-12-04 22:01:38,URGENT: Stupak Vote Soon. Sign the petition to Fight for Women's Health now! http://bit.ly/8tf92Q
6284258649,2009-12-02 23:01:36,I'm going to be on MSNBC with Ed Schultz at 3:30 pm PST to talk about health care and the radical Stupak amendment. Hope you tune in!
5901039709,2009-11-20 21:33:04,Speaking on the floor of the Senate about the health care bill at about 3pm Pacific. Check it out on CSpan.
5835030964,2009-11-18 19:38:21,"More than 35,000 have already signed! Stand for women's health and Stop Stupak: http://bit.ly/health4women"
5806588949,2009-11-17 21:18:23,Sign the petition to protect women's health care and Stop Stupak: http://bit.ly/health4women
5595419231,2009-11-10 18:24:48,Getting ready for a visit to the Ed Schultz radio show. Listen live online: http://bit.ly/LMMId
5593923425,2009-11-10 17:22:01,Stupak approach is radical and unfair to women. Check out the new blog post: http://bit.ly/Xp4O9
5454401567,2009-11-05 17:12:09,It's official: Carly Fiorina is in. Join us and Rise to the Challenge! http://bit.ly/4Gg5qz
5242743735,2009-10-28 22:40:25,Time to get serious. Please sign on now as a citizen co-sponsor of the Kerry-Boxer climate change bill http://bit.ly/4lRmye
5053688008,2009-10-21 22:08:28,New blog post reflecting on the Climate Change Blog Action Day last week: http://bit.ly/4DhHa3
5001768825,2009-10-19 22:00:58,New blog post up on 'A Nation Transformed by Women'. Check it out! http://bit.ly/4eAAre
4739721553,2009-10-09 17:25:46,Appearing today on MSNBC NYT Edition at 2:30 ET and the Rachel Maddow show a bit after 9 ET. Tune in!
4719413206,2009-10-08 22:56:34,"We've finished tallying all the 3rd quarter donations and wow, you're amazing! http://blog.barbaraboxer.com/?p=307"
4689605369,2009-10-07 19:16:14,LiveBlog is up at DailyKos. Come by! http://bit.ly/MSkKl
4689176322,2009-10-07 18:56:02,"About to LiveBlog at DailyKos on Kerry-Boxer and anything else people want to discuss. Starts about 3pm ET, Noon PT."
4634282083,2009-10-05 18:33:33,New post: Breast Cancer Awareness Month & cosponsoring Breast Cancer Education & Awareness Senate bill http://bit.ly/33Zkni
4300189949,2009-09-22 22:33:40,Will have to reschedule today's visit to The Ed Show. Will post with the new time when it's confirmed.
4296673093,2009-09-22 19:53:14,"Talking about Global Warming and Health Care on The Ed Show today; 6:50 ET, 3:50 PT. Tune in!"
4148222648,2009-09-21 15:22:58,We've launched a $100K grassroots fundraising drive to close the quarter w/ a bang. Will you join us? http://bit.ly/1SzJPo
3878551702,2009-09-10 02:30:11,On Rachel Maddow right after this commercial break. Tune in!
3872442279,2009-09-09 21:48:26,"Visiting the Rachel Maddow show tonight, discussing President Obama's speech. 10:15 ET, 7:15 PT. Tune in!"
3676587012,2009-08-31 23:45:45,"As Carly Fiorina gears up for her campaign, help us hit our $100K goal by September 8th! http://tinyurl.com/l74jrd"
3250223562,2009-08-11 18:42:49,"Clips are up on the website from Maddow, Colbert and Morning Joe. Check them out! http://barbaraboxer.com/multimedia/"
3231120250,2009-08-10 20:00:15,Late change: Appearing on Rachel Maddow at 9pm instead of Countdown w/ Keith Olbermann.
3230592287,2009-08-10 19:29:00,Don't forget Countdown with Olbermann and The Colbert Report tonight and Morning Joe bright and early at 6am PT tomorrow!
3214998416,2009-08-09 22:45:29,Appearing tomorrow (Monday) on Countdown with Keith Olbermann and The Colbert Report. Tune in!
3156476444,2009-08-06 00:32:49,Going on KGO tomorrow morning to discuss Health Care & Clunkers. 9:15am EST/ 6:15 PST. Stream: http://tinyurl.com/by4o66
3153084018,2009-08-05 21:14:04,House Parties are coming! Sign up now to host on Sept. 12: http://tinyurl.com/mqlybs
2942097594,2009-07-31 01:16:54,Rasmussen calls it a 4pt race. It's time to prepare now. Contribute $10 to the 10 in 2010 Drive http://tinyurl.com/nwco7j
2909941316,2009-07-29 14:08:55,"Gearing up to talk health care w/ Carlos Watson on MSNBC- 11:05am EST, 8:05am PST. Tune in!"
2899072073,2009-07-28 23:10:51,"Talking health care with Carlos Watson on MSNBC tomorrow morning @ 11:05am EST, 8:05am PST."
2827093065,2009-07-24 22:19:54,"Senate passed Boxer amendment on HC flex accounts for military families. 12340 signed, have you? http://tinyurl.com/mnxb85"
2823958929,2009-07-24 19:12:02,Partnered with Senator Kerry today to explain What Palin Got Wrong About Energy: http://tinyurl.com/kj3cwf
2764593757,2009-07-21 20:41:41,Join VoteVets and Sen. Boxer: Support her 3 amendments to help military families. http://bit.ly/supportmilitaryfamilies
2700982755,2009-07-18 03:45:27,"6,745 people have already signed the petition to Stop Hate Crimes. Sign and share it now: http://tinyurl.com/n2aznt"
2695198000,2009-07-17 20:53:56,Sign the petition today in support of the Matthew Shepard Hate Crimes Prevention Act: http://tinyurl.com/n2aznt
2572089057,2009-07-10 18:57:11,"Carly Fiorina failed to register business and foundation with county, state, and federal officials http://tinyurl.com/lztuwf"
2521582638,2009-07-07 21:35:47,Began hearings today on climate change legislation in the EPW Committee: http://tinyurl.com/nbhz9j
2409972426,2009-06-30 21:27:30,"Reminder: Our first Boxer Virtual Fundraiser is at 6:15pm PT! RSVP now, then join us live: http://twurl.nl/azp075 . Please RT"
2405456063,2009-06-30 16:06:03,"Sierra Club's Carl Pope joining me for tonight’s Boxer Virtual Fundraiser! RSVP now, then join us live at 6:15pm PT: http://twurl.nl/azp075"
2300954236,2009-06-23 21:48:33,Join me online for our first Boxer Virtual Fundraiser at 6:15pm PT on June 30! RSVP here: http://www.barbaraboxer.com/virtualfundraiser
2296306238,2009-06-23 16:01:21,Sen. Boxer will be on MSNBC today at 9am PT to talk about President Obama's 9:30am press conference
2018934690,2009-06-03 17:44:28,Watch Sen. Boxer appear live on MSNBC at 11:10am PT this morning #fb
2008112264,2009-06-02 20:38:21,Meet James Carville and Barbara Boxer in New Orleans on June 12th. Enter our contest now: http://bit.ly/carville
1948813004,2009-05-28 16:20:30,Looking for the latest Boxer Campaign merchandise? Check out our new campaign store at http://store.barbaraboxer.com!
1940808127,2009-05-27 23:18:56,Tune in to watch Barbara talk about Judge Sotomayor’s nomination and the Prop 8 ruling on MSNBC's Morning Joe at 8:30am Thursday AM
1852098898,2009-05-19 21:54:11,Tune in to MSNBC at 3pm PT to watch Sen. Boxer talk with Ed Schultz about the President's new car emissions and mileage standards.
1810698846,2009-05-15 22:01:50,"Since Tuesday, 14k+ people and Sen. Boxer urged Pres. Obama to nominate a woman for the Supreme Court. Join them! http://bit.ly/supremecourt"
1777386224,2009-05-12 21:04:05,Joining Ed Schultz on MSNBC at 3:10pm PT to talk about Supreme Court. Urge Pres. Obama to nominate a woman here: http://bit.ly/supremecourt
1776906019,2009-05-12 20:13:20,@charmed0813 thanks so much for your help on this!
1776805960,2009-05-12 20:02:54,@ABGRAY Thank you!
1776475777,2009-05-12 19:27:57,Join me in urging President Obama to nominate a woman to the Supreme Court. Email the White House today: http://bit.ly/supremecourt
1650621593,2009-04-29 17:12:42,Sen. Boxer will talk to Ed Schultz about Pres. Obama's first 100 days & Sen. Specter's switch on MSNBC today at 11:15am PT #topprog
1586458215,2009-04-22 17:30:05,Senator Boxer will be talking with Norah O'Donnell just after noon PT on MSNBC. Hope you can tune in!
1567822383,2009-04-20 18:49:48,"In the last 48 hours, more than 6,000 people have voted in our poster contest. Cast your vote today! http://bit.ly/boxerposter"
1551918492,2009-04-18 17:18:45,"It's time to vote! From over 200 submissions, we've selected 12 finalists in the Boxer Poster Contest. Vote today! http://bit.ly/boxerposter"
1390802869,2009-03-25 22:29:09,Just finished up TV interview with @Shuster1600 on MSNBC to talk about President Obama's visit and the budget #topprog
1389365721,2009-03-25 18:04:31,Sen. Boxer will talk about the budget and Pres. Obama's lunch with Senate Democrats on MSNBC at 12:45pm PT today. -- Boxer staff #topprog
1345560917,2009-03-18 00:18:40,Senator Boxer calls AIG bonuses disgraceful in a speech on the Senate floor: http://twurl.nl/7blrt1
1316708103,2009-03-12 16:08:20,Thanks to all who tweeted me about e-filing of campaign finance reports. I was a cosponsor of S. 482 before and will do so again.
1316698819,2009-03-12 16:06:31,"@craignewmark Hi Craig, I was a cosponsor of S. 482 before and will do so again."
1283858534,2009-03-05 16:04:13,"@jessicaAPISS Hi Jessica, thanks for the follow!"
1283857535,2009-03-05 16:04:00,@VictoriaRS340 thank you!
1272468513,2009-03-03 04:35:45,@gempari thank you so much
1270493818,2009-03-02 19:31:32,@craighartel thank you... will need your help to get a good global warming bill passed!
1270492836,2009-03-02 19:31:17,@Reddingtonpass thank you!
1268115003,2009-03-02 05:09:35,@D_dot_com thank you... i love my job... what a privilege!
1268114052,2009-03-02 05:09:12,@nicki2377 thank you... great to hear from Kansas!
1268112425,2009-03-02 05:08:34,@sooner02 thank you so much!
1268042868,2009-03-02 04:42:34,@ahenck thanks for the invite!
1268032278,2009-03-02 04:38:32,@libnnc ok!
1268032139,2009-03-02 04:38:31,@GrrrlRomeo thanks for following!
1268031458,2009-03-02 04:38:13,@StyxMaker slowly but surely
1268021783,2009-03-02 04:34:39,"@hankmissenheim yes, I have some catching up to do there... working on it..."
1268006946,2009-03-02 04:29:30,Only 38 more followers away from 3000. Thanks everybody!  Who will be #3000?  #topprog
1250347322,2009-02-25 18:57:20,@tavdb thank you so much!
1250293750,2009-02-25 18:43:24,@Dolly13 thanks!
1250293205,2009-02-25 18:43:15,@Chupie thank you
1250262628,2009-02-25 18:35:12,@Karafin thanks... we just put video up here: http://twurl.nl/u58t8r
1250258929,2009-02-25 18:34:16,Talking with Keith Olbermann on @MSNBC last night about the President's speech: http://twurl.nl/u58t8r #topprog
1250189002,2009-02-25 18:16:00,@Karafin thanks a lot!
1250186415,2009-02-25 18:15:19,Here's video from my AM interview on @MSNBC with @JoeNBC and @morningmika about the President's speech: http://twurl.nl/apu2e1 #topprog
1250134373,2009-02-25 18:01:41,@cheeseburger07 I thought President Obama's speech was a home run!
1247131935,2009-02-25 00:17:04,"On @MSNBC with Keith Olbermann after the President's speech tonite, then Morning Joe at 8:30am tomorrow morning -- pls watch! #topprog"
1246268020,2009-02-24 20:24:05,@StyxMaker I've got a ways to go!
1246102213,2009-02-24 19:40:31,"Appearing on MSNBC w/ @norahodonnell at 3:30pm ET today to preview the President's speech, then Morning Joe tomorrow at 8:30am ET #topprog"
1245807655,2009-02-24 18:20:52,@jaketapper todah
1245786001,2009-02-24 18:14:44,"@CReporter Sometimes Barbara, sometimes a staffer (this is from a staffer!)"
1245776233,2009-02-24 18:11:53,@raberumphenour you bet!
1245749523,2009-02-24 18:04:08,Welcome @damnyooneek -- my 2000th follower!
1245716450,2009-02-24 17:54:57,Only 2 more followers away from 2000... will you join?  #topprog
1220681492,2009-02-17 22:43:19,"@jedimacias From Boxer staff. You don't have to -- but part of the ""Be a Boxer"" grassroots donor program is a quarterly call with Sen. Boxer"
1220434326,2009-02-17 21:30:54,"Reminder: Join me on a conference call at 7pm PT tonight -- just sign up for ""Be a Boxer"" for $15/month! http://twurl.nl/ytcovq #topprog"
1219675424,2009-02-17 17:45:05,"Sign up for our ""Be a Boxer"" program for $15/month -- and join me on a conference call at 7pm PT tonight! http://twurl.nl/ytcovq #topprog"
1219672406,2009-02-17 17:44:13,"Sign up for our ""Be a Boxer"" program for $15/month -- and join me on a conference call at 7pm PT tonight!  http://twurl.nl/ytcovq"
1217964785,2009-02-17 05:35:21,"@EileenLeft Yes, i'll be at the CA Dem Convention. Look forward to seeing you!"
1207392678,2009-02-13 18:59:28,"@tigerbeat hear, hear!"
1200835687,2009-02-11 23:35:52,@LaurieInQueens thank you so much
1200834846,2009-02-11 23:35:34,@MadamaAmbi yes that's the best phone number for LA office
1200831615,2009-02-11 23:34:36,@bboy001 thanks very much!
1200831263,2009-02-11 23:34:26,@derekForrest thank you!
1199968631,2009-02-11 19:06:56,Watch video from my interview this morning about the stimulus package on MSNBC's Morning Joe: http://twurl.nl/sjimwx
1196582185,2009-02-10 19:49:04,@cARTHAN thank you!
1196464813,2009-02-10 19:13:11,@Sevilla90 thanks!
1196464495,2009-02-10 19:13:06,@Sharoney thanks!
1196459284,2009-02-10 19:11:29,@james3neal Thanks for the RT!
1196449880,2009-02-10 19:08:34,Video clip from my discussion with @maddow on MSNBC last night (starts at 2:00 mark): http://tinyurl.com/d89f9u
1196253218,2009-02-10 18:07:42,@Mickeleh Thanks for the RT
1196244249,2009-02-10 18:04:57,@CandaceKuss thanks for the RT!
1196241866,2009-02-10 18:04:13,@scottknaster thanks scott
1196241117,2009-02-10 18:04:01,@plumpqt thank you!
1196240580,2009-02-10 18:03:52,@k_michael thanks... i agree with you
1196239024,2009-02-10 18:03:23,@lindasusan thank you so much
1196238426,2009-02-10 18:03:12,@greengirl08 thanks very much... appreciate it
1196181817,2009-02-10 17:46:16,@MadamaAmbi thanks!
1196180404,2009-02-10 17:45:48,@lawgrrl07 thank you!
1196179713,2009-02-10 17:45:38,@faboomama thanks!
1196012922,2009-02-10 16:55:08,Will be on MSNBC with Norah O'Donnell today at 3:30pm ET to discuss the stimulus package
1194039993,2009-02-10 01:57:00,Will be on MSNBC with Rachel Maddow tonight at 9:30pm ET to discuss economic recovery and the stimulus bill http://twurl.nl/ttfes6
1180648153,2009-02-05 19:01:51,"Excited to be chairing new subcommittee on global women's issues,  stamping out violence against women worldwide: http://twurl.nl/slldzt"
1177246692,2009-02-04 19:16:02,"Yesterday, I laid out 6 principles for our global warming bill this year: http://twurl.nl/cb5x4x http://twurl.nl/qzhu0m"
903377011,2008-08-29 21:12:32,Just left Denver. Wow. Barack hit it out of the park last night. The atmosphere in that stadium was electric.
902647714,2008-08-29 07:35:13,Barack's speech was so inspring! Now it's time to get to work! #dnc08
900972674,2008-08-27 21:48:53,Now at the Pepsi Center. I will be announcing CA's delegate vote at 4:05. I hope u get to watch that moment.
900971909,2008-08-27 21:48:05,We just left our Pac for A Change party. Saw lots of old dear friends. What a wonderful time
900760629,2008-08-27 18:04:48,@sfpelosi thanks for following me!
900759209,2008-08-27 18:03:15,@j_ro usually it's me... sometimes staff will post an update if i can't
900694138,2008-08-27 16:58:48,"Leaving a party for the documentary  ""14 Women"". Empowering! On to the Hispanic Caucus"
900602398,2008-08-27 15:32:54,Just left the DSCC breakfast. Heard our great New Hamp candiate Jean Shaheen
900600327,2008-08-27 15:31:02,The CDP breakfast was inspiring. Great Dems. #dnc08
900551511,2008-08-27 14:48:05,At the California delegation breakfast
899805158,2008-08-26 22:01:55,My speech will be carried live online at http://gallery1.demconvention.com/ -- tune in at 4pm PT!  #dnc08
899780062,2008-08-26 21:32:45,getting ready to deliver my speech tonight at #dnc08
899594372,2008-08-26 18:11:28,Sitting on radio row with KGO Radio's Ronn Owens #dnc08
899551167,2008-08-26 17:26:55,Just finished up interview on Fox #dnc08
899461588,2008-08-26 15:59:51,"We must not lose the America that made the American Dream possible for the Obamas, the Bidens and all of us. #dnc08"
899460857,2008-08-26 15:59:08,A quick report from last night: Ted Kennedy is a profile in courage.  And Michele Obama touched me deeply. #dnc08
898807162,2008-08-26 00:55:30,... I told them McCain has a zero record on choice.  Now they are doubly motivated. #dnc08
898807001,2008-08-26 00:55:17,Went to a gathering of women and they are so pumped up about the prospect of a pro-choice democratic ticket. #dnc08
898503160,2008-08-25 18:57:51,Just finished up rehearsing my speech at the Pepsi Center -- off to more events! #dnc08
895036117,2008-08-22 01:39:56,getting ready to head to Denver for #DNC2008
